{"customer_name": "Eric Cline", "customer_address": "0801 Lauren Alley, East William, MS 43056", "customer_email": "bairddennis@vazquez.com", "policy_number": "BC-857143475", "phone_number": "242.261.8544", "accident_date": "2024-01-06", "accident_time": "6:30 PM", "accident_location": "intersection of Elm Ln and Pine Blvd", "description": "\n        Dear Parasol Insurance,\n\n        My name is Eric Cline, and I am writing to file a claim for a recent car accident that occurred on 2024-01-06, \n        at approximately 6:30 PM. My policy number is BC-857143475.\n\n        The accident took place at the intersection of Elm Ln and Pine Blvd. I was driving my vehicle, a yellow Ford Traverse with license plate \n        number 614 7962. At the same time, another vehicle, a blue BMW Civic with license plate number 094-RGL, \n        collided with my car. The driver, Samantha Juarez, failed to adhere to traffic rules, resulting in damage to both vehicles.\n\n        I promptly exchanged information with the other driver and took photos of the accident scene, including damages to both vehicles.\n        Attached to this email are the photos, a copy of the police report, and the estimate for the repair costs.\n\n        Kindly assist in processing this claim and let me know the next steps. You can reach me at 242.261.8544 or bairddennis@vazquez.com.\n\n        Thank you for your assistance.\n\n        Sincerely,\n        Eric Cline\n        0801 Lauren Alley, East William, MS 43056\n        "}
{"customer_name": "Aaron Bowman", "customer_address": "Unit 4232 Box 8906, DPO AE 18730", "customer_email": "bestrada@chang.com", "policy_number": "AC-584790380", "phone_number": "(909)412-1229", "accident_date": "2024-01-02", "accident_time": "11:45 AM", "accident_location": "intersection of Maple Rd and Main St", "description": "\n        Dear Parasol Insurance,\n\n        My name is Aaron Bowman, and I am writing to file a claim for a recent car accident that occurred on 2024-01-02, \n        at approximately 11:45 AM. My policy number is AC-584790380.\n\n        The accident took place at the intersection of Maple Rd and Main St. I was driving my vehicle, a maroon Nissan Elantra with license plate \n        number 285 3YT. At the same time, another vehicle, a silver Honda Traverse with license plate number 1DZ S60, \n        collided with my car. The driver, Douglas Small, failed to adhere to traffic rules, resulting in damage to both vehicles.\n\n        I promptly exchanged information with the other driver and took photos of the accident scene, including damages to both vehicles.\n        Attached to this email are the photos, a copy of the police report, and the estimate for the repair costs.\n\n        Kindly assist in processing this claim and let me know the next steps. You can reach me at (909)412-1229 or bestrada@chang.com.\n\n        Thank you for your assistance.\n\n        Sincerely,\n        Aaron Bowman\n        Unit 4232 Box 8906, DPO AE 18730\n        "}
{"customer_name": "Jennifer Lewis", "customer_address": "2557 Smith Street Apt. 819, North Ryan, MS 82717", "customer_email": "evelez@yahoo.com", "policy_number": "XY-294014511", "phone_number": "009-665-1801x565", "accident_date": "2024-01-02", "accident_time": "3:30 PM", "accident_location": "intersection of Elm Ln and Elm Ln", "description": "\n        Dear Parasol Insurance,\n\n        My name is Jennifer Lewis, and I am writing to file a claim for a recent car accident that occurred on 2024-01-02, \n        at approximately 3:30 PM. My policy number is XY-294014511.\n\n        The accident took place at the intersection of Elm Ln and Elm Ln. I was driving my vehicle, a blue Kia Focus with license plate \n        number 711-901. At the same time, another vehicle, a yellow Hyundai A4 with license plate number QLS-9120, \n        collided with my car. The driver, Amanda Hall, failed to adhere to traffic rules, resulting in damage to both vehicles.\n\n        I promptly exchanged information with the other driver and took photos of the accident scene, including damages to both vehicles.\n        Attached to this email are the photos, a copy of the police report, and the estimate for the repair costs.\n\n        Kindly assist in processing this claim and let me know the next steps. You can reach me at 009-665-1801x565 or evelez@yahoo.com.\n\n        Thank you for your assistance.\n\n        Sincerely,\n        Jennifer Lewis\n        2557 Smith Street Apt. 819, North Ryan, MS 82717\n        "}
{"customer_name": "Sarah Palmer", "customer_address": "4023 Rhonda Ridge, Smithside, CO 28584", "customer_email": "wmcintyre@rivera-williams.net", "policy_number": "XY-581702749", "phone_number": "001-071-957-3685x11975", "accident_date": "2024-01-05", "accident_time": "5:15 PM", "accident_location": "intersection of Spruce Ct and Willow Ave", "description": "\n        Dear Parasol Insurance,\n\n        My name is Sarah Palmer, and I am writing to file a claim for a recent car accident that occurred on 2024-01-05, \n        at approximately 5:15 PM. My policy number is XY-581702749.\n\n        The accident took place at the intersection of Spruce Ct and Willow Ave. I was driving my vehicle, a white Mercedes-Benz Focus with license plate \n        number ZQO 037. At the same time, another vehicle, a gray Ford Focus with license plate number 02-D684, \n        collided with my car. The driver, Elizabeth Fox, failed to adhere to traffic rules, resulting in damage to both vehicles.\n\n        I promptly exchanged information with the other driver and took photos of the accident scene, including damages to both vehicles.\n        Attached to this email are the photos, a copy of the police report, and the estimate for the repair costs.\n\n        Kindly assist in processing this claim and let me know the next steps. You can reach me at 001-071-957-3685x11975 or wmcintyre@rivera-williams.net.\n\n        Thank you for your assistance.\n\n        Sincerely,\n        Sarah Palmer\n        4023 Rhonda Ridge, Smithside, CO 28584\n        "}
{"customer_name": "Douglas Fletcher", "customer_address": "56963 Mike Park, Pattersonhaven, SD 89902", "customer_email": "rushrobert@morris.info", "policy_number": "BC-219104239", "phone_number": "484-703-5575", "accident_date": "2024-01-05", "accident_time": "12:00 PM", "accident_location": "intersection of Willow Ave and Main St", "description": "\n        Dear Parasol Insurance,\n\n        My name is Douglas Fletcher, and I am writing to file a claim for a recent car accident that occurred on 2024-01-05, \n        at approximately 12:00 PM. My policy number is BC-219104239.\n\n        The accident took place at the intersection of Willow Ave and Main St. I was driving my vehicle, a red Mercedes-Benz Altima with license plate \n        number T47 4KT. At the same time, another vehicle, a blue BMW Altima with license plate number 08B\u2022709, \n        collided with my car. The driver, Jennifer Diaz, failed to adhere to traffic rules, resulting in damage to both vehicles.\n\n        I promptly exchanged information with the other driver and took photos of the accident scene, including damages to both vehicles.\n        Attached to this email are the photos, a copy of the police report, and the estimate for the repair costs.\n\n        Kindly assist in processing this claim and let me know the next steps. You can reach me at 484-703-5575 or rushrobert@morris.info.\n\n        Thank you for your assistance.\n\n        Sincerely,\n        Douglas Fletcher\n        56963 Mike Park, Pattersonhaven, SD 89902\n        "}
{"customer_name": "Dawn Rogers", "customer_address": "33305 Owens Well, Teresatown, IN 35812", "customer_email": "omathis@hotmail.com", "policy_number": "AC-717171281", "phone_number": "+1-334-846-9558x38939", "accident_date": "2024-01-03", "accident_time": "6:30 PM", "accident_location": "intersection of Willow Ave and Cedar Dr", "description": "\n        Dear Parasol Insurance,\n\n        My name is Dawn Rogers, and I am writing to file a claim for a recent car accident that occurred on 2024-01-03, \n        at approximately 6:30 PM. My policy number is AC-717171281.\n\n        The accident took place at the intersection of Willow Ave and Cedar Dr. I was driving my vehicle, a gray Toyota Camry with license plate \n        number 186-EZHK. At the same time, another vehicle, a gold BMW Elantra with license plate number BFL1095, \n        collided with my car. The driver, Allison Browning, failed to adhere to traffic rules, resulting in damage to both vehicles.\n\n        I promptly exchanged information with the other driver and took photos of the accident scene, including damages to both vehicles.\n        Attached to this email are the photos, a copy of the police report, and the estimate for the repair costs.\n\n        Kindly assist in processing this claim and let me know the next steps. You can reach me at +1-334-846-9558x38939 or omathis@hotmail.com.\n\n        Thank you for your assistance.\n\n        Sincerely,\n        Dawn Rogers\n        33305 Owens Well, Teresatown, IN 35812\n        "}
{"customer_name": "Carolyn Doyle", "customer_address": "0102 Whitney Junction Suite 770, Bryantbury, ME 15806", "customer_email": "freemandaniel@hotmail.com", "policy_number": "MN-553206964", "phone_number": "001-005-968-1801x468", "accident_date": "2024-01-02", "accident_time": "11:45 AM", "accident_location": "intersection of Elm Ln and Oak St", "description": "\n        Dear Parasol Insurance,\n\n        My name is Carolyn Doyle, and I am writing to file a claim for a recent car accident that occurred on 2024-01-02, \n        at approximately 11:45 AM. My policy number is MN-553206964.\n\n        The accident took place at the intersection of Elm Ln and Oak St. I was driving my vehicle, a green Mercedes-Benz A4 with license plate \n        number WDA-1188. At the same time, another vehicle, a yellow Kia Traverse with license plate number 492-CKLY, \n        collided with my car. The driver, Daniel Lester, failed to adhere to traffic rules, resulting in damage to both vehicles.\n\n        I promptly exchanged information with the other driver and took photos of the accident scene, including damages to both vehicles.\n        Attached to this email are the photos, a copy of the police report, and the estimate for the repair costs.\n\n        Kindly assist in processing this claim and let me know the next steps. You can reach me at 001-005-968-1801x468 or freemandaniel@hotmail.com.\n\n        Thank you for your assistance.\n\n        Sincerely,\n        Carolyn Doyle\n        0102 Whitney Junction Suite 770, Bryantbury, ME 15806\n        "}
{"customer_name": "Tristan Bullock", "customer_address": "299 Henry Mission Apt. 391, East Kimberly, ME 36002", "customer_email": "kstewart@hotmail.com", "policy_number": "BC-795898738", "phone_number": "+1-038-346-2163x913", "accident_date": "2024-01-07", "accident_time": "2:15 PM", "accident_location": "intersection of Willow Ave and Willow Ave", "description": "\n        Dear Parasol Insurance,\n\n        My name is Tristan Bullock, and I am writing to file a claim for a recent car accident that occurred on 2024-01-07, \n        at approximately 2:15 PM. My policy number is BC-795898738.\n\n        The accident took place at the intersection of Willow Ave and Willow Ave. I was driving my vehicle, a gray Chevrolet C-Class with license plate \n        number 05E 351. At the same time, another vehicle, a red Honda Elantra with license plate number DZI-095, \n        collided with my car. The driver, Jessica Galloway, failed to adhere to traffic rules, resulting in damage to both vehicles.\n\n        I promptly exchanged information with the other driver and took photos of the accident scene, including damages to both vehicles.\n        Attached to this email are the photos, a copy of the police report, and the estimate for the repair costs.\n\n        Kindly assist in processing this claim and let me know the next steps. You can reach me at +1-038-346-2163x913 or kstewart@hotmail.com.\n\n        Thank you for your assistance.\n\n        Sincerely,\n        Tristan Bullock\n        299 Henry Mission Apt. 391, East Kimberly, ME 36002\n        "}
{"customer_name": "Wendy Medina", "customer_address": "334 Marc Plain Apt. 050, South William, NE 16774", "customer_email": "combssarah@gmail.com", "policy_number": "BC-420881377", "phone_number": "641.190.0313x8080", "accident_date": "2024-01-05", "accident_time": "10:00 AM", "accident_location": "intersection of Maple Rd and Main St", "description": "\n        Dear Parasol Insurance,\n\n        My name is Wendy Medina, and I am writing to file a claim for a recent car accident that occurred on 2024-01-05, \n        at approximately 10:00 AM. My policy number is BC-420881377.\n\n        The accident took place at the intersection of Maple Rd and Main St. I was driving my vehicle, a gold Toyota 3 Series with license plate \n        number 7DR 399. At the same time, another vehicle, a green Nissan 3 Series with license plate number Y44 3SV, \n        collided with my car. The driver, Natasha Jennings, failed to adhere to traffic rules, resulting in damage to both vehicles.\n\n        I promptly exchanged information with the other driver and took photos of the accident scene, including damages to both vehicles.\n        Attached to this email are the photos, a copy of the police report, and the estimate for the repair costs.\n\n        Kindly assist in processing this claim and let me know the next steps. You can reach me at 641.190.0313x8080 or combssarah@gmail.com.\n\n        Thank you for your assistance.\n\n        Sincerely,\n        Wendy Medina\n        334 Marc Plain Apt. 050, South William, NE 16774\n        "}
{"customer_name": "Dennis Barnes", "customer_address": "22279 Brown Harbors Apt. 945, New William, NV 98184", "customer_email": "kelly10@hotmail.com", "policy_number": "BC-246197773", "phone_number": "(715)630-4020x76329", "accident_date": "2024-01-03", "accident_time": "5:15 PM", "accident_location": "intersection of Maple Rd and Willow Ave", "description": "\n        Dear Parasol Insurance,\n\n        My name is Dennis Barnes, and I am writing to file a claim for a recent car accident that occurred on 2024-01-03, \n        at approximately 5:15 PM. My policy number is BC-246197773.\n\n        The accident took place at the intersection of Maple Rd and Willow Ave. I was driving my vehicle, a black Kia Camry with license plate \n        number 745 6WG. At the same time, another vehicle, a maroon Honda Civic with license plate number 3K626, \n        collided with my car. The driver, Joseph Miller, failed to adhere to traffic rules, resulting in damage to both vehicles.\n\n        I promptly exchanged information with the other driver and took photos of the accident scene, including damages to both vehicles.\n        Attached to this email are the photos, a copy of the police report, and the estimate for the repair costs.\n\n        Kindly assist in processing this claim and let me know the next steps. You can reach me at (715)630-4020x76329 or kelly10@hotmail.com.\n\n        Thank you for your assistance.\n\n        Sincerely,\n        Dennis Barnes\n        22279 Brown Harbors Apt. 945, New William, NV 98184\n        "}
{"customer_name": "Anna Miller", "customer_address": "4609 Williams Alley Apt. 216, South Kellymouth, AL 03858", "customer_email": "keith92@gmail.com", "policy_number": "AC-357458259", "phone_number": "0508077325", "accident_date": "2024-01-05", "accident_time": "11:45 AM", "accident_location": "intersection of Spruce Ct and Main St", "description": "\n        Dear Parasol Insurance,\n\n        My name is Anna Miller, and I am writing to file a claim for a recent car accident that occurred on 2024-01-05, \n        at approximately 11:45 AM. My policy number is AC-357458259.\n\n        The accident took place at the intersection of Spruce Ct and Main St. I was driving my vehicle, a silver Toyota Focus with license plate \n        number 700 MXG. At the same time, another vehicle, a blue Chevrolet Camry with license plate number HLJ-0841, \n        collided with my car. The driver, Karen Morgan, failed to adhere to traffic rules, resulting in damage to both vehicles.\n\n        I promptly exchanged information with the other driver and took photos of the accident scene, including damages to both vehicles.\n        Attached to this email are the photos, a copy of the police report, and the estimate for the repair costs.\n\n        Kindly assist in processing this claim and let me know the next steps. You can reach me at 0508077325 or keith92@gmail.com.\n\n        Thank you for your assistance.\n\n        Sincerely,\n        Anna Miller\n        4609 Williams Alley Apt. 216, South Kellymouth, AL 03858\n        "}
{"customer_name": "Jill Rodriguez", "customer_address": "1557 Miranda Parkway Suite 056, New Calvinhaven, IN 19547", "customer_email": "sharon02@gmail.com", "policy_number": "BC-590714306", "phone_number": "888-017-5120x4262", "accident_date": "2024-01-02", "accident_time": "11:45 AM", "accident_location": "intersection of Birch St and Main St", "description": "\n        Dear Parasol Insurance,\n\n        My name is Jill Rodriguez, and I am writing to file a claim for a recent car accident that occurred on 2024-01-02, \n        at approximately 11:45 AM. My policy number is BC-590714306.\n\n        The accident took place at the intersection of Birch St and Main St. I was driving my vehicle, a maroon Nissan Elantra with license plate \n        number 0ZJ 781. At the same time, another vehicle, a blue Kia A4 with license plate number YVP-4719, \n        collided with my car. The driver, Michelle Reilly, failed to adhere to traffic rules, resulting in damage to both vehicles.\n\n        I promptly exchanged information with the other driver and took photos of the accident scene, including damages to both vehicles.\n        Attached to this email are the photos, a copy of the police report, and the estimate for the repair costs.\n\n        Kindly assist in processing this claim and let me know the next steps. You can reach me at 888-017-5120x4262 or sharon02@gmail.com.\n\n        Thank you for your assistance.\n\n        Sincerely,\n        Jill Rodriguez\n        1557 Miranda Parkway Suite 056, New Calvinhaven, IN 19547\n        "}
{"customer_name": "Ashley Williams", "customer_address": "5315 Jason Course, North Carlachester, NH 80896", "customer_email": "hrodriguez@gmail.com", "policy_number": "XY-266394153", "phone_number": "(284)210-3760", "accident_date": "2024-01-04", "accident_time": "5:15 PM", "accident_location": "intersection of Cedar Dr and Oak St", "description": "\n        Dear Parasol Insurance,\n\n        My name is Ashley Williams, and I am writing to file a claim for a recent car accident that occurred on 2024-01-04, \n        at approximately 5:15 PM. My policy number is XY-266394153.\n\n        The accident took place at the intersection of Cedar Dr and Oak St. I was driving my vehicle, a blue Toyota Altima with license plate \n        number 374 BYH. At the same time, another vehicle, a gray Chevrolet Sorento with license plate number 1X572, \n        collided with my car. The driver, Teresa Fowler, failed to adhere to traffic rules, resulting in damage to both vehicles.\n\n        I promptly exchanged information with the other driver and took photos of the accident scene, including damages to both vehicles.\n        Attached to this email are the photos, a copy of the police report, and the estimate for the repair costs.\n\n        Kindly assist in processing this claim and let me know the next steps. You can reach me at (284)210-3760 or hrodriguez@gmail.com.\n\n        Thank you for your assistance.\n\n        Sincerely,\n        Ashley Williams\n        5315 Jason Course, North Carlachester, NH 80896\n        "}
{"customer_name": "Tina Serrano", "customer_address": "716 Byrd Lights, Youngport, IA 45769", "customer_email": "wnichols@king.com", "policy_number": "XY-789752615", "phone_number": "422-346-9787", "accident_date": "2024-01-05", "accident_time": "3:30 PM", "accident_location": "intersection of Willow Ave and Oak St", "description": "\n        Dear Parasol Insurance,\n\n        My name is Tina Serrano, and I am writing to file a claim for a recent car accident that occurred on 2024-01-05, \n        at approximately 3:30 PM. My policy number is XY-789752615.\n\n        The accident took place at the intersection of Willow Ave and Oak St. I was driving my vehicle, a white Nissan 3 Series with license plate \n        number 25D 2435. At the same time, another vehicle, a silver Kia Altima with license plate number 584 EXX, \n        collided with my car. The driver, John Gonzalez, failed to adhere to traffic rules, resulting in damage to both vehicles.\n\n        I promptly exchanged information with the other driver and took photos of the accident scene, including damages to both vehicles.\n        Attached to this email are the photos, a copy of the police report, and the estimate for the repair costs.\n\n        Kindly assist in processing this claim and let me know the next steps. You can reach me at 422-346-9787 or wnichols@king.com.\n\n        Thank you for your assistance.\n\n        Sincerely,\n        Tina Serrano\n        716 Byrd Lights, Youngport, IA 45769\n        "}
{"customer_name": "Kimberly Hayden", "customer_address": "1284 Courtney Flat, Nancyborough, NJ 83953", "customer_email": "fporter@hart-french.com", "policy_number": "BC-607767656", "phone_number": "441.285.9885x9255", "accident_date": "2024-01-03", "accident_time": "1:45 PM", "accident_location": "intersection of Birch St and Willow Ave", "description": "\n        Dear Parasol Insurance,\n\n        My name is Kimberly Hayden, and I am writing to file a claim for a recent car accident that occurred on 2024-01-03, \n        at approximately 1:45 PM. My policy number is BC-607767656.\n\n        The accident took place at the intersection of Birch St and Willow Ave. I was driving my vehicle, a black Audi 3 Series with license plate \n        number 21SD6. At the same time, another vehicle, a white Kia 3 Series with license plate number GP7 U1N, \n        collided with my car. The driver, Nathan Martin, failed to adhere to traffic rules, resulting in damage to both vehicles.\n\n        I promptly exchanged information with the other driver and took photos of the accident scene, including damages to both vehicles.\n        Attached to this email are the photos, a copy of the police report, and the estimate for the repair costs.\n\n        Kindly assist in processing this claim and let me know the next steps. You can reach me at 441.285.9885x9255 or fporter@hart-french.com.\n\n        Thank you for your assistance.\n\n        Sincerely,\n        Kimberly Hayden\n        1284 Courtney Flat, Nancyborough, NJ 83953\n        "}
{"customer_name": "Emily Crawford", "customer_address": "5173 Jones Manor Apt. 693, Paulville, HI 14002", "customer_email": "corypayne@garcia.com", "policy_number": "YZ-941964228", "phone_number": "200.204.6602x285", "accident_date": "2024-01-05", "accident_time": "4:00 PM", "accident_location": "intersection of Maple Rd and Elm Ln", "description": "\n        Dear Parasol Insurance,\n\n        My name is Emily Crawford, and I am writing to file a claim for a recent car accident that occurred on 2024-01-05, \n        at approximately 4:00 PM. My policy number is YZ-941964228.\n\n        The accident took place at the intersection of Maple Rd and Elm Ln. I was driving my vehicle, a red Audi Camry with license plate \n        number 46C CU8. At the same time, another vehicle, a gold Hyundai Elantra with license plate number 2OA0943, \n        collided with my car. The driver, Randy Franklin, failed to adhere to traffic rules, resulting in damage to both vehicles.\n\n        I promptly exchanged information with the other driver and took photos of the accident scene, including damages to both vehicles.\n        Attached to this email are the photos, a copy of the police report, and the estimate for the repair costs.\n\n        Kindly assist in processing this claim and let me know the next steps. You can reach me at 200.204.6602x285 or corypayne@garcia.com.\n\n        Thank you for your assistance.\n\n        Sincerely,\n        Emily Crawford\n        5173 Jones Manor Apt. 693, Paulville, HI 14002\n        "}
{"customer_name": "Kimberly Gonzalez", "customer_address": "1088 Good Lane, Cantuport, WA 46891", "customer_email": "deborahvega@yahoo.com", "policy_number": "YZ-120830061", "phone_number": "+1-640-626-5995x053", "accident_date": "2024-01-04", "accident_time": "12:00 PM", "accident_location": "intersection of Main St and Oak St", "description": "\n        Dear Parasol Insurance,\n\n        My name is Kimberly Gonzalez, and I am writing to file a claim for a recent car accident that occurred on 2024-01-04, \n        at approximately 12:00 PM. My policy number is YZ-120830061.\n\n        The accident took place at the intersection of Main St and Oak St. I was driving my vehicle, a white Mercedes-Benz 3 Series with license plate \n        number YKK 570. At the same time, another vehicle, a blue Honda Focus with license plate number ROI 582, \n        collided with my car. The driver, Angela King, failed to adhere to traffic rules, resulting in damage to both vehicles.\n\n        I promptly exchanged information with the other driver and took photos of the accident scene, including damages to both vehicles.\n        Attached to this email are the photos, a copy of the police report, and the estimate for the repair costs.\n\n        Kindly assist in processing this claim and let me know the next steps. You can reach me at +1-640-626-5995x053 or deborahvega@yahoo.com.\n\n        Thank you for your assistance.\n\n        Sincerely,\n        Kimberly Gonzalez\n        1088 Good Lane, Cantuport, WA 46891\n        "}
{"customer_name": "Angel Raymond", "customer_address": "09092 Craig Route, North Hannah, WI 41877", "customer_email": "kelly61@nicholson.biz", "policy_number": "BC-990456621", "phone_number": "407.298.9469x4729", "accident_date": "2024-01-05", "accident_time": "1:45 PM", "accident_location": "intersection of Cedar Dr and Maple Rd", "description": "\n        Dear Parasol Insurance,\n\n        My name is Angel Raymond, and I am writing to file a claim for a recent car accident that occurred on 2024-01-05, \n        at approximately 1:45 PM. My policy number is BC-990456621.\n\n        The accident took place at the intersection of Cedar Dr and Maple Rd. I was driving my vehicle, a red Honda C-Class with license plate \n        number JQO2892. At the same time, another vehicle, a blue Ford Altima with license plate number 059 NT9, \n        collided with my car. The driver, Melanie Drake, failed to adhere to traffic rules, resulting in damage to both vehicles.\n\n        I promptly exchanged information with the other driver and took photos of the accident scene, including damages to both vehicles.\n        Attached to this email are the photos, a copy of the police report, and the estimate for the repair costs.\n\n        Kindly assist in processing this claim and let me know the next steps. You can reach me at 407.298.9469x4729 or kelly61@nicholson.biz.\n\n        Thank you for your assistance.\n\n        Sincerely,\n        Angel Raymond\n        09092 Craig Route, North Hannah, WI 41877\n        "}
{"customer_name": "Christopher Ford", "customer_address": "6113 Craig Spring, North Sophiamouth, TX 96090", "customer_email": "davidmorris@hotmail.com", "policy_number": "MN-828467783", "phone_number": "7165282308", "accident_date": "2024-01-04", "accident_time": "4:00 PM", "accident_location": "intersection of Pine Blvd and Main St", "description": "\n        Dear Parasol Insurance,\n\n        My name is Christopher Ford, and I am writing to file a claim for a recent car accident that occurred on 2024-01-04, \n        at approximately 4:00 PM. My policy number is MN-828467783.\n\n        The accident took place at the intersection of Pine Blvd and Main St. I was driving my vehicle, a white Honda 3 Series with license plate \n        number 886189. At the same time, another vehicle, a white Ford 3 Series with license plate number 070 RGU, \n        collided with my car. The driver, Dr. Robert Douglas, failed to adhere to traffic rules, resulting in damage to both vehicles.\n\n        I promptly exchanged information with the other driver and took photos of the accident scene, including damages to both vehicles.\n        Attached to this email are the photos, a copy of the police report, and the estimate for the repair costs.\n\n        Kindly assist in processing this claim and let me know the next steps. You can reach me at 7165282308 or davidmorris@hotmail.com.\n\n        Thank you for your assistance.\n\n        Sincerely,\n        Christopher Ford\n        6113 Craig Spring, North Sophiamouth, TX 96090\n        "}
{"customer_name": "Kathy Sparks", "customer_address": "122 Luis Loaf Apt. 915, West Neil, MT 57793", "customer_email": "martinezsarah@hotmail.com", "policy_number": "YZ-141551643", "phone_number": "(254)079-5091", "accident_date": "2024-01-04", "accident_time": "4:00 PM", "accident_location": "intersection of Willow Ave and Oak St", "description": "\n        Dear Parasol Insurance,\n\n        My name is Kathy Sparks, and I am writing to file a claim for a recent car accident that occurred on 2024-01-04, \n        at approximately 4:00 PM. My policy number is YZ-141551643.\n\n        The accident took place at the intersection of Willow Ave and Oak St. I was driving my vehicle, a yellow Toyota 3 Series with license plate \n        number 602 FD4. At the same time, another vehicle, a silver Toyota Camry with license plate number 52ME8, \n        collided with my car. The driver, Kristine Avery, failed to adhere to traffic rules, resulting in damage to both vehicles.\n\n        I promptly exchanged information with the other driver and took photos of the accident scene, including damages to both vehicles.\n        Attached to this email are the photos, a copy of the police report, and the estimate for the repair costs.\n\n        Kindly assist in processing this claim and let me know the next steps. You can reach me at (254)079-5091 or martinezsarah@hotmail.com.\n\n        Thank you for your assistance.\n\n        Sincerely,\n        Kathy Sparks\n        122 Luis Loaf Apt. 915, West Neil, MT 57793\n        "}
{"customer_name": "Laura Hardy", "customer_address": "02332 Hopkins Run, Martinezborough, MO 47982", "customer_email": "cdennis@garcia-holmes.com", "policy_number": "YZ-507287534", "phone_number": "434.621.2635x5108", "accident_date": "2024-01-06", "accident_time": "3:30 PM", "accident_location": "intersection of Maple Rd and Maple Rd", "description": "\n        Dear Parasol Insurance,\n\n        My name is Laura Hardy, and I am writing to file a claim for a recent car accident that occurred on 2024-01-06, \n        at approximately 3:30 PM. My policy number is YZ-507287534.\n\n        The accident took place at the intersection of Maple Rd and Maple Rd. I was driving my vehicle, a yellow Hyundai Sorento with license plate \n        number GQ4 N1W. At the same time, another vehicle, a white BMW Traverse with license plate number T85 8VQ, \n        collided with my car. The driver, Scott Williams, failed to adhere to traffic rules, resulting in damage to both vehicles.\n\n        I promptly exchanged information with the other driver and took photos of the accident scene, including damages to both vehicles.\n        Attached to this email are the photos, a copy of the police report, and the estimate for the repair costs.\n\n        Kindly assist in processing this claim and let me know the next steps. You can reach me at 434.621.2635x5108 or cdennis@garcia-holmes.com.\n\n        Thank you for your assistance.\n\n        Sincerely,\n        Laura Hardy\n        02332 Hopkins Run, Martinezborough, MO 47982\n        "}
{"customer_name": "Matthew Marshall", "customer_address": "382 Herrera Court Apt. 365, New Ericaborough, ME 52576", "customer_email": "lbarrett@yahoo.com", "policy_number": "XY-746192003", "phone_number": "001-762-094-8510", "accident_date": "2024-01-05", "accident_time": "6:30 PM", "accident_location": "intersection of Maple Rd and Pine Blvd", "description": "\n        Dear Parasol Insurance,\n\n        My name is Matthew Marshall, and I am writing to file a claim for a recent car accident that occurred on 2024-01-05, \n        at approximately 6:30 PM. My policy number is XY-746192003.\n\n        The accident took place at the intersection of Maple Rd and Pine Blvd. I was driving my vehicle, a gold Kia Sorento with license plate \n        number 0AW 657. At the same time, another vehicle, a gray Mercedes-Benz 3 Series with license plate number 82HP410, \n        collided with my car. The driver, Anna Wells, failed to adhere to traffic rules, resulting in damage to both vehicles.\n\n        I promptly exchanged information with the other driver and took photos of the accident scene, including damages to both vehicles.\n        Attached to this email are the photos, a copy of the police report, and the estimate for the repair costs.\n\n        Kindly assist in processing this claim and let me know the next steps. You can reach me at 001-762-094-8510 or lbarrett@yahoo.com.\n\n        Thank you for your assistance.\n\n        Sincerely,\n        Matthew Marshall\n        382 Herrera Court Apt. 365, New Ericaborough, ME 52576\n        "}
{"customer_name": "Amy Kim", "customer_address": "66017 Peterson Tunnel Apt. 104, Lake Robert, CA 59826", "customer_email": "jennifer52@flores-brown.org", "policy_number": "BC-216590983", "phone_number": "9210037856", "accident_date": "2024-01-05", "accident_time": "10:00 AM", "accident_location": "intersection of Elm Ln and Willow Ave", "description": "\n        Dear Parasol Insurance,\n\n        My name is Amy Kim, and I am writing to file a claim for a recent car accident that occurred on 2024-01-05, \n        at approximately 10:00 AM. My policy number is BC-216590983.\n\n        The accident took place at the intersection of Elm Ln and Willow Ave. I was driving my vehicle, a silver Kia 3 Series with license plate \n        number 694 ZTZ. At the same time, another vehicle, a gold Kia Altima with license plate number FLY-992, \n        collided with my car. The driver, John Warner, failed to adhere to traffic rules, resulting in damage to both vehicles.\n\n        I promptly exchanged information with the other driver and took photos of the accident scene, including damages to both vehicles.\n        Attached to this email are the photos, a copy of the police report, and the estimate for the repair costs.\n\n        Kindly assist in processing this claim and let me know the next steps. You can reach me at 9210037856 or jennifer52@flores-brown.org.\n\n        Thank you for your assistance.\n\n        Sincerely,\n        Amy Kim\n        66017 Peterson Tunnel Apt. 104, Lake Robert, CA 59826\n        "}
{"customer_name": "David Baker", "customer_address": "127 Reed Vista Apt. 044, Kingborough, MT 52939", "customer_email": "lwelch@yahoo.com", "policy_number": "MN-754293323", "phone_number": "0023341678", "accident_date": "2024-01-05", "accident_time": "11:45 AM", "accident_location": "intersection of Birch St and Willow Ave", "description": "\n        Dear Parasol Insurance,\n\n        My name is David Baker, and I am writing to file a claim for a recent car accident that occurred on 2024-01-05, \n        at approximately 11:45 AM. My policy number is MN-754293323.\n\n        The accident took place at the intersection of Birch St and Willow Ave. I was driving my vehicle, a yellow Ford C-Class with license plate \n        number 9O 2725N. At the same time, another vehicle, a gold Toyota Altima with license plate number 873 YB8, \n        collided with my car. The driver, Robin Molina, failed to adhere to traffic rules, resulting in damage to both vehicles.\n\n        I promptly exchanged information with the other driver and took photos of the accident scene, including damages to both vehicles.\n        Attached to this email are the photos, a copy of the police report, and the estimate for the repair costs.\n\n        Kindly assist in processing this claim and let me know the next steps. You can reach me at 0023341678 or lwelch@yahoo.com.\n\n        Thank you for your assistance.\n\n        Sincerely,\n        David Baker\n        127 Reed Vista Apt. 044, Kingborough, MT 52939\n        "}
{"customer_name": "Mark Stephens", "customer_address": "51416 Drew Highway, Maryside, IA 78336", "customer_email": "maryjohnson@roberts-castillo.com", "policy_number": "YZ-398042033", "phone_number": "9684942160", "accident_date": "2024-01-07", "accident_time": "2:15 PM", "accident_location": "intersection of Birch St and Oak St", "description": "\n        Dear Parasol Insurance,\n\n        My name is Mark Stephens, and I am writing to file a claim for a recent car accident that occurred on 2024-01-07, \n        at approximately 2:15 PM. My policy number is YZ-398042033.\n\n        The accident took place at the intersection of Birch St and Oak St. I was driving my vehicle, a blue Mercedes-Benz 3 Series with license plate \n        number HUJ 214. At the same time, another vehicle, a maroon Hyundai Traverse with license plate number 78S P35, \n        collided with my car. The driver, Brian Humphrey, failed to adhere to traffic rules, resulting in damage to both vehicles.\n\n        I promptly exchanged information with the other driver and took photos of the accident scene, including damages to both vehicles.\n        Attached to this email are the photos, a copy of the police report, and the estimate for the repair costs.\n\n        Kindly assist in processing this claim and let me know the next steps. You can reach me at 9684942160 or maryjohnson@roberts-castillo.com.\n\n        Thank you for your assistance.\n\n        Sincerely,\n        Mark Stephens\n        51416 Drew Highway, Maryside, IA 78336\n        "}
{"customer_name": "Kurt Taylor", "customer_address": "3933 Kristen Inlet Apt. 171, Batesstad, SC 07503", "customer_email": "nicole96@smith.biz", "policy_number": "AC-882418828", "phone_number": "506.487.2240", "accident_date": "2024-01-02", "accident_time": "10:00 AM", "accident_location": "intersection of Oak St and Maple Rd", "description": "\n        Dear Parasol Insurance,\n\n        My name is Kurt Taylor, and I am writing to file a claim for a recent car accident that occurred on 2024-01-02, \n        at approximately 10:00 AM. My policy number is AC-882418828.\n\n        The accident took place at the intersection of Oak St and Maple Rd. I was driving my vehicle, a gold Honda Sorento with license plate \n        number HBA0018. At the same time, another vehicle, a red Audi Camry with license plate number WXD 542, \n        collided with my car. The driver, Michelle Anderson, failed to adhere to traffic rules, resulting in damage to both vehicles.\n\n        I promptly exchanged information with the other driver and took photos of the accident scene, including damages to both vehicles.\n        Attached to this email are the photos, a copy of the police report, and the estimate for the repair costs.\n\n        Kindly assist in processing this claim and let me know the next steps. You can reach me at 506.487.2240 or nicole96@smith.biz.\n\n        Thank you for your assistance.\n\n        Sincerely,\n        Kurt Taylor\n        3933 Kristen Inlet Apt. 171, Batesstad, SC 07503\n        "}
{"customer_name": "Elaine Rosales", "customer_address": "55595 Stephen Plaza Apt. 124, North Sandratown, MN 86154", "customer_email": "tammykim@hotmail.com", "policy_number": "LK-445787251", "phone_number": "(742)910-9304x505", "accident_date": "2024-01-02", "accident_time": "11:45 AM", "accident_location": "intersection of Spruce Ct and Spruce Ct", "description": "\n        Dear Parasol Insurance,\n\n        My name is Elaine Rosales, and I am writing to file a claim for a recent car accident that occurred on 2024-01-02, \n        at approximately 11:45 AM. My policy number is LK-445787251.\n\n        The accident took place at the intersection of Spruce Ct and Spruce Ct. I was driving my vehicle, a gray Honda A4 with license plate \n        number 4T P3786. At the same time, another vehicle, a green Hyundai Camry with license plate number CNE-493, \n        collided with my car. The driver, Zachary Barnett, failed to adhere to traffic rules, resulting in damage to both vehicles.\n\n        I promptly exchanged information with the other driver and took photos of the accident scene, including damages to both vehicles.\n        Attached to this email are the photos, a copy of the police report, and the estimate for the repair costs.\n\n        Kindly assist in processing this claim and let me know the next steps. You can reach me at (742)910-9304x505 or tammykim@hotmail.com.\n\n        Thank you for your assistance.\n\n        Sincerely,\n        Elaine Rosales\n        55595 Stephen Plaza Apt. 124, North Sandratown, MN 86154\n        "}
{"customer_name": "Eddie Miller", "customer_address": "2143 Powers Pine Apt. 987, Port Crystalshire, AR 41751", "customer_email": "kjohnston@shaw.com", "policy_number": "LK-127327571", "phone_number": "470.792.1702x491", "accident_date": "2024-01-06", "accident_time": "5:15 PM", "accident_location": "intersection of Cedar Dr and Spruce Ct", "description": "\n        Dear Parasol Insurance,\n\n        My name is Eddie Miller, and I am writing to file a claim for a recent car accident that occurred on 2024-01-06, \n        at approximately 5:15 PM. My policy number is LK-127327571.\n\n        The accident took place at the intersection of Cedar Dr and Spruce Ct. I was driving my vehicle, a gold Nissan 3 Series with license plate \n        number 813-XSK. At the same time, another vehicle, a black Nissan Civic with license plate number 074-APM, \n        collided with my car. The driver, Christopher Watson, failed to adhere to traffic rules, resulting in damage to both vehicles.\n\n        I promptly exchanged information with the other driver and took photos of the accident scene, including damages to both vehicles.\n        Attached to this email are the photos, a copy of the police report, and the estimate for the repair costs.\n\n        Kindly assist in processing this claim and let me know the next steps. You can reach me at 470.792.1702x491 or kjohnston@shaw.com.\n\n        Thank you for your assistance.\n\n        Sincerely,\n        Eddie Miller\n        2143 Powers Pine Apt. 987, Port Crystalshire, AR 41751\n        "}
{"customer_name": "Susan Casey", "customer_address": "29560 Edward Ramp Suite 054, East Kevin, MO 59296", "customer_email": "michaelmanning@gmail.com", "policy_number": "LK-739588153", "phone_number": "360.944.7245x97318", "accident_date": "2024-01-02", "accident_time": "4:00 PM", "accident_location": "intersection of Oak St and Cedar Dr", "description": "\n        Dear Parasol Insurance,\n\n        My name is Susan Casey, and I am writing to file a claim for a recent car accident that occurred on 2024-01-02, \n        at approximately 4:00 PM. My policy number is LK-739588153.\n\n        The accident took place at the intersection of Oak St and Cedar Dr. I was driving my vehicle, a gray Mercedes-Benz A4 with license plate \n        number EXD 723. At the same time, another vehicle, a gray Ford Camry with license plate number 74P P39, \n        collided with my car. The driver, Stephen Lee, failed to adhere to traffic rules, resulting in damage to both vehicles.\n\n        I promptly exchanged information with the other driver and took photos of the accident scene, including damages to both vehicles.\n        Attached to this email are the photos, a copy of the police report, and the estimate for the repair costs.\n\n        Kindly assist in processing this claim and let me know the next steps. You can reach me at 360.944.7245x97318 or michaelmanning@gmail.com.\n\n        Thank you for your assistance.\n\n        Sincerely,\n        Susan Casey\n        29560 Edward Ramp Suite 054, East Kevin, MO 59296\n        "}
{"customer_name": "Clarence Carter", "customer_address": "82216 Andrea Orchard, North Kelly, NY 44952", "customer_email": "jasonbell@lara-johnson.com", "policy_number": "MN-565891975", "phone_number": "642.252.9433x8558", "accident_date": "2024-01-07", "accident_time": "6:30 PM", "accident_location": "intersection of Willow Ave and Pine Blvd", "description": "\n        Dear Parasol Insurance,\n\n        My name is Clarence Carter, and I am writing to file a claim for a recent car accident that occurred on 2024-01-07, \n        at approximately 6:30 PM. My policy number is MN-565891975.\n\n        The accident took place at the intersection of Willow Ave and Pine Blvd. I was driving my vehicle, a white Toyota 3 Series with license plate \n        number 3R 63894. At the same time, another vehicle, a red Hyundai Focus with license plate number 9-2806L, \n        collided with my car. The driver, Jacqueline Gill, failed to adhere to traffic rules, resulting in damage to both vehicles.\n\n        I promptly exchanged information with the other driver and took photos of the accident scene, including damages to both vehicles.\n        Attached to this email are the photos, a copy of the police report, and the estimate for the repair costs.\n\n        Kindly assist in processing this claim and let me know the next steps. You can reach me at 642.252.9433x8558 or jasonbell@lara-johnson.com.\n\n        Thank you for your assistance.\n\n        Sincerely,\n        Clarence Carter\n        82216 Andrea Orchard, North Kelly, NY 44952\n        "}
{"customer_name": "Valerie Berg", "customer_address": "94971 Griffin Streets Apt. 192, Alexanderstad, WV 62003", "customer_email": "richardsonfelicia@hotmail.com", "policy_number": "LK-329159373", "phone_number": "363-752-1956x1923", "accident_date": "2024-01-02", "accident_time": "3:30 PM", "accident_location": "intersection of Elm Ln and Spruce Ct", "description": "\n        Dear Parasol Insurance,\n\n        My name is Valerie Berg, and I am writing to file a claim for a recent car accident that occurred on 2024-01-02, \n        at approximately 3:30 PM. My policy number is LK-329159373.\n\n        The accident took place at the intersection of Elm Ln and Spruce Ct. I was driving my vehicle, a silver Kia Focus with license plate \n        number MJL 058. At the same time, another vehicle, a black Audi Civic with license plate number 37-K899, \n        collided with my car. The driver, Charlene Harrison, failed to adhere to traffic rules, resulting in damage to both vehicles.\n\n        I promptly exchanged information with the other driver and took photos of the accident scene, including damages to both vehicles.\n        Attached to this email are the photos, a copy of the police report, and the estimate for the repair costs.\n\n        Kindly assist in processing this claim and let me know the next steps. You can reach me at 363-752-1956x1923 or richardsonfelicia@hotmail.com.\n\n        Thank you for your assistance.\n\n        Sincerely,\n        Valerie Berg\n        94971 Griffin Streets Apt. 192, Alexanderstad, WV 62003\n        "}
{"customer_name": "Wendy Williams", "customer_address": "7755 Kim Drive Suite 832, West Jorgebury, NE 47031", "customer_email": "fschmidt@andrade.info", "policy_number": "XY-366823456", "phone_number": "(302)064-6738", "accident_date": "2024-01-03", "accident_time": "2:15 PM", "accident_location": "intersection of Birch St and Main St", "description": "\n        Dear Parasol Insurance,\n\n        My name is Wendy Williams, and I am writing to file a claim for a recent car accident that occurred on 2024-01-03, \n        at approximately 2:15 PM. My policy number is XY-366823456.\n\n        The accident took place at the intersection of Birch St and Main St. I was driving my vehicle, a maroon Nissan Civic with license plate \n        number 9HE 406. At the same time, another vehicle, a red Chevrolet A4 with license plate number N 132229, \n        collided with my car. The driver, Teresa Fisher, failed to adhere to traffic rules, resulting in damage to both vehicles.\n\n        I promptly exchanged information with the other driver and took photos of the accident scene, including damages to both vehicles.\n        Attached to this email are the photos, a copy of the police report, and the estimate for the repair costs.\n\n        Kindly assist in processing this claim and let me know the next steps. You can reach me at (302)064-6738 or fschmidt@andrade.info.\n\n        Thank you for your assistance.\n\n        Sincerely,\n        Wendy Williams\n        7755 Kim Drive Suite 832, West Jorgebury, NE 47031\n        "}
{"customer_name": "Eddie Kelley", "customer_address": "5675 Murphy Mount, Harrisonmouth, MD 07227", "customer_email": "johnherring@gmail.com", "policy_number": "MN-308388529", "phone_number": "314.417.5202", "accident_date": "2024-01-06", "accident_time": "12:00 PM", "accident_location": "intersection of Elm Ln and Maple Rd", "description": "\n        Dear Parasol Insurance,\n\n        My name is Eddie Kelley, and I am writing to file a claim for a recent car accident that occurred on 2024-01-06, \n        at approximately 12:00 PM. My policy number is MN-308388529.\n\n        The accident took place at the intersection of Elm Ln and Maple Rd. I was driving my vehicle, a green Hyundai C-Class with license plate \n        number 4V 6Y1UGJ. At the same time, another vehicle, a blue Honda Civic with license plate number 8JK8519, \n        collided with my car. The driver, Shannon Weaver, failed to adhere to traffic rules, resulting in damage to both vehicles.\n\n        I promptly exchanged information with the other driver and took photos of the accident scene, including damages to both vehicles.\n        Attached to this email are the photos, a copy of the police report, and the estimate for the repair costs.\n\n        Kindly assist in processing this claim and let me know the next steps. You can reach me at 314.417.5202 or johnherring@gmail.com.\n\n        Thank you for your assistance.\n\n        Sincerely,\n        Eddie Kelley\n        5675 Murphy Mount, Harrisonmouth, MD 07227\n        "}
{"customer_name": "Jacqueline Sullivan", "customer_address": "44948 Johnson Pass, Robertbury, TX 25853", "customer_email": "ibrown@glenn-mcknight.biz", "policy_number": "YZ-642116832", "phone_number": "798-003-5687", "accident_date": "2024-01-05", "accident_time": "11:45 AM", "accident_location": "intersection of Spruce Ct and Maple Rd", "description": "\n        Dear Parasol Insurance,\n\n        My name is Jacqueline Sullivan, and I am writing to file a claim for a recent car accident that occurred on 2024-01-05, \n        at approximately 11:45 AM. My policy number is YZ-642116832.\n\n        The accident took place at the intersection of Spruce Ct and Maple Rd. I was driving my vehicle, a red Ford Civic with license plate \n        number 00Q\u2022453. At the same time, another vehicle, a silver Hyundai Traverse with license plate number 9-N3526, \n        collided with my car. The driver, Justin Roberts, failed to adhere to traffic rules, resulting in damage to both vehicles.\n\n        I promptly exchanged information with the other driver and took photos of the accident scene, including damages to both vehicles.\n        Attached to this email are the photos, a copy of the police report, and the estimate for the repair costs.\n\n        Kindly assist in processing this claim and let me know the next steps. You can reach me at 798-003-5687 or ibrown@glenn-mcknight.biz.\n\n        Thank you for your assistance.\n\n        Sincerely,\n        Jacqueline Sullivan\n        44948 Johnson Pass, Robertbury, TX 25853\n        "}
{"customer_name": "Christine Dixon", "customer_address": "14074 Horn Mountains, North Kristychester, NM 51957", "customer_email": "manuel12@yahoo.com", "policy_number": "BC-522723775", "phone_number": "+1-698-031-2229x7440", "accident_date": "2024-01-06", "accident_time": "5:15 PM", "accident_location": "intersection of Elm Ln and Cedar Dr", "description": "\n        Dear Parasol Insurance,\n\n        My name is Christine Dixon, and I am writing to file a claim for a recent car accident that occurred on 2024-01-06, \n        at approximately 5:15 PM. My policy number is BC-522723775.\n\n        The accident took place at the intersection of Elm Ln and Cedar Dr. I was driving my vehicle, a maroon Kia Traverse with license plate \n        number HBM 293. At the same time, another vehicle, a yellow Hyundai Sorento with license plate number 18AJ518, \n        collided with my car. The driver, Nathaniel Bowers, failed to adhere to traffic rules, resulting in damage to both vehicles.\n\n        I promptly exchanged information with the other driver and took photos of the accident scene, including damages to both vehicles.\n        Attached to this email are the photos, a copy of the police report, and the estimate for the repair costs.\n\n        Kindly assist in processing this claim and let me know the next steps. You can reach me at +1-698-031-2229x7440 or manuel12@yahoo.com.\n\n        Thank you for your assistance.\n\n        Sincerely,\n        Christine Dixon\n        14074 Horn Mountains, North Kristychester, NM 51957\n        "}
{"customer_name": "Kimberly Donovan", "customer_address": "42996 Coffey Pass, Dianashire, OR 17917", "customer_email": "rnelson@hogan.com", "policy_number": "BC-492673602", "phone_number": "433-596-9641", "accident_date": "2024-01-04", "accident_time": "4:00 PM", "accident_location": "intersection of Oak St and Oak St", "description": "\n        Dear Parasol Insurance,\n\n        My name is Kimberly Donovan, and I am writing to file a claim for a recent car accident that occurred on 2024-01-04, \n        at approximately 4:00 PM. My policy number is BC-492673602.\n\n        The accident took place at the intersection of Oak St and Oak St. I was driving my vehicle, a maroon Kia Sorento with license plate \n        number TPG5846. At the same time, another vehicle, a maroon Hyundai A4 with license plate number VHY-9920, \n        collided with my car. The driver, Jason Garcia, failed to adhere to traffic rules, resulting in damage to both vehicles.\n\n        I promptly exchanged information with the other driver and took photos of the accident scene, including damages to both vehicles.\n        Attached to this email are the photos, a copy of the police report, and the estimate for the repair costs.\n\n        Kindly assist in processing this claim and let me know the next steps. You can reach me at 433-596-9641 or rnelson@hogan.com.\n\n        Thank you for your assistance.\n\n        Sincerely,\n        Kimberly Donovan\n        42996 Coffey Pass, Dianashire, OR 17917\n        "}
{"customer_name": "Sean Bush", "customer_address": "1181 Ashley Road, Brittneyville, VA 61033", "customer_email": "campbellgregory@wood.net", "policy_number": "XY-238905493", "phone_number": "001-786-410-0877x2230", "accident_date": "2024-01-04", "accident_time": "2:15 PM", "accident_location": "intersection of Spruce Ct and Elm Ln", "description": "\n        Dear Parasol Insurance,\n\n        My name is Sean Bush, and I am writing to file a claim for a recent car accident that occurred on 2024-01-04, \n        at approximately 2:15 PM. My policy number is XY-238905493.\n\n        The accident took place at the intersection of Spruce Ct and Elm Ln. I was driving my vehicle, a gray Audi Focus with license plate \n        number 490-152. At the same time, another vehicle, a yellow Nissan Focus with license plate number 1O382, \n        collided with my car. The driver, Jessica Long, failed to adhere to traffic rules, resulting in damage to both vehicles.\n\n        I promptly exchanged information with the other driver and took photos of the accident scene, including damages to both vehicles.\n        Attached to this email are the photos, a copy of the police report, and the estimate for the repair costs.\n\n        Kindly assist in processing this claim and let me know the next steps. You can reach me at 001-786-410-0877x2230 or campbellgregory@wood.net.\n\n        Thank you for your assistance.\n\n        Sincerely,\n        Sean Bush\n        1181 Ashley Road, Brittneyville, VA 61033\n        "}
{"customer_name": "Christopher Burgess", "customer_address": "2974 Olivia Turnpike, New Brandon, WI 03366", "customer_email": "dawnbaker@hotmail.com", "policy_number": "BC-764063958", "phone_number": "(495)621-0544", "accident_date": "2024-01-06", "accident_time": "4:00 PM", "accident_location": "intersection of Cedar Dr and Spruce Ct", "description": "\n        Dear Parasol Insurance,\n\n        My name is Christopher Burgess, and I am writing to file a claim for a recent car accident that occurred on 2024-01-06, \n        at approximately 4:00 PM. My policy number is BC-764063958.\n\n        The accident took place at the intersection of Cedar Dr and Spruce Ct. I was driving my vehicle, a silver Ford C-Class with license plate \n        number TG-2244. At the same time, another vehicle, a maroon Hyundai Focus with license plate number 386 HJQ, \n        collided with my car. The driver, David Phelps, failed to adhere to traffic rules, resulting in damage to both vehicles.\n\n        I promptly exchanged information with the other driver and took photos of the accident scene, including damages to both vehicles.\n        Attached to this email are the photos, a copy of the police report, and the estimate for the repair costs.\n\n        Kindly assist in processing this claim and let me know the next steps. You can reach me at (495)621-0544 or dawnbaker@hotmail.com.\n\n        Thank you for your assistance.\n\n        Sincerely,\n        Christopher Burgess\n        2974 Olivia Turnpike, New Brandon, WI 03366\n        "}
{"customer_name": "Daniel Zimmerman", "customer_address": "44100 Porter Trail, Barbaraport, ME 87453", "customer_email": "kristi75@hotmail.com", "policy_number": "LK-930002286", "phone_number": "(266)580-2470x23200", "accident_date": "2024-01-07", "accident_time": "4:00 PM", "accident_location": "intersection of Elm Ln and Main St", "description": "\n        Dear Parasol Insurance,\n\n        My name is Daniel Zimmerman, and I am writing to file a claim for a recent car accident that occurred on 2024-01-07, \n        at approximately 4:00 PM. My policy number is LK-930002286.\n\n        The accident took place at the intersection of Elm Ln and Main St. I was driving my vehicle, a green Audi Traverse with license plate \n        number 32R R72. At the same time, another vehicle, a green BMW Altima with license plate number ZOR4228, \n        collided with my car. The driver, Donald King, failed to adhere to traffic rules, resulting in damage to both vehicles.\n\n        I promptly exchanged information with the other driver and took photos of the accident scene, including damages to both vehicles.\n        Attached to this email are the photos, a copy of the police report, and the estimate for the repair costs.\n\n        Kindly assist in processing this claim and let me know the next steps. You can reach me at (266)580-2470x23200 or kristi75@hotmail.com.\n\n        Thank you for your assistance.\n\n        Sincerely,\n        Daniel Zimmerman\n        44100 Porter Trail, Barbaraport, ME 87453\n        "}
{"customer_name": "Jason Pittman", "customer_address": "78721 Joshua Square, West Donaldberg, OK 98996", "customer_email": "oblackwell@peterson-lindsey.com", "policy_number": "YZ-613786776", "phone_number": "+1-255-337-5007", "accident_date": "2024-01-04", "accident_time": "6:30 PM", "accident_location": "intersection of Maple Rd and Willow Ave", "description": "\n        Dear Parasol Insurance,\n\n        My name is Jason Pittman, and I am writing to file a claim for a recent car accident that occurred on 2024-01-04, \n        at approximately 6:30 PM. My policy number is YZ-613786776.\n\n        The accident took place at the intersection of Maple Rd and Willow Ave. I was driving my vehicle, a green Ford Altima with license plate \n        number KVY-5576. At the same time, another vehicle, a red Chevrolet Altima with license plate number 53-AU84, \n        collided with my car. The driver, Jason Delgado, failed to adhere to traffic rules, resulting in damage to both vehicles.\n\n        I promptly exchanged information with the other driver and took photos of the accident scene, including damages to both vehicles.\n        Attached to this email are the photos, a copy of the police report, and the estimate for the repair costs.\n\n        Kindly assist in processing this claim and let me know the next steps. You can reach me at +1-255-337-5007 or oblackwell@peterson-lindsey.com.\n\n        Thank you for your assistance.\n\n        Sincerely,\n        Jason Pittman\n        78721 Joshua Square, West Donaldberg, OK 98996\n        "}
{"customer_name": "Kristin Smith", "customer_address": "3128 Hendrix Tunnel, Harrismouth, HI 46512", "customer_email": "bryansmith@may.com", "policy_number": "BC-675911207", "phone_number": "183.965.8166x819", "accident_date": "2024-01-06", "accident_time": "6:30 PM", "accident_location": "intersection of Elm Ln and Elm Ln", "description": "\n        Dear Parasol Insurance,\n\n        My name is Kristin Smith, and I am writing to file a claim for a recent car accident that occurred on 2024-01-06, \n        at approximately 6:30 PM. My policy number is BC-675911207.\n\n        The accident took place at the intersection of Elm Ln and Elm Ln. I was driving my vehicle, a silver Kia Sorento with license plate \n        number 608 AAE. At the same time, another vehicle, a black Ford Traverse with license plate number 73F PS5, \n        collided with my car. The driver, Amanda Marshall, failed to adhere to traffic rules, resulting in damage to both vehicles.\n\n        I promptly exchanged information with the other driver and took photos of the accident scene, including damages to both vehicles.\n        Attached to this email are the photos, a copy of the police report, and the estimate for the repair costs.\n\n        Kindly assist in processing this claim and let me know the next steps. You can reach me at 183.965.8166x819 or bryansmith@may.com.\n\n        Thank you for your assistance.\n\n        Sincerely,\n        Kristin Smith\n        3128 Hendrix Tunnel, Harrismouth, HI 46512\n        "}
{"customer_name": "Kimberly Davis", "customer_address": "6503 Martinez Trail, Jeffreyburgh, RI 48193", "customer_email": "amberdalton@hotmail.com", "policy_number": "YZ-636248568", "phone_number": "866.875.6841x043", "accident_date": "2024-01-06", "accident_time": "3:30 PM", "accident_location": "intersection of Oak St and Oak St", "description": "\n        Dear Parasol Insurance,\n\n        My name is Kimberly Davis, and I am writing to file a claim for a recent car accident that occurred on 2024-01-06, \n        at approximately 3:30 PM. My policy number is YZ-636248568.\n\n        The accident took place at the intersection of Oak St and Oak St. I was driving my vehicle, a silver Chevrolet Altima with license plate \n        number EUH S73. At the same time, another vehicle, a blue BMW C-Class with license plate number C83 7ZN, \n        collided with my car. The driver, Steven Baker, failed to adhere to traffic rules, resulting in damage to both vehicles.\n\n        I promptly exchanged information with the other driver and took photos of the accident scene, including damages to both vehicles.\n        Attached to this email are the photos, a copy of the police report, and the estimate for the repair costs.\n\n        Kindly assist in processing this claim and let me know the next steps. You can reach me at 866.875.6841x043 or amberdalton@hotmail.com.\n\n        Thank you for your assistance.\n\n        Sincerely,\n        Kimberly Davis\n        6503 Martinez Trail, Jeffreyburgh, RI 48193\n        "}
{"customer_name": "Thomas Perez", "customer_address": "29033 Kim Unions, Garciabury, MT 48670", "customer_email": "joshuamaddox@gmail.com", "policy_number": "XY-412158805", "phone_number": "001-225-399-1389x698", "accident_date": "2024-01-07", "accident_time": "5:15 PM", "accident_location": "intersection of Elm Ln and Pine Blvd", "description": "\n        Dear Parasol Insurance,\n\n        My name is Thomas Perez, and I am writing to file a claim for a recent car accident that occurred on 2024-01-07, \n        at approximately 5:15 PM. My policy number is XY-412158805.\n\n        The accident took place at the intersection of Elm Ln and Pine Blvd. I was driving my vehicle, a red Nissan C-Class with license plate \n        number 9ZM 628. At the same time, another vehicle, a white Hyundai Focus with license plate number 9TM P04, \n        collided with my car. The driver, Alexander Jimenez, failed to adhere to traffic rules, resulting in damage to both vehicles.\n\n        I promptly exchanged information with the other driver and took photos of the accident scene, including damages to both vehicles.\n        Attached to this email are the photos, a copy of the police report, and the estimate for the repair costs.\n\n        Kindly assist in processing this claim and let me know the next steps. You can reach me at 001-225-399-1389x698 or joshuamaddox@gmail.com.\n\n        Thank you for your assistance.\n\n        Sincerely,\n        Thomas Perez\n        29033 Kim Unions, Garciabury, MT 48670\n        "}
{"customer_name": "Theresa Solis", "customer_address": "8849 Craig Wall, Lindseystad, ME 85250", "customer_email": "deanna33@abbott-silva.com", "policy_number": "AC-165132609", "phone_number": "378-220-5447x15796", "accident_date": "2024-01-04", "accident_time": "10:00 AM", "accident_location": "intersection of Elm Ln and Willow Ave", "description": "\n        Dear Parasol Insurance,\n\n        My name is Theresa Solis, and I am writing to file a claim for a recent car accident that occurred on 2024-01-04, \n        at approximately 10:00 AM. My policy number is AC-165132609.\n\n        The accident took place at the intersection of Elm Ln and Willow Ave. I was driving my vehicle, a white Nissan Civic with license plate \n        number 422 BYA. At the same time, another vehicle, a red Audi 3 Series with license plate number FND-9987, \n        collided with my car. The driver, Cindy Mcneil, failed to adhere to traffic rules, resulting in damage to both vehicles.\n\n        I promptly exchanged information with the other driver and took photos of the accident scene, including damages to both vehicles.\n        Attached to this email are the photos, a copy of the police report, and the estimate for the repair costs.\n\n        Kindly assist in processing this claim and let me know the next steps. You can reach me at 378-220-5447x15796 or deanna33@abbott-silva.com.\n\n        Thank you for your assistance.\n\n        Sincerely,\n        Theresa Solis\n        8849 Craig Wall, Lindseystad, ME 85250\n        "}
{"customer_name": "William Wright", "customer_address": "7123 Thomas Ranch Apt. 628, Murphyshire, AZ 87933", "customer_email": "kramerryan@gmail.com", "policy_number": "XY-782067472", "phone_number": "856-935-3344", "accident_date": "2024-01-04", "accident_time": "4:00 PM", "accident_location": "intersection of Pine Blvd and Spruce Ct", "description": "\n        Dear Parasol Insurance,\n\n        My name is William Wright, and I am writing to file a claim for a recent car accident that occurred on 2024-01-04, \n        at approximately 4:00 PM. My policy number is XY-782067472.\n\n        The accident took place at the intersection of Pine Blvd and Spruce Ct. I was driving my vehicle, a gold Toyota Sorento with license plate \n        number 736-YAH. At the same time, another vehicle, a blue Kia A4 with license plate number 479 PRF, \n        collided with my car. The driver, Christine Scott, failed to adhere to traffic rules, resulting in damage to both vehicles.\n\n        I promptly exchanged information with the other driver and took photos of the accident scene, including damages to both vehicles.\n        Attached to this email are the photos, a copy of the police report, and the estimate for the repair costs.\n\n        Kindly assist in processing this claim and let me know the next steps. You can reach me at 856-935-3344 or kramerryan@gmail.com.\n\n        Thank you for your assistance.\n\n        Sincerely,\n        William Wright\n        7123 Thomas Ranch Apt. 628, Murphyshire, AZ 87933\n        "}
{"customer_name": "Jason Reeves", "customer_address": "353 Gregory Squares Apt. 421, Jacobborough, NE 02347", "customer_email": "smurphy@buchanan.com", "policy_number": "YZ-795464045", "phone_number": "001-082-207-5798x84268", "accident_date": "2024-01-03", "accident_time": "1:45 PM", "accident_location": "intersection of Willow Ave and Oak St", "description": "\n        Dear Parasol Insurance,\n\n        My name is Jason Reeves, and I am writing to file a claim for a recent car accident that occurred on 2024-01-03, \n        at approximately 1:45 PM. My policy number is YZ-795464045.\n\n        The accident took place at the intersection of Willow Ave and Oak St. I was driving my vehicle, a green BMW Focus with license plate \n        number RVL-0072. At the same time, another vehicle, a gold Hyundai Camry with license plate number MBP 195, \n        collided with my car. The driver, Amanda Sanchez, failed to adhere to traffic rules, resulting in damage to both vehicles.\n\n        I promptly exchanged information with the other driver and took photos of the accident scene, including damages to both vehicles.\n        Attached to this email are the photos, a copy of the police report, and the estimate for the repair costs.\n\n        Kindly assist in processing this claim and let me know the next steps. You can reach me at 001-082-207-5798x84268 or smurphy@buchanan.com.\n\n        Thank you for your assistance.\n\n        Sincerely,\n        Jason Reeves\n        353 Gregory Squares Apt. 421, Jacobborough, NE 02347\n        "}
{"customer_name": "Tyler Little", "customer_address": "784 Gonzalez Alley, Alexismouth, SD 54188", "customer_email": "vaughanleah@hotmail.com", "policy_number": "YZ-398257431", "phone_number": "(503)131-8063x1350", "accident_date": "2024-01-03", "accident_time": "2:15 PM", "accident_location": "intersection of Elm Ln and Birch St", "description": "\n        Dear Parasol Insurance,\n\n        My name is Tyler Little, and I am writing to file a claim for a recent car accident that occurred on 2024-01-03, \n        at approximately 2:15 PM. My policy number is YZ-398257431.\n\n        The accident took place at the intersection of Elm Ln and Birch St. I was driving my vehicle, a blue BMW Camry with license plate \n        number 63D US2. At the same time, another vehicle, a yellow Mercedes-Benz Focus with license plate number 3P 8E8WPE, \n        collided with my car. The driver, Jeffrey Hudson, failed to adhere to traffic rules, resulting in damage to both vehicles.\n\n        I promptly exchanged information with the other driver and took photos of the accident scene, including damages to both vehicles.\n        Attached to this email are the photos, a copy of the police report, and the estimate for the repair costs.\n\n        Kindly assist in processing this claim and let me know the next steps. You can reach me at (503)131-8063x1350 or vaughanleah@hotmail.com.\n\n        Thank you for your assistance.\n\n        Sincerely,\n        Tyler Little\n        784 Gonzalez Alley, Alexismouth, SD 54188\n        "}
{"customer_name": "Anna Brown", "customer_address": "30875 Thomas Brook, South Patricia, TN 96878", "customer_email": "william15@nicholson.com", "policy_number": "MN-932068645", "phone_number": "586.052.9300", "accident_date": "2024-01-06", "accident_time": "10:00 AM", "accident_location": "intersection of Pine Blvd and Cedar Dr", "description": "\n        Dear Parasol Insurance,\n\n        My name is Anna Brown, and I am writing to file a claim for a recent car accident that occurred on 2024-01-06, \n        at approximately 10:00 AM. My policy number is MN-932068645.\n\n        The accident took place at the intersection of Pine Blvd and Cedar Dr. I was driving my vehicle, a blue Kia A4 with license plate \n        number 172734. At the same time, another vehicle, a blue Mercedes-Benz Civic with license plate number BXM H90, \n        collided with my car. The driver, James Cruz, failed to adhere to traffic rules, resulting in damage to both vehicles.\n\n        I promptly exchanged information with the other driver and took photos of the accident scene, including damages to both vehicles.\n        Attached to this email are the photos, a copy of the police report, and the estimate for the repair costs.\n\n        Kindly assist in processing this claim and let me know the next steps. You can reach me at 586.052.9300 or william15@nicholson.com.\n\n        Thank you for your assistance.\n\n        Sincerely,\n        Anna Brown\n        30875 Thomas Brook, South Patricia, TN 96878\n        "}
{"customer_name": "Mark Fisher", "customer_address": "695 Ashley Wells, South Cassieview, MN 29612", "customer_email": "ericmartinez@yahoo.com", "policy_number": "YZ-185998067", "phone_number": "406-184-9173", "accident_date": "2024-01-02", "accident_time": "6:30 PM", "accident_location": "intersection of Cedar Dr and Oak St", "description": "\n        Dear Parasol Insurance,\n\n        My name is Mark Fisher, and I am writing to file a claim for a recent car accident that occurred on 2024-01-02, \n        at approximately 6:30 PM. My policy number is YZ-185998067.\n\n        The accident took place at the intersection of Cedar Dr and Oak St. I was driving my vehicle, a blue Mercedes-Benz Sorento with license plate \n        number Q 117765. At the same time, another vehicle, a black Audi Civic with license plate number HQA 325, \n        collided with my car. The driver, Leslie Duke, failed to adhere to traffic rules, resulting in damage to both vehicles.\n\n        I promptly exchanged information with the other driver and took photos of the accident scene, including damages to both vehicles.\n        Attached to this email are the photos, a copy of the police report, and the estimate for the repair costs.\n\n        Kindly assist in processing this claim and let me know the next steps. You can reach me at 406-184-9173 or ericmartinez@yahoo.com.\n\n        Thank you for your assistance.\n\n        Sincerely,\n        Mark Fisher\n        695 Ashley Wells, South Cassieview, MN 29612\n        "}
