{"customer_name": "Eric Cline", "customer_address": "0801 Lauren Alley, East William, MS 43056", "customer_email": "bairddennis@vazquez.com", "policy_number": "BC-857143475", "phone_number": "242.261.8544", "accident_date": "2024-01-06", "accident_time": "6:30 PM", "accident_location": "intersection of Elm Ln and Pine Blvd", "description": "\n        Dear Parasol Insurance,\n\n        My name is Eric Cline, and I am writing to file a claim for a recent car accident that occurred on 2024-01-06, \n        at approximately 6:30 PM. My policy number is BC-857143475.\n\n        The accident took place at the intersection of Elm Ln and Pine Blvd. I was driving my vehicle, a yellow Ford Traverse with license plate \n        number 614 7962. At the same time, another vehicle, a blue BMW Civic with license plate number 094-RGL, \n        collided with my car. The driver, Samantha Juarez, failed to adhere to traffic rules, resulting in damage to both vehicles.\n\n        I promptly exchanged information with the other driver and took photos of the accident scene, including damages to both vehicles.\n        Attached to this email are the photos, a copy of the police report, and the estimate for the repair costs.\n\n        Kindly assist in processing this claim and let me know the next steps. You can reach me at 242.261.8544 or bairddennis@vazquez.com.\n\n        Thank you for your assistance.\n\n        Sincerely,\n        Eric Cline\n        0801 Lauren Alley, East William, MS 43056\n        "}
{"customer_name": "Aaron Bowman", "customer_address": "Unit 4232 Box 8906, DPO AE 18730", "customer_email": "bestrada@chang.com", "policy_number": "AC-584790380", "phone_number": "(909)412-1229", "accident_date": "2024-01-02", "accident_time": "11:45 AM", "accident_location": "intersection of Maple Rd and Main St", "description": "\n        Dear Parasol Insurance,\n\n        My name is Aaron Bowman, and I am writing to file a claim for a recent car accident that occurred on 2024-01-02, \n        at approximately 11:45 AM. My policy number is AC-584790380.\n\n        The accident took place at the intersection of Maple Rd and Main St. I was driving my vehicle, a maroon Nissan Elantra with license plate \n        number 285 3YT. At the same time, another vehicle, a silver Honda Traverse with license plate number 1DZ S60, \n        collided with my car. The driver, Douglas Small, failed to adhere to traffic rules, resulting in damage to both vehicles.\n\n        I promptly exchanged information with the other driver and took photos of the accident scene, including damages to both vehicles.\n        Attached to this email are the photos, a copy of the police report, and the estimate for the repair costs.\n\n        Kindly assist in processing this claim and let me know the next steps. You can reach me at (909)412-1229 or bestrada@chang.com.\n\n        Thank you for your assistance.\n\n        Sincerely,\n        Aaron Bowman\n        Unit 4232 Box 8906, DPO AE 18730\n        "}
{"customer_name": "Jennifer Lewis", "customer_address": "2557 Smith Street Apt. 819, North Ryan, MS 82717", "customer_email": "evelez@yahoo.com", "policy_number": "XY-294014511", "phone_number": "009-665-1801x565", "accident_date": "2024-01-02", "accident_time": "3:30 PM", "accident_location": "intersection of Elm Ln and Elm Ln", "description": "\n        Dear Parasol Insurance,\n\n        My name is Jennifer Lewis, and I am writing to file a claim for a recent car accident that occurred on 2024-01-02, \n        at approximately 3:30 PM. My policy number is XY-294014511.\n\n        The accident took place at the intersection of Elm Ln and Elm Ln. I was driving my vehicle, a blue Kia Focus with license plate \n        number 711-901. At the same time, another vehicle, a yellow Hyundai A4 with license plate number QLS-9120, \n        collided with my car. The driver, Amanda Hall, failed to adhere to traffic rules, resulting in damage to both vehicles.\n\n        I promptly exchanged information with the other driver and took photos of the accident scene, including damages to both vehicles.\n        Attached to this email are the photos, a copy of the police report, and the estimate for the repair costs.\n\n        Kindly assist in processing this claim and let me know the next steps. You can reach me at 009-665-1801x565 or evelez@yahoo.com.\n\n        Thank you for your assistance.\n\n        Sincerely,\n        Jennifer Lewis\n        2557 Smith Street Apt. 819, North Ryan, MS 82717\n        "}
{"customer_name": "Sarah Palmer", "customer_address": "4023 Rhonda Ridge, Smithside, CO 28584", "customer_email": "wmcintyre@rivera-williams.net", "policy_number": "XY-581702749", "phone_number": "001-071-957-3685x11975", "accident_date": "2024-01-05", "accident_time": "5:15 PM", "accident_location": "intersection of Spruce Ct and Willow Ave", "description": "\n        Dear Parasol Insurance,\n\n        My name is Sarah Palmer, and I am writing to file a claim for a recent car accident that occurred on 2024-01-05, \n        at approximately 5:15 PM. My policy number is XY-581702749.\n\n        The accident took place at the intersection of Spruce Ct and Willow Ave. I was driving my vehicle, a white Mercedes-Benz Focus with license plate \n        number ZQO 037. At the same time, another vehicle, a gray Ford Focus with license plate number 02-D684, \n        collided with my car. The driver, Elizabeth Fox, failed to adhere to traffic rules, resulting in damage to both vehicles.\n\n        I promptly exchanged information with the other driver and took photos of the accident scene, including damages to both vehicles.\n        Attached to this email are the photos, a copy of the police report, and the estimate for the repair costs.\n\n        Kindly assist in processing this claim and let me know the next steps. You can reach me at 001-071-957-3685x11975 or wmcintyre@rivera-williams.net.\n\n        Thank you for your assistance.\n\n        Sincerely,\n        Sarah Palmer\n        4023 Rhonda Ridge, Smithside, CO 28584\n        "}
{"customer_name": "Douglas Fletcher", "customer_address": "56963 Mike Park, Pattersonhaven, SD 89902", "customer_email": "rushrobert@morris.info", "policy_number": "BC-219104239", "phone_number": "484-703-5575", "accident_date": "2024-01-05", "accident_time": "12:00 PM", "accident_location": "intersection of Willow Ave and Main St", "description": "\n        Dear Parasol Insurance,\n\n        My name is Douglas Fletcher, and I am writing to file a claim for a recent car accident that occurred on 2024-01-05, \n        at approximately 12:00 PM. My policy number is BC-219104239.\n\n        The accident took place at the intersection of Willow Ave and Main St. I was driving my vehicle, a red Mercedes-Benz Altima with license plate \n        number T47 4KT. At the same time, another vehicle, a blue BMW Altima with license plate number 08B\u2022709, \n        collided with my car. The driver, Jennifer Diaz, failed to adhere to traffic rules, resulting in damage to both vehicles.\n\n        I promptly exchanged information with the other driver and took photos of the accident scene, including damages to both vehicles.\n        Attached to this email are the photos, a copy of the police report, and the estimate for the repair costs.\n\n        Kindly assist in processing this claim and let me know the next steps. You can reach me at 484-703-5575 or rushrobert@morris.info.\n\n        Thank you for your assistance.\n\n        Sincerely,\n        Douglas Fletcher\n        56963 Mike Park, Pattersonhaven, SD 89902\n        "}
{"customer_name": "Dawn Rogers", "customer_address": "33305 Owens Well, Teresatown, IN 35812", "customer_email": "omathis@hotmail.com", "policy_number": "AC-717171281", "phone_number": "+1-334-846-9558x38939", "accident_date": "2024-01-03", "accident_time": "6:30 PM", "accident_location": "intersection of Willow Ave and Cedar Dr", "description": "\n        Dear Parasol Insurance,\n\n        My name is Dawn Rogers, and I am writing to file a claim for a recent car accident that occurred on 2024-01-03, \n        at approximately 6:30 PM. My policy number is AC-717171281.\n\n        The accident took place at the intersection of Willow Ave and Cedar Dr. I was driving my vehicle, a gray Toyota Camry with license plate \n        number 186-EZHK. At the same time, another vehicle, a gold BMW Elantra with license plate number BFL1095, \n        collided with my car. The driver, Allison Browning, failed to adhere to traffic rules, resulting in damage to both vehicles.\n\n        I promptly exchanged information with the other driver and took photos of the accident scene, including damages to both vehicles.\n        Attached to this email are the photos, a copy of the police report, and the estimate for the repair costs.\n\n        Kindly assist in processing this claim and let me know the next steps. You can reach me at +1-334-846-9558x38939 or omathis@hotmail.com.\n\n        Thank you for your assistance.\n\n        Sincerely,\n        Dawn Rogers\n        33305 Owens Well, Teresatown, IN 35812\n        "}
{"customer_name": "Carolyn Doyle", "customer_address": "0102 Whitney Junction Suite 770, Bryantbury, ME 15806", "customer_email": "freemandaniel@hotmail.com", "policy_number": "MN-553206964", "phone_number": "001-005-968-1801x468", "accident_date": "2024-01-02", "accident_time": "11:45 AM", "accident_location": "intersection of Elm Ln and Oak St", "description": "\n        Dear Parasol Insurance,\n\n        My name is Carolyn Doyle, and I am writing to file a claim for a recent car accident that occurred on 2024-01-02, \n        at approximately 11:45 AM. My policy number is MN-553206964.\n\n        The accident took place at the intersection of Elm Ln and Oak St. I was driving my vehicle, a green Mercedes-Benz A4 with license plate \n        number WDA-1188. At the same time, another vehicle, a yellow Kia Traverse with license plate number 492-CKLY, \n        collided with my car. The driver, Daniel Lester, failed to adhere to traffic rules, resulting in damage to both vehicles.\n\n        I promptly exchanged information with the other driver and took photos of the accident scene, including damages to both vehicles.\n        Attached to this email are the photos, a copy of the police report, and the estimate for the repair costs.\n\n        Kindly assist in processing this claim and let me know the next steps. You can reach me at 001-005-968-1801x468 or freemandaniel@hotmail.com.\n\n        Thank you for your assistance.\n\n        Sincerely,\n        Carolyn Doyle\n        0102 Whitney Junction Suite 770, Bryantbury, ME 15806\n        "}
{"customer_name": "Gloria Gutierrez", "customer_address": "PSC 5655, Box 0502, APO AE 75439", "customer_email": "elizabethdennis@stewart-evans.com", "policy_number": "BC-446187044", "phone_number": "+1-506-712-9344", "accident_date": "2024-01-05", "accident_time": "3:30 PM", "accident_location": "intersection of Elm Ln and Oak St", "description": "\n        Dear Parasol Insurance,\n\n        My name is Gloria Gutierrez, and I am writing to file a claim for a recent car accident that occurred on 2024-01-05, \n        at approximately 3:30 PM. My policy number is BC-446187044.\n\n        The accident took place at the intersection of Elm Ln and Oak St. I was driving my vehicle, a gold Kia A4 with license plate \n        number BFJ-0336. At the same time, another vehicle, a green Toyota C-Class with license plate number XHM 8920, \n        collided with my car. The driver, Jillian Joseph, failed to adhere to traffic rules, resulting in damage to both vehicles.\n\n        I promptly exchanged information with the other driver and took photos of the accident scene, including damages to both vehicles.\n        Attached to this email are the photos, a copy of the police report, and the estimate for the repair costs.\n\n        Kindly assist in processing this claim and let me know the next steps. You can reach me at +1-506-712-9344 or elizabethdennis@stewart-evans.com.\n\n        Thank you for your assistance.\n\n        Sincerely,\n        Gloria Gutierrez\n        PSC 5655, Box 0502, APO AE 75439\n        "}
{"customer_name": "Tristan Bullock", "customer_address": "299 Henry Mission Apt. 391, East Kimberly, ME 36002", "customer_email": "kstewart@hotmail.com", "policy_number": "BC-795898738", "phone_number": "+1-038-346-2163x913", "accident_date": "2024-01-07", "accident_time": "2:15 PM", "accident_location": "intersection of Willow Ave and Willow Ave", "description": "\n        Dear Parasol Insurance,\n\n        My name is Tristan Bullock, and I am writing to file a claim for a recent car accident that occurred on 2024-01-07, \n        at approximately 2:15 PM. My policy number is BC-795898738.\n\n        The accident took place at the intersection of Willow Ave and Willow Ave. I was driving my vehicle, a gray Chevrolet C-Class with license plate \n        number 05E 351. At the same time, another vehicle, a red Honda Elantra with license plate number DZI-095, \n        collided with my car. The driver, Jessica Galloway, failed to adhere to traffic rules, resulting in damage to both vehicles.\n\n        I promptly exchanged information with the other driver and took photos of the accident scene, including damages to both vehicles.\n        Attached to this email are the photos, a copy of the police report, and the estimate for the repair costs.\n\n        Kindly assist in processing this claim and let me know the next steps. You can reach me at +1-038-346-2163x913 or kstewart@hotmail.com.\n\n        Thank you for your assistance.\n\n        Sincerely,\n        Tristan Bullock\n        299 Henry Mission Apt. 391, East Kimberly, ME 36002\n        "}
{"customer_name": "Kara Chen", "customer_address": "3112 Farley Prairie Suite 633, East Christopherfurt, OR 45616", "customer_email": "melinda73@hotmail.com", "policy_number": "AC-140136059", "phone_number": "(120)204-7858x621", "accident_date": "2024-01-02", "accident_time": "4:00 PM", "accident_location": "intersection of Birch St and Oak St", "description": "\n        Dear Parasol Insurance,\n\n        My name is Kara Chen, and I am writing to file a claim for a recent car accident that occurred on 2024-01-02, \n        at approximately 4:00 PM. My policy number is AC-140136059.\n\n        The accident took place at the intersection of Birch St and Oak St. I was driving my vehicle, a blue BMW C-Class with license plate \n        number 744-VJB. At the same time, another vehicle, a blue Hyundai A4 with license plate number 89-4957Q, \n        collided with my car. The driver, Kathryn Lewis, failed to adhere to traffic rules, resulting in damage to both vehicles.\n\n        I promptly exchanged information with the other driver and took photos of the accident scene, including damages to both vehicles.\n        Attached to this email are the photos, a copy of the police report, and the estimate for the repair costs.\n\n        Kindly assist in processing this claim and let me know the next steps. You can reach me at (120)204-7858x621 or melinda73@hotmail.com.\n\n        Thank you for your assistance.\n\n        Sincerely,\n        Kara Chen\n        3112 Farley Prairie Suite 633, East Christopherfurt, OR 45616\n        "}
{"customer_name": "James Nixon", "customer_address": "USCGC Butler, FPO AE 84392", "customer_email": "flewis@cooper.com", "policy_number": "YZ-364042270", "phone_number": "(117)151-0856x435", "accident_date": "2024-01-04", "accident_time": "6:30 PM", "accident_location": "intersection of Oak St and Elm Ln", "description": "\n        Dear Parasol Insurance,\n\n        My name is James Nixon, and I am writing to file a claim for a recent car accident that occurred on 2024-01-04, \n        at approximately 6:30 PM. My policy number is YZ-364042270.\n\n        The accident took place at the intersection of Oak St and Elm Ln. I was driving my vehicle, a white Chevrolet C-Class with license plate \n        number 002 6TR. At the same time, another vehicle, a red Hyundai Altima with license plate number 338J3, \n        collided with my car. The driver, Leah Graves, failed to adhere to traffic rules, resulting in damage to both vehicles.\n\n        I promptly exchanged information with the other driver and took photos of the accident scene, including damages to both vehicles.\n        Attached to this email are the photos, a copy of the police report, and the estimate for the repair costs.\n\n        Kindly assist in processing this claim and let me know the next steps. You can reach me at (117)151-0856x435 or flewis@cooper.com.\n\n        Thank you for your assistance.\n\n        Sincerely,\n        James Nixon\n        USCGC Butler, FPO AE 84392\n        "}
{"customer_name": "Sarah Soto", "customer_address": "5873 Garcia Fort, Port Jasonville, DC 11047", "customer_email": "michael71@frye.com", "policy_number": "AC-245523699", "phone_number": "(467)572-6085", "accident_date": "2024-01-05", "accident_time": "1:45 PM", "accident_location": "intersection of Oak St and Oak St", "description": "\n        Dear Parasol Insurance,\n\n        My name is Sarah Soto, and I am writing to file a claim for a recent car accident that occurred on 2024-01-05, \n        at approximately 1:45 PM. My policy number is AC-245523699.\n\n        The accident took place at the intersection of Oak St and Oak St. I was driving my vehicle, a black Ford Sorento with license plate \n        number L62 6PH. At the same time, another vehicle, a red Nissan Sorento with license plate number 822-FIJ, \n        collided with my car. The driver, Gail Savage, failed to adhere to traffic rules, resulting in damage to both vehicles.\n\n        I promptly exchanged information with the other driver and took photos of the accident scene, including damages to both vehicles.\n        Attached to this email are the photos, a copy of the police report, and the estimate for the repair costs.\n\n        Kindly assist in processing this claim and let me know the next steps. You can reach me at (467)572-6085 or michael71@frye.com.\n\n        Thank you for your assistance.\n\n        Sincerely,\n        Sarah Soto\n        5873 Garcia Fort, Port Jasonville, DC 11047\n        "}
{"customer_name": "Cody Martin", "customer_address": "239 Kristina Mountain Suite 623, North Kristyshire, DE 26932", "customer_email": "jamesmoore@hotmail.com", "policy_number": "MN-160964733", "phone_number": "+1-572-363-3622", "accident_date": "2024-01-07", "accident_time": "2:15 PM", "accident_location": "intersection of Cedar Dr and Elm Ln", "description": "\n        Dear Parasol Insurance,\n\n        My name is Cody Martin, and I am writing to file a claim for a recent car accident that occurred on 2024-01-07, \n        at approximately 2:15 PM. My policy number is MN-160964733.\n\n        The accident took place at the intersection of Cedar Dr and Elm Ln. I was driving my vehicle, a blue Kia Traverse with license plate \n        number 339 BS9. At the same time, another vehicle, a black Hyundai Camry with license plate number 60-6918B, \n        collided with my car. The driver, Susan Johnson, failed to adhere to traffic rules, resulting in damage to both vehicles.\n\n        I promptly exchanged information with the other driver and took photos of the accident scene, including damages to both vehicles.\n        Attached to this email are the photos, a copy of the police report, and the estimate for the repair costs.\n\n        Kindly assist in processing this claim and let me know the next steps. You can reach me at +1-572-363-3622 or jamesmoore@hotmail.com.\n\n        Thank you for your assistance.\n\n        Sincerely,\n        Cody Martin\n        239 Kristina Mountain Suite 623, North Kristyshire, DE 26932\n        "}
{"customer_name": "Carolyn Jackson", "customer_address": "83922 Dixon Centers Suite 433, South Timothy, IL 85222", "customer_email": "christopherjacobson@wright-hayes.biz", "policy_number": "AC-245692969", "phone_number": "337.273.0914x73699", "accident_date": "2024-01-03", "accident_time": "2:15 PM", "accident_location": "intersection of Cedar Dr and Spruce Ct", "description": "\n        Dear Parasol Insurance,\n\n        My name is Carolyn Jackson, and I am writing to file a claim for a recent car accident that occurred on 2024-01-03, \n        at approximately 2:15 PM. My policy number is AC-245692969.\n\n        The accident took place at the intersection of Cedar Dr and Spruce Ct. I was driving my vehicle, a green BMW Sorento with license plate \n        number 0-23850D. At the same time, another vehicle, a red Nissan Traverse with license plate number UJH-4725, \n        collided with my car. The driver, Melissa Frost, failed to adhere to traffic rules, resulting in damage to both vehicles.\n\n        I promptly exchanged information with the other driver and took photos of the accident scene, including damages to both vehicles.\n        Attached to this email are the photos, a copy of the police report, and the estimate for the repair costs.\n\n        Kindly assist in processing this claim and let me know the next steps. You can reach me at 337.273.0914x73699 or christopherjacobson@wright-hayes.biz.\n\n        Thank you for your assistance.\n\n        Sincerely,\n        Carolyn Jackson\n        83922 Dixon Centers Suite 433, South Timothy, IL 85222\n        "}
{"customer_name": "Jessica Gomez", "customer_address": "USNV Miller, FPO AP 53524", "customer_email": "dbaldwin@hotmail.com", "policy_number": "XY-770007462", "phone_number": "698-096-6387", "accident_date": "2024-01-03", "accident_time": "2:15 PM", "accident_location": "intersection of Oak St and Cedar Dr", "description": "\n        Dear Parasol Insurance,\n\n        My name is Jessica Gomez, and I am writing to file a claim for a recent car accident that occurred on 2024-01-03, \n        at approximately 2:15 PM. My policy number is XY-770007462.\n\n        The accident took place at the intersection of Oak St and Cedar Dr. I was driving my vehicle, a white Toyota Altima with license plate \n        number 171VZN. At the same time, another vehicle, a green Audi Focus with license plate number XNC5454, \n        collided with my car. The driver, Maurice Tate, failed to adhere to traffic rules, resulting in damage to both vehicles.\n\n        I promptly exchanged information with the other driver and took photos of the accident scene, including damages to both vehicles.\n        Attached to this email are the photos, a copy of the police report, and the estimate for the repair costs.\n\n        Kindly assist in processing this claim and let me know the next steps. You can reach me at 698-096-6387 or dbaldwin@hotmail.com.\n\n        Thank you for your assistance.\n\n        Sincerely,\n        Jessica Gomez\n        USNV Miller, FPO AP 53524\n        "}
{"customer_name": "Wendy Medina", "customer_address": "334 Marc Plain Apt. 050, South William, NE 16774", "customer_email": "combssarah@gmail.com", "policy_number": "BC-420881377", "phone_number": "641.190.0313x8080", "accident_date": "2024-01-05", "accident_time": "10:00 AM", "accident_location": "intersection of Maple Rd and Main St", "description": "\n        Dear Parasol Insurance,\n\n        My name is Wendy Medina, and I am writing to file a claim for a recent car accident that occurred on 2024-01-05, \n        at approximately 10:00 AM. My policy number is BC-420881377.\n\n        The accident took place at the intersection of Maple Rd and Main St. I was driving my vehicle, a gold Toyota 3 Series with license plate \n        number 7DR 399. At the same time, another vehicle, a green Nissan 3 Series with license plate number Y44 3SV, \n        collided with my car. The driver, Natasha Jennings, failed to adhere to traffic rules, resulting in damage to both vehicles.\n\n        I promptly exchanged information with the other driver and took photos of the accident scene, including damages to both vehicles.\n        Attached to this email are the photos, a copy of the police report, and the estimate for the repair costs.\n\n        Kindly assist in processing this claim and let me know the next steps. You can reach me at 641.190.0313x8080 or combssarah@gmail.com.\n\n        Thank you for your assistance.\n\n        Sincerely,\n        Wendy Medina\n        334 Marc Plain Apt. 050, South William, NE 16774\n        "}
{"customer_name": "Sarah Stafford", "customer_address": "Unit 1678 Box 9980, DPO AE 88803", "customer_email": "dunnsusan@hotmail.com", "policy_number": "AC-215634890", "phone_number": "635.088.3564", "accident_date": "2024-01-07", "accident_time": "11:45 AM", "accident_location": "intersection of Maple Rd and Elm Ln", "description": "\n        Dear Parasol Insurance,\n\n        My name is Sarah Stafford, and I am writing to file a claim for a recent car accident that occurred on 2024-01-07, \n        at approximately 11:45 AM. My policy number is AC-215634890.\n\n        The accident took place at the intersection of Maple Rd and Elm Ln. I was driving my vehicle, a red Audi Civic with license plate \n        number 632SAO. At the same time, another vehicle, a red BMW C-Class with license plate number 9779, \n        collided with my car. The driver, Andrew Roth, failed to adhere to traffic rules, resulting in damage to both vehicles.\n\n        I promptly exchanged information with the other driver and took photos of the accident scene, including damages to both vehicles.\n        Attached to this email are the photos, a copy of the police report, and the estimate for the repair costs.\n\n        Kindly assist in processing this claim and let me know the next steps. You can reach me at 635.088.3564 or dunnsusan@hotmail.com.\n\n        Thank you for your assistance.\n\n        Sincerely,\n        Sarah Stafford\n        Unit 1678 Box 9980, DPO AE 88803\n        "}
{"customer_name": "Danielle Douglas", "customer_address": "30706 Townsend Keys, West Davidside, OH 29572", "customer_email": "davidmclean@yahoo.com", "policy_number": "MN-639525949", "phone_number": "(439)543-3010x95742", "accident_date": "2024-01-02", "accident_time": "11:45 AM", "accident_location": "intersection of Willow Ave and Oak St", "description": "\n        Dear Parasol Insurance,\n\n        My name is Danielle Douglas, and I am writing to file a claim for a recent car accident that occurred on 2024-01-02, \n        at approximately 11:45 AM. My policy number is MN-639525949.\n\n        The accident took place at the intersection of Willow Ave and Oak St. I was driving my vehicle, a gold Ford Traverse with license plate \n        number 883 HWQ. At the same time, another vehicle, a gray Hyundai Civic with license plate number 33BZ7, \n        collided with my car. The driver, Natalie Davis, failed to adhere to traffic rules, resulting in damage to both vehicles.\n\n        I promptly exchanged information with the other driver and took photos of the accident scene, including damages to both vehicles.\n        Attached to this email are the photos, a copy of the police report, and the estimate for the repair costs.\n\n        Kindly assist in processing this claim and let me know the next steps. You can reach me at (439)543-3010x95742 or davidmclean@yahoo.com.\n\n        Thank you for your assistance.\n\n        Sincerely,\n        Danielle Douglas\n        30706 Townsend Keys, West Davidside, OH 29572\n        "}
{"customer_name": "Michael Austin", "customer_address": "PSC 9696, Box 0672, APO AP 43878", "customer_email": "blake64@gmail.com", "policy_number": "YZ-290578726", "phone_number": "(180)582-5607x99054", "accident_date": "2024-01-05", "accident_time": "11:45 AM", "accident_location": "intersection of Birch St and Elm Ln", "description": "\n        Dear Parasol Insurance,\n\n        My name is Michael Austin, and I am writing to file a claim for a recent car accident that occurred on 2024-01-05, \n        at approximately 11:45 AM. My policy number is YZ-290578726.\n\n        The accident took place at the intersection of Birch St and Elm Ln. I was driving my vehicle, a red Hyundai Camry with license plate \n        number 38-8417I. At the same time, another vehicle, a black Nissan Elantra with license plate number 1MTJ680, \n        collided with my car. The driver, Charles Armstrong, failed to adhere to traffic rules, resulting in damage to both vehicles.\n\n        I promptly exchanged information with the other driver and took photos of the accident scene, including damages to both vehicles.\n        Attached to this email are the photos, a copy of the police report, and the estimate for the repair costs.\n\n        Kindly assist in processing this claim and let me know the next steps. You can reach me at (180)582-5607x99054 or blake64@gmail.com.\n\n        Thank you for your assistance.\n\n        Sincerely,\n        Michael Austin\n        PSC 9696, Box 0672, APO AP 43878\n        "}
{"customer_name": "Pamela Robinson", "customer_address": "563 Fields Lodge Suite 159, Rebeccaport, DE 09893", "customer_email": "jayjones@gmail.com", "policy_number": "MN-786515331", "phone_number": "(078)689-7040x678", "accident_date": "2024-01-02", "accident_time": "12:00 PM", "accident_location": "intersection of Willow Ave and Elm Ln", "description": "\n        Dear Parasol Insurance,\n\n        My name is Pamela Robinson, and I am writing to file a claim for a recent car accident that occurred on 2024-01-02, \n        at approximately 12:00 PM. My policy number is MN-786515331.\n\n        The accident took place at the intersection of Willow Ave and Elm Ln. I was driving my vehicle, a green Kia Sorento with license plate \n        number UXI 630. At the same time, another vehicle, a yellow Honda Focus with license plate number 6XZH511, \n        collided with my car. The driver, Carla Bailey, failed to adhere to traffic rules, resulting in damage to both vehicles.\n\n        I promptly exchanged information with the other driver and took photos of the accident scene, including damages to both vehicles.\n        Attached to this email are the photos, a copy of the police report, and the estimate for the repair costs.\n\n        Kindly assist in processing this claim and let me know the next steps. You can reach me at (078)689-7040x678 or jayjones@gmail.com.\n\n        Thank you for your assistance.\n\n        Sincerely,\n        Pamela Robinson\n        563 Fields Lodge Suite 159, Rebeccaport, DE 09893\n        "}
{"customer_name": "Dennis Barnes", "customer_address": "22279 Brown Harbors Apt. 945, New William, NV 98184", "customer_email": "kelly10@hotmail.com", "policy_number": "BC-246197773", "phone_number": "(715)630-4020x76329", "accident_date": "2024-01-03", "accident_time": "5:15 PM", "accident_location": "intersection of Maple Rd and Willow Ave", "description": "\n        Dear Parasol Insurance,\n\n        My name is Dennis Barnes, and I am writing to file a claim for a recent car accident that occurred on 2024-01-03, \n        at approximately 5:15 PM. My policy number is BC-246197773.\n\n        The accident took place at the intersection of Maple Rd and Willow Ave. I was driving my vehicle, a black Kia Camry with license plate \n        number 745 6WG. At the same time, another vehicle, a maroon Honda Civic with license plate number 3K626, \n        collided with my car. The driver, Joseph Miller, failed to adhere to traffic rules, resulting in damage to both vehicles.\n\n        I promptly exchanged information with the other driver and took photos of the accident scene, including damages to both vehicles.\n        Attached to this email are the photos, a copy of the police report, and the estimate for the repair costs.\n\n        Kindly assist in processing this claim and let me know the next steps. You can reach me at (715)630-4020x76329 or kelly10@hotmail.com.\n\n        Thank you for your assistance.\n\n        Sincerely,\n        Dennis Barnes\n        22279 Brown Harbors Apt. 945, New William, NV 98184\n        "}
{"customer_name": "Anna Miller", "customer_address": "4609 Williams Alley Apt. 216, South Kellymouth, AL 03858", "customer_email": "keith92@gmail.com", "policy_number": "AC-357458259", "phone_number": "0508077325", "accident_date": "2024-01-05", "accident_time": "11:45 AM", "accident_location": "intersection of Spruce Ct and Main St", "description": "\n        Dear Parasol Insurance,\n\n        My name is Anna Miller, and I am writing to file a claim for a recent car accident that occurred on 2024-01-05, \n        at approximately 11:45 AM. My policy number is AC-357458259.\n\n        The accident took place at the intersection of Spruce Ct and Main St. I was driving my vehicle, a silver Toyota Focus with license plate \n        number 700 MXG. At the same time, another vehicle, a blue Chevrolet Camry with license plate number HLJ-0841, \n        collided with my car. The driver, Karen Morgan, failed to adhere to traffic rules, resulting in damage to both vehicles.\n\n        I promptly exchanged information with the other driver and took photos of the accident scene, including damages to both vehicles.\n        Attached to this email are the photos, a copy of the police report, and the estimate for the repair costs.\n\n        Kindly assist in processing this claim and let me know the next steps. You can reach me at 0508077325 or keith92@gmail.com.\n\n        Thank you for your assistance.\n\n        Sincerely,\n        Anna Miller\n        4609 Williams Alley Apt. 216, South Kellymouth, AL 03858\n        "}
{"customer_name": "Deborah Bowman", "customer_address": "331 Michael Garden Apt. 335, Lauraton, WI 50398", "customer_email": "toddkramer@yahoo.com", "policy_number": "BC-110199309", "phone_number": "(284)210-6271x850", "accident_date": "2024-01-06", "accident_time": "6:30 PM", "accident_location": "intersection of Elm Ln and Willow Ave", "description": "\n        Dear Parasol Insurance,\n\n        My name is Deborah Bowman, and I am writing to file a claim for a recent car accident that occurred on 2024-01-06, \n        at approximately 6:30 PM. My policy number is BC-110199309.\n\n        The accident took place at the intersection of Elm Ln and Willow Ave. I was driving my vehicle, a gray Chevrolet A4 with license plate \n        number 883 ARZ. At the same time, another vehicle, a gold Nissan Sorento with license plate number 1W 2Z9OUR, \n        collided with my car. The driver, John Mcmillan, failed to adhere to traffic rules, resulting in damage to both vehicles.\n\n        I promptly exchanged information with the other driver and took photos of the accident scene, including damages to both vehicles.\n        Attached to this email are the photos, a copy of the police report, and the estimate for the repair costs.\n\n        Kindly assist in processing this claim and let me know the next steps. You can reach me at (284)210-6271x850 or toddkramer@yahoo.com.\n\n        Thank you for your assistance.\n\n        Sincerely,\n        Deborah Bowman\n        331 Michael Garden Apt. 335, Lauraton, WI 50398\n        "}
{"customer_name": "Angel Stevenson", "customer_address": "PSC 8767, Box 6603, APO AP 34045", "customer_email": "grahamwanda@gmail.com", "policy_number": "BC-821364686", "phone_number": "+1-602-935-2049x03608", "accident_date": "2024-01-02", "accident_time": "1:45 PM", "accident_location": "intersection of Cedar Dr and Cedar Dr", "description": "\n        Dear Parasol Insurance,\n\n        My name is Angel Stevenson, and I am writing to file a claim for a recent car accident that occurred on 2024-01-02, \n        at approximately 1:45 PM. My policy number is BC-821364686.\n\n        The accident took place at the intersection of Cedar Dr and Cedar Dr. I was driving my vehicle, a white Toyota Camry with license plate \n        number YUF-549. At the same time, another vehicle, a green Hyundai C-Class with license plate number BQO-140, \n        collided with my car. The driver, Robert Rivera, failed to adhere to traffic rules, resulting in damage to both vehicles.\n\n        I promptly exchanged information with the other driver and took photos of the accident scene, including damages to both vehicles.\n        Attached to this email are the photos, a copy of the police report, and the estimate for the repair costs.\n\n        Kindly assist in processing this claim and let me know the next steps. You can reach me at +1-602-935-2049x03608 or grahamwanda@gmail.com.\n\n        Thank you for your assistance.\n\n        Sincerely,\n        Angel Stevenson\n        PSC 8767, Box 6603, APO AP 34045\n        "}
{"customer_name": "Jill Rodriguez", "customer_address": "1557 Miranda Parkway Suite 056, New Calvinhaven, IN 19547", "customer_email": "sharon02@gmail.com", "policy_number": "BC-590714306", "phone_number": "888-017-5120x4262", "accident_date": "2024-01-02", "accident_time": "11:45 AM", "accident_location": "intersection of Birch St and Main St", "description": "\n        Dear Parasol Insurance,\n\n        My name is Jill Rodriguez, and I am writing to file a claim for a recent car accident that occurred on 2024-01-02, \n        at approximately 11:45 AM. My policy number is BC-590714306.\n\n        The accident took place at the intersection of Birch St and Main St. I was driving my vehicle, a maroon Nissan Elantra with license plate \n        number 0ZJ 781. At the same time, another vehicle, a blue Kia A4 with license plate number YVP-4719, \n        collided with my car. The driver, Michelle Reilly, failed to adhere to traffic rules, resulting in damage to both vehicles.\n\n        I promptly exchanged information with the other driver and took photos of the accident scene, including damages to both vehicles.\n        Attached to this email are the photos, a copy of the police report, and the estimate for the repair costs.\n\n        Kindly assist in processing this claim and let me know the next steps. You can reach me at 888-017-5120x4262 or sharon02@gmail.com.\n\n        Thank you for your assistance.\n\n        Sincerely,\n        Jill Rodriguez\n        1557 Miranda Parkway Suite 056, New Calvinhaven, IN 19547\n        "}
{"customer_name": "Ashley Williams", "customer_address": "5315 Jason Course, North Carlachester, NH 80896", "customer_email": "hrodriguez@gmail.com", "policy_number": "XY-266394153", "phone_number": "(284)210-3760", "accident_date": "2024-01-04", "accident_time": "5:15 PM", "accident_location": "intersection of Cedar Dr and Oak St", "description": "\n        Dear Parasol Insurance,\n\n        My name is Ashley Williams, and I am writing to file a claim for a recent car accident that occurred on 2024-01-04, \n        at approximately 5:15 PM. My policy number is XY-266394153.\n\n        The accident took place at the intersection of Cedar Dr and Oak St. I was driving my vehicle, a blue Toyota Altima with license plate \n        number 374 BYH. At the same time, another vehicle, a gray Chevrolet Sorento with license plate number 1X572, \n        collided with my car. The driver, Teresa Fowler, failed to adhere to traffic rules, resulting in damage to both vehicles.\n\n        I promptly exchanged information with the other driver and took photos of the accident scene, including damages to both vehicles.\n        Attached to this email are the photos, a copy of the police report, and the estimate for the repair costs.\n\n        Kindly assist in processing this claim and let me know the next steps. You can reach me at (284)210-3760 or hrodriguez@gmail.com.\n\n        Thank you for your assistance.\n\n        Sincerely,\n        Ashley Williams\n        5315 Jason Course, North Carlachester, NH 80896\n        "}
{"customer_name": "Christopher Nichols", "customer_address": "677 Julie Ferry Apt. 009, Craigmouth, SC 75460", "customer_email": "tannerdeleon@yahoo.com", "policy_number": "BC-666739444", "phone_number": "+1-859-823-8821x151", "accident_date": "2024-01-07", "accident_time": "12:00 PM", "accident_location": "intersection of Pine Blvd and Cedar Dr", "description": "\n        Dear Parasol Insurance,\n\n        My name is Christopher Nichols, and I am writing to file a claim for a recent car accident that occurred on 2024-01-07, \n        at approximately 12:00 PM. My policy number is BC-666739444.\n\n        The accident took place at the intersection of Pine Blvd and Cedar Dr. I was driving my vehicle, a red Hyundai C-Class with license plate \n        number RMV 323. At the same time, another vehicle, a green Audi A4 with license plate number 9LP 404, \n        collided with my car. The driver, John Ford, failed to adhere to traffic rules, resulting in damage to both vehicles.\n\n        I promptly exchanged information with the other driver and took photos of the accident scene, including damages to both vehicles.\n        Attached to this email are the photos, a copy of the police report, and the estimate for the repair costs.\n\n        Kindly assist in processing this claim and let me know the next steps. You can reach me at +1-859-823-8821x151 or tannerdeleon@yahoo.com.\n\n        Thank you for your assistance.\n\n        Sincerely,\n        Christopher Nichols\n        677 Julie Ferry Apt. 009, Craigmouth, SC 75460\n        "}
{"customer_name": "Rita Navarro MD", "customer_address": "96488 Michael Views Suite 731, Port Ryan, MT 05043", "customer_email": "wbuck@gmail.com", "policy_number": "LK-593260351", "phone_number": "871-063-1671", "accident_date": "2024-01-05", "accident_time": "12:00 PM", "accident_location": "intersection of Oak St and Willow Ave", "description": "\n        Dear Parasol Insurance,\n\n        My name is Rita Navarro MD, and I am writing to file a claim for a recent car accident that occurred on 2024-01-05, \n        at approximately 12:00 PM. My policy number is LK-593260351.\n\n        The accident took place at the intersection of Oak St and Willow Ave. I was driving my vehicle, a gold BMW Focus with license plate \n        number V96-94C. At the same time, another vehicle, a red Nissan A4 with license plate number NUX-9835, \n        collided with my car. The driver, Derrick Edwards, failed to adhere to traffic rules, resulting in damage to both vehicles.\n\n        I promptly exchanged information with the other driver and took photos of the accident scene, including damages to both vehicles.\n        Attached to this email are the photos, a copy of the police report, and the estimate for the repair costs.\n\n        Kindly assist in processing this claim and let me know the next steps. You can reach me at 871-063-1671 or wbuck@gmail.com.\n\n        Thank you for your assistance.\n\n        Sincerely,\n        Rita Navarro MD\n        96488 Michael Views Suite 731, Port Ryan, MT 05043\n        "}
{"customer_name": "Ronald Watkins", "customer_address": "587 Melanie Stravenue Suite 744, New Caitlinhaven, AR 71889", "customer_email": "rebeccarasmussen@gordon-holland.com", "policy_number": "XY-877826644", "phone_number": "+1-352-518-6660x9837", "accident_date": "2024-01-05", "accident_time": "11:45 AM", "accident_location": "intersection of Cedar Dr and Elm Ln", "description": "\n        Dear Parasol Insurance,\n\n        My name is Ronald Watkins, and I am writing to file a claim for a recent car accident that occurred on 2024-01-05, \n        at approximately 11:45 AM. My policy number is XY-877826644.\n\n        The accident took place at the intersection of Cedar Dr and Elm Ln. I was driving my vehicle, a green Mercedes-Benz Sorento with license plate \n        number 788-DTE. At the same time, another vehicle, a yellow Ford Traverse with license plate number DX1 W8N, \n        collided with my car. The driver, Gary Hughes, failed to adhere to traffic rules, resulting in damage to both vehicles.\n\n        I promptly exchanged information with the other driver and took photos of the accident scene, including damages to both vehicles.\n        Attached to this email are the photos, a copy of the police report, and the estimate for the repair costs.\n\n        Kindly assist in processing this claim and let me know the next steps. You can reach me at +1-352-518-6660x9837 or rebeccarasmussen@gordon-holland.com.\n\n        Thank you for your assistance.\n\n        Sincerely,\n        Ronald Watkins\n        587 Melanie Stravenue Suite 744, New Caitlinhaven, AR 71889\n        "}
{"customer_name": "Laura Carson", "customer_address": "USS Mills, FPO AA 19891", "customer_email": "howard94@yahoo.com", "policy_number": "MN-772776199", "phone_number": "+1-215-569-7117x79066", "accident_date": "2024-01-07", "accident_time": "4:00 PM", "accident_location": "intersection of Maple Rd and Maple Rd", "description": "\n        Dear Parasol Insurance,\n\n        My name is Laura Carson, and I am writing to file a claim for a recent car accident that occurred on 2024-01-07, \n        at approximately 4:00 PM. My policy number is MN-772776199.\n\n        The accident took place at the intersection of Maple Rd and Maple Rd. I was driving my vehicle, a gray Audi Altima with license plate \n        number UKC-3451. At the same time, another vehicle, a yellow Toyota Civic with license plate number 42H V80, \n        collided with my car. The driver, Anthony Perry, failed to adhere to traffic rules, resulting in damage to both vehicles.\n\n        I promptly exchanged information with the other driver and took photos of the accident scene, including damages to both vehicles.\n        Attached to this email are the photos, a copy of the police report, and the estimate for the repair costs.\n\n        Kindly assist in processing this claim and let me know the next steps. You can reach me at +1-215-569-7117x79066 or howard94@yahoo.com.\n\n        Thank you for your assistance.\n\n        Sincerely,\n        Laura Carson\n        USS Mills, FPO AA 19891\n        "}
{"customer_name": "Michael Cannon", "customer_address": "99147 George Locks, Rebeccahaven, CA 39564", "customer_email": "kaylameza@gmail.com", "policy_number": "BC-732180453", "phone_number": "350.251.2155x179", "accident_date": "2024-01-03", "accident_time": "5:15 PM", "accident_location": "intersection of Spruce Ct and Oak St", "description": "\n        Dear Parasol Insurance,\n\n        My name is Michael Cannon, and I am writing to file a claim for a recent car accident that occurred on 2024-01-03, \n        at approximately 5:15 PM. My policy number is BC-732180453.\n\n        The accident took place at the intersection of Spruce Ct and Oak St. I was driving my vehicle, a red Kia Camry with license plate \n        number 6N 7L0LPU. At the same time, another vehicle, a silver Toyota Elantra with license plate number GGL 687, \n        collided with my car. The driver, Randall Jones, failed to adhere to traffic rules, resulting in damage to both vehicles.\n\n        I promptly exchanged information with the other driver and took photos of the accident scene, including damages to both vehicles.\n        Attached to this email are the photos, a copy of the police report, and the estimate for the repair costs.\n\n        Kindly assist in processing this claim and let me know the next steps. You can reach me at 350.251.2155x179 or kaylameza@gmail.com.\n\n        Thank you for your assistance.\n\n        Sincerely,\n        Michael Cannon\n        99147 George Locks, Rebeccahaven, CA 39564\n        "}
{"customer_name": "Robert Melton", "customer_address": "964 Larry Common, New Jason, ME 82461", "customer_email": "elaine91@poole.com", "policy_number": "BC-347797197", "phone_number": "(211)564-7652x5068", "accident_date": "2024-01-02", "accident_time": "12:00 PM", "accident_location": "intersection of Birch St and Main St", "description": "\n        Dear Parasol Insurance,\n\n        My name is Robert Melton, and I am writing to file a claim for a recent car accident that occurred on 2024-01-02, \n        at approximately 12:00 PM. My policy number is BC-347797197.\n\n        The accident took place at the intersection of Birch St and Main St. I was driving my vehicle, a white Hyundai Elantra with license plate \n        number 3831. At the same time, another vehicle, a white Nissan Civic with license plate number 199 QPH, \n        collided with my car. The driver, Bobby Perkins, failed to adhere to traffic rules, resulting in damage to both vehicles.\n\n        I promptly exchanged information with the other driver and took photos of the accident scene, including damages to both vehicles.\n        Attached to this email are the photos, a copy of the police report, and the estimate for the repair costs.\n\n        Kindly assist in processing this claim and let me know the next steps. You can reach me at (211)564-7652x5068 or elaine91@poole.com.\n\n        Thank you for your assistance.\n\n        Sincerely,\n        Robert Melton\n        964 Larry Common, New Jason, ME 82461\n        "}
{"customer_name": "Tina Serrano", "customer_address": "716 Byrd Lights, Youngport, IA 45769", "customer_email": "wnichols@king.com", "policy_number": "XY-789752615", "phone_number": "422-346-9787", "accident_date": "2024-01-05", "accident_time": "3:30 PM", "accident_location": "intersection of Willow Ave and Oak St", "description": "\n        Dear Parasol Insurance,\n\n        My name is Tina Serrano, and I am writing to file a claim for a recent car accident that occurred on 2024-01-05, \n        at approximately 3:30 PM. My policy number is XY-789752615.\n\n        The accident took place at the intersection of Willow Ave and Oak St. I was driving my vehicle, a white Nissan 3 Series with license plate \n        number 25D 2435. At the same time, another vehicle, a silver Kia Altima with license plate number 584 EXX, \n        collided with my car. The driver, John Gonzalez, failed to adhere to traffic rules, resulting in damage to both vehicles.\n\n        I promptly exchanged information with the other driver and took photos of the accident scene, including damages to both vehicles.\n        Attached to this email are the photos, a copy of the police report, and the estimate for the repair costs.\n\n        Kindly assist in processing this claim and let me know the next steps. You can reach me at 422-346-9787 or wnichols@king.com.\n\n        Thank you for your assistance.\n\n        Sincerely,\n        Tina Serrano\n        716 Byrd Lights, Youngport, IA 45769\n        "}
{"customer_name": "Barbara Nelson", "customer_address": "802 Terri Grove Suite 102, North Benjaminfurt, FL 64212", "customer_email": "ymedina@yahoo.com", "policy_number": "YZ-162582093", "phone_number": "341-132-9154", "accident_date": "2024-01-03", "accident_time": "10:00 AM", "accident_location": "intersection of Elm Ln and Birch St", "description": "\n        Dear Parasol Insurance,\n\n        My name is Barbara Nelson, and I am writing to file a claim for a recent car accident that occurred on 2024-01-03, \n        at approximately 10:00 AM. My policy number is YZ-162582093.\n\n        The accident took place at the intersection of Elm Ln and Birch St. I was driving my vehicle, a green Honda A4 with license plate \n        number 812-WOR. At the same time, another vehicle, a silver Nissan Camry with license plate number 2X 43896, \n        collided with my car. The driver, Alexander Dennis, failed to adhere to traffic rules, resulting in damage to both vehicles.\n\n        I promptly exchanged information with the other driver and took photos of the accident scene, including damages to both vehicles.\n        Attached to this email are the photos, a copy of the police report, and the estimate for the repair costs.\n\n        Kindly assist in processing this claim and let me know the next steps. You can reach me at 341-132-9154 or ymedina@yahoo.com.\n\n        Thank you for your assistance.\n\n        Sincerely,\n        Barbara Nelson\n        802 Terri Grove Suite 102, North Benjaminfurt, FL 64212\n        "}
{"customer_name": "Kimberly Hayden", "customer_address": "1284 Courtney Flat, Nancyborough, NJ 83953", "customer_email": "fporter@hart-french.com", "policy_number": "BC-607767656", "phone_number": "441.285.9885x9255", "accident_date": "2024-01-03", "accident_time": "1:45 PM", "accident_location": "intersection of Birch St and Willow Ave", "description": "\n        Dear Parasol Insurance,\n\n        My name is Kimberly Hayden, and I am writing to file a claim for a recent car accident that occurred on 2024-01-03, \n        at approximately 1:45 PM. My policy number is BC-607767656.\n\n        The accident took place at the intersection of Birch St and Willow Ave. I was driving my vehicle, a black Audi 3 Series with license plate \n        number 21SD6. At the same time, another vehicle, a white Kia 3 Series with license plate number GP7 U1N, \n        collided with my car. The driver, Nathan Martin, failed to adhere to traffic rules, resulting in damage to both vehicles.\n\n        I promptly exchanged information with the other driver and took photos of the accident scene, including damages to both vehicles.\n        Attached to this email are the photos, a copy of the police report, and the estimate for the repair costs.\n\n        Kindly assist in processing this claim and let me know the next steps. You can reach me at 441.285.9885x9255 or fporter@hart-french.com.\n\n        Thank you for your assistance.\n\n        Sincerely,\n        Kimberly Hayden\n        1284 Courtney Flat, Nancyborough, NJ 83953\n        "}
{"customer_name": "Emily Crawford", "customer_address": "5173 Jones Manor Apt. 693, Paulville, HI 14002", "customer_email": "corypayne@garcia.com", "policy_number": "YZ-941964228", "phone_number": "200.204.6602x285", "accident_date": "2024-01-05", "accident_time": "4:00 PM", "accident_location": "intersection of Maple Rd and Elm Ln", "description": "\n        Dear Parasol Insurance,\n\n        My name is Emily Crawford, and I am writing to file a claim for a recent car accident that occurred on 2024-01-05, \n        at approximately 4:00 PM. My policy number is YZ-941964228.\n\n        The accident took place at the intersection of Maple Rd and Elm Ln. I was driving my vehicle, a red Audi Camry with license plate \n        number 46C CU8. At the same time, another vehicle, a gold Hyundai Elantra with license plate number 2OA0943, \n        collided with my car. The driver, Randy Franklin, failed to adhere to traffic rules, resulting in damage to both vehicles.\n\n        I promptly exchanged information with the other driver and took photos of the accident scene, including damages to both vehicles.\n        Attached to this email are the photos, a copy of the police report, and the estimate for the repair costs.\n\n        Kindly assist in processing this claim and let me know the next steps. You can reach me at 200.204.6602x285 or corypayne@garcia.com.\n\n        Thank you for your assistance.\n\n        Sincerely,\n        Emily Crawford\n        5173 Jones Manor Apt. 693, Paulville, HI 14002\n        "}
{"customer_name": "Kimberly Gonzalez", "customer_address": "1088 Good Lane, Cantuport, WA 46891", "customer_email": "deborahvega@yahoo.com", "policy_number": "YZ-120830061", "phone_number": "+1-640-626-5995x053", "accident_date": "2024-01-04", "accident_time": "12:00 PM", "accident_location": "intersection of Main St and Oak St", "description": "\n        Dear Parasol Insurance,\n\n        My name is Kimberly Gonzalez, and I am writing to file a claim for a recent car accident that occurred on 2024-01-04, \n        at approximately 12:00 PM. My policy number is YZ-120830061.\n\n        The accident took place at the intersection of Main St and Oak St. I was driving my vehicle, a white Mercedes-Benz 3 Series with license plate \n        number YKK 570. At the same time, another vehicle, a blue Honda Focus with license plate number ROI 582, \n        collided with my car. The driver, Angela King, failed to adhere to traffic rules, resulting in damage to both vehicles.\n\n        I promptly exchanged information with the other driver and took photos of the accident scene, including damages to both vehicles.\n        Attached to this email are the photos, a copy of the police report, and the estimate for the repair costs.\n\n        Kindly assist in processing this claim and let me know the next steps. You can reach me at +1-640-626-5995x053 or deborahvega@yahoo.com.\n\n        Thank you for your assistance.\n\n        Sincerely,\n        Kimberly Gonzalez\n        1088 Good Lane, Cantuport, WA 46891\n        "}
{"customer_name": "Angel Raymond", "customer_address": "09092 Craig Route, North Hannah, WI 41877", "customer_email": "kelly61@nicholson.biz", "policy_number": "BC-990456621", "phone_number": "407.298.9469x4729", "accident_date": "2024-01-05", "accident_time": "1:45 PM", "accident_location": "intersection of Cedar Dr and Maple Rd", "description": "\n        Dear Parasol Insurance,\n\n        My name is Angel Raymond, and I am writing to file a claim for a recent car accident that occurred on 2024-01-05, \n        at approximately 1:45 PM. My policy number is BC-990456621.\n\n        The accident took place at the intersection of Cedar Dr and Maple Rd. I was driving my vehicle, a red Honda C-Class with license plate \n        number JQO2892. At the same time, another vehicle, a blue Ford Altima with license plate number 059 NT9, \n        collided with my car. The driver, Melanie Drake, failed to adhere to traffic rules, resulting in damage to both vehicles.\n\n        I promptly exchanged information with the other driver and took photos of the accident scene, including damages to both vehicles.\n        Attached to this email are the photos, a copy of the police report, and the estimate for the repair costs.\n\n        Kindly assist in processing this claim and let me know the next steps. You can reach me at 407.298.9469x4729 or kelly61@nicholson.biz.\n\n        Thank you for your assistance.\n\n        Sincerely,\n        Angel Raymond\n        09092 Craig Route, North Hannah, WI 41877\n        "}
{"customer_name": "Christopher Ford", "customer_address": "6113 Craig Spring, North Sophiamouth, TX 96090", "customer_email": "davidmorris@hotmail.com", "policy_number": "MN-828467783", "phone_number": "7165282308", "accident_date": "2024-01-04", "accident_time": "4:00 PM", "accident_location": "intersection of Pine Blvd and Main St", "description": "\n        Dear Parasol Insurance,\n\n        My name is Christopher Ford, and I am writing to file a claim for a recent car accident that occurred on 2024-01-04, \n        at approximately 4:00 PM. My policy number is MN-828467783.\n\n        The accident took place at the intersection of Pine Blvd and Main St. I was driving my vehicle, a white Honda 3 Series with license plate \n        number 886189. At the same time, another vehicle, a white Ford 3 Series with license plate number 070 RGU, \n        collided with my car. The driver, Dr. Robert Douglas, failed to adhere to traffic rules, resulting in damage to both vehicles.\n\n        I promptly exchanged information with the other driver and took photos of the accident scene, including damages to both vehicles.\n        Attached to this email are the photos, a copy of the police report, and the estimate for the repair costs.\n\n        Kindly assist in processing this claim and let me know the next steps. You can reach me at 7165282308 or davidmorris@hotmail.com.\n\n        Thank you for your assistance.\n\n        Sincerely,\n        Christopher Ford\n        6113 Craig Spring, North Sophiamouth, TX 96090\n        "}
{"customer_name": "Dustin Bonilla", "customer_address": "8332 Cynthia Groves, Edwardsside, LA 47636", "customer_email": "ashlee80@gmail.com", "policy_number": "BC-566297087", "phone_number": "001-481-384-5822x11688", "accident_date": "2024-01-04", "accident_time": "10:00 AM", "accident_location": "intersection of Willow Ave and Oak St", "description": "\n        Dear Parasol Insurance,\n\n        My name is Dustin Bonilla, and I am writing to file a claim for a recent car accident that occurred on 2024-01-04, \n        at approximately 10:00 AM. My policy number is BC-566297087.\n\n        The accident took place at the intersection of Willow Ave and Oak St. I was driving my vehicle, a white Mercedes-Benz Civic with license plate \n        number KXY-6810. At the same time, another vehicle, a black Audi Altima with license plate number UGR0855, \n        collided with my car. The driver, Debbie Richards, failed to adhere to traffic rules, resulting in damage to both vehicles.\n\n        I promptly exchanged information with the other driver and took photos of the accident scene, including damages to both vehicles.\n        Attached to this email are the photos, a copy of the police report, and the estimate for the repair costs.\n\n        Kindly assist in processing this claim and let me know the next steps. You can reach me at 001-481-384-5822x11688 or ashlee80@gmail.com.\n\n        Thank you for your assistance.\n\n        Sincerely,\n        Dustin Bonilla\n        8332 Cynthia Groves, Edwardsside, LA 47636\n        "}
{"customer_name": "Dustin Phillips", "customer_address": "PSC 2965, Box 3893, APO AP 39903", "customer_email": "jeanjackson@mayer.info", "policy_number": "XY-865190266", "phone_number": "001-717-113-4902x4566", "accident_date": "2024-01-07", "accident_time": "11:45 AM", "accident_location": "intersection of Pine Blvd and Elm Ln", "description": "\n        Dear Parasol Insurance,\n\n        My name is Dustin Phillips, and I am writing to file a claim for a recent car accident that occurred on 2024-01-07, \n        at approximately 11:45 AM. My policy number is XY-865190266.\n\n        The accident took place at the intersection of Pine Blvd and Elm Ln. I was driving my vehicle, a blue Ford Altima with license plate \n        number 944-KKL. At the same time, another vehicle, a red Chevrolet Sorento with license plate number 8B 6U4VIE, \n        collided with my car. The driver, Krystal Tucker, failed to adhere to traffic rules, resulting in damage to both vehicles.\n\n        I promptly exchanged information with the other driver and took photos of the accident scene, including damages to both vehicles.\n        Attached to this email are the photos, a copy of the police report, and the estimate for the repair costs.\n\n        Kindly assist in processing this claim and let me know the next steps. You can reach me at 001-717-113-4902x4566 or jeanjackson@mayer.info.\n\n        Thank you for your assistance.\n\n        Sincerely,\n        Dustin Phillips\n        PSC 2965, Box 3893, APO AP 39903\n        "}
{"customer_name": "Samuel Lopez", "customer_address": "6889 Phillips Club Apt. 093, Timothyhaven, ND 07911", "customer_email": "hriddle@gmail.com", "policy_number": "YZ-111416106", "phone_number": "001-027-876-0532", "accident_date": "2024-01-07", "accident_time": "4:00 PM", "accident_location": "intersection of Birch St and Maple Rd", "description": "\n        Dear Parasol Insurance,\n\n        My name is Samuel Lopez, and I am writing to file a claim for a recent car accident that occurred on 2024-01-07, \n        at approximately 4:00 PM. My policy number is YZ-111416106.\n\n        The accident took place at the intersection of Birch St and Maple Rd. I was driving my vehicle, a black Nissan Elantra with license plate \n        number JRD 146. At the same time, another vehicle, a gold Chevrolet Civic with license plate number HBW-633, \n        collided with my car. The driver, Michelle Sanders, failed to adhere to traffic rules, resulting in damage to both vehicles.\n\n        I promptly exchanged information with the other driver and took photos of the accident scene, including damages to both vehicles.\n        Attached to this email are the photos, a copy of the police report, and the estimate for the repair costs.\n\n        Kindly assist in processing this claim and let me know the next steps. You can reach me at 001-027-876-0532 or hriddle@gmail.com.\n\n        Thank you for your assistance.\n\n        Sincerely,\n        Samuel Lopez\n        6889 Phillips Club Apt. 093, Timothyhaven, ND 07911\n        "}
{"customer_name": "Kimberly Brown", "customer_address": "6510 Frank Place, Christophermouth, WI 52372", "customer_email": "burnsrobert@yahoo.com", "policy_number": "MN-776696960", "phone_number": "001-041-373-6654x631", "accident_date": "2024-01-07", "accident_time": "12:00 PM", "accident_location": "intersection of Main St and Oak St", "description": "\n        Dear Parasol Insurance,\n\n        My name is Kimberly Brown, and I am writing to file a claim for a recent car accident that occurred on 2024-01-07, \n        at approximately 12:00 PM. My policy number is MN-776696960.\n\n        The accident took place at the intersection of Main St and Oak St. I was driving my vehicle, a gold Ford C-Class with license plate \n        number 39-2261Q. At the same time, another vehicle, a silver Nissan 3 Series with license plate number YRF 332, \n        collided with my car. The driver, Mariah Davis, failed to adhere to traffic rules, resulting in damage to both vehicles.\n\n        I promptly exchanged information with the other driver and took photos of the accident scene, including damages to both vehicles.\n        Attached to this email are the photos, a copy of the police report, and the estimate for the repair costs.\n\n        Kindly assist in processing this claim and let me know the next steps. You can reach me at 001-041-373-6654x631 or burnsrobert@yahoo.com.\n\n        Thank you for your assistance.\n\n        Sincerely,\n        Kimberly Brown\n        6510 Frank Place, Christophermouth, WI 52372\n        "}
{"customer_name": "Kathy Sparks", "customer_address": "122 Luis Loaf Apt. 915, West Neil, MT 57793", "customer_email": "martinezsarah@hotmail.com", "policy_number": "YZ-141551643", "phone_number": "(254)079-5091", "accident_date": "2024-01-04", "accident_time": "4:00 PM", "accident_location": "intersection of Willow Ave and Oak St", "description": "\n        Dear Parasol Insurance,\n\n        My name is Kathy Sparks, and I am writing to file a claim for a recent car accident that occurred on 2024-01-04, \n        at approximately 4:00 PM. My policy number is YZ-141551643.\n\n        The accident took place at the intersection of Willow Ave and Oak St. I was driving my vehicle, a yellow Toyota 3 Series with license plate \n        number 602 FD4. At the same time, another vehicle, a silver Toyota Camry with license plate number 52ME8, \n        collided with my car. The driver, Kristine Avery, failed to adhere to traffic rules, resulting in damage to both vehicles.\n\n        I promptly exchanged information with the other driver and took photos of the accident scene, including damages to both vehicles.\n        Attached to this email are the photos, a copy of the police report, and the estimate for the repair costs.\n\n        Kindly assist in processing this claim and let me know the next steps. You can reach me at (254)079-5091 or martinezsarah@hotmail.com.\n\n        Thank you for your assistance.\n\n        Sincerely,\n        Kathy Sparks\n        122 Luis Loaf Apt. 915, West Neil, MT 57793\n        "}
{"customer_name": "Debra Phillips", "customer_address": "2629 Jacob Village Suite 724, Valerieborough, WY 58777", "customer_email": "harrellallen@hotmail.com", "policy_number": "XY-967653881", "phone_number": "(530)625-7759x385", "accident_date": "2024-01-03", "accident_time": "3:30 PM", "accident_location": "intersection of Pine Blvd and Cedar Dr", "description": "\n        Dear Parasol Insurance,\n\n        My name is Debra Phillips, and I am writing to file a claim for a recent car accident that occurred on 2024-01-03, \n        at approximately 3:30 PM. My policy number is XY-967653881.\n\n        The accident took place at the intersection of Pine Blvd and Cedar Dr. I was driving my vehicle, a red Chevrolet Sorento with license plate \n        number 057 AAU. At the same time, another vehicle, a maroon Nissan Traverse with license plate number TF 1109, \n        collided with my car. The driver, Russell Carroll, failed to adhere to traffic rules, resulting in damage to both vehicles.\n\n        I promptly exchanged information with the other driver and took photos of the accident scene, including damages to both vehicles.\n        Attached to this email are the photos, a copy of the police report, and the estimate for the repair costs.\n\n        Kindly assist in processing this claim and let me know the next steps. You can reach me at (530)625-7759x385 or harrellallen@hotmail.com.\n\n        Thank you for your assistance.\n\n        Sincerely,\n        Debra Phillips\n        2629 Jacob Village Suite 724, Valerieborough, WY 58777\n        "}
{"customer_name": "Jason Morgan", "customer_address": "147 Drake Inlet Suite 787, Contrerasburgh, AL 07623", "customer_email": "jeffreybrown@lopez.com", "policy_number": "BC-526531976", "phone_number": "8054912435", "accident_date": "2024-01-07", "accident_time": "1:45 PM", "accident_location": "intersection of Oak St and Main St", "description": "\n        Dear Parasol Insurance,\n\n        My name is Jason Morgan, and I am writing to file a claim for a recent car accident that occurred on 2024-01-07, \n        at approximately 1:45 PM. My policy number is BC-526531976.\n\n        The accident took place at the intersection of Oak St and Main St. I was driving my vehicle, a blue Mercedes-Benz Traverse with license plate \n        number HDQ 474. At the same time, another vehicle, a black Mercedes-Benz Traverse with license plate number PAI 374, \n        collided with my car. The driver, Nancy Maldonado, failed to adhere to traffic rules, resulting in damage to both vehicles.\n\n        I promptly exchanged information with the other driver and took photos of the accident scene, including damages to both vehicles.\n        Attached to this email are the photos, a copy of the police report, and the estimate for the repair costs.\n\n        Kindly assist in processing this claim and let me know the next steps. You can reach me at 8054912435 or jeffreybrown@lopez.com.\n\n        Thank you for your assistance.\n\n        Sincerely,\n        Jason Morgan\n        147 Drake Inlet Suite 787, Contrerasburgh, AL 07623\n        "}
{"customer_name": "Jason Dean", "customer_address": "PSC 0242, Box 7955, APO AA 02320", "customer_email": "fordlaura@rivera.com", "policy_number": "BC-823537165", "phone_number": "001-329-534-6599x4390", "accident_date": "2024-01-04", "accident_time": "1:45 PM", "accident_location": "intersection of Cedar Dr and Elm Ln", "description": "\n        Dear Parasol Insurance,\n\n        My name is Jason Dean, and I am writing to file a claim for a recent car accident that occurred on 2024-01-04, \n        at approximately 1:45 PM. My policy number is BC-823537165.\n\n        The accident took place at the intersection of Cedar Dr and Elm Ln. I was driving my vehicle, a yellow Nissan Traverse with license plate \n        number LIM 609. At the same time, another vehicle, a yellow Hyundai Camry with license plate number 735 2097, \n        collided with my car. The driver, Brittney Douglas, failed to adhere to traffic rules, resulting in damage to both vehicles.\n\n        I promptly exchanged information with the other driver and took photos of the accident scene, including damages to both vehicles.\n        Attached to this email are the photos, a copy of the police report, and the estimate for the repair costs.\n\n        Kindly assist in processing this claim and let me know the next steps. You can reach me at 001-329-534-6599x4390 or fordlaura@rivera.com.\n\n        Thank you for your assistance.\n\n        Sincerely,\n        Jason Dean\n        PSC 0242, Box 7955, APO AA 02320\n        "}
{"customer_name": "Lucas Doyle", "customer_address": "01851 Joshua Island, Lake Jamie, LA 06744", "customer_email": "michelle27@hotmail.com", "policy_number": "XY-976821209", "phone_number": "(970)348-7226x5348", "accident_date": "2024-01-06", "accident_time": "11:45 AM", "accident_location": "intersection of Main St and Willow Ave", "description": "\n        Dear Parasol Insurance,\n\n        My name is Lucas Doyle, and I am writing to file a claim for a recent car accident that occurred on 2024-01-06, \n        at approximately 11:45 AM. My policy number is XY-976821209.\n\n        The accident took place at the intersection of Main St and Willow Ave. I was driving my vehicle, a green Mercedes-Benz C-Class with license plate \n        number 381 DOG. At the same time, another vehicle, a gold Hyundai Altima with license plate number QK 1991, \n        collided with my car. The driver, Joseph Anderson, failed to adhere to traffic rules, resulting in damage to both vehicles.\n\n        I promptly exchanged information with the other driver and took photos of the accident scene, including damages to both vehicles.\n        Attached to this email are the photos, a copy of the police report, and the estimate for the repair costs.\n\n        Kindly assist in processing this claim and let me know the next steps. You can reach me at (970)348-7226x5348 or michelle27@hotmail.com.\n\n        Thank you for your assistance.\n\n        Sincerely,\n        Lucas Doyle\n        01851 Joshua Island, Lake Jamie, LA 06744\n        "}
{"customer_name": "Laura Hardy", "customer_address": "02332 Hopkins Run, Martinezborough, MO 47982", "customer_email": "cdennis@garcia-holmes.com", "policy_number": "YZ-507287534", "phone_number": "434.621.2635x5108", "accident_date": "2024-01-06", "accident_time": "3:30 PM", "accident_location": "intersection of Maple Rd and Maple Rd", "description": "\n        Dear Parasol Insurance,\n\n        My name is Laura Hardy, and I am writing to file a claim for a recent car accident that occurred on 2024-01-06, \n        at approximately 3:30 PM. My policy number is YZ-507287534.\n\n        The accident took place at the intersection of Maple Rd and Maple Rd. I was driving my vehicle, a yellow Hyundai Sorento with license plate \n        number GQ4 N1W. At the same time, another vehicle, a white BMW Traverse with license plate number T85 8VQ, \n        collided with my car. The driver, Scott Williams, failed to adhere to traffic rules, resulting in damage to both vehicles.\n\n        I promptly exchanged information with the other driver and took photos of the accident scene, including damages to both vehicles.\n        Attached to this email are the photos, a copy of the police report, and the estimate for the repair costs.\n\n        Kindly assist in processing this claim and let me know the next steps. You can reach me at 434.621.2635x5108 or cdennis@garcia-holmes.com.\n\n        Thank you for your assistance.\n\n        Sincerely,\n        Laura Hardy\n        02332 Hopkins Run, Martinezborough, MO 47982\n        "}
{"customer_name": "Mario Austin", "customer_address": "Unit 7539 Box 7428, DPO AE 06578", "customer_email": "angel81@hotmail.com", "policy_number": "YZ-152135534", "phone_number": "316.161.7082x34758", "accident_date": "2024-01-04", "accident_time": "11:45 AM", "accident_location": "intersection of Maple Rd and Maple Rd", "description": "\n        Dear Parasol Insurance,\n\n        My name is Mario Austin, and I am writing to file a claim for a recent car accident that occurred on 2024-01-04, \n        at approximately 11:45 AM. My policy number is YZ-152135534.\n\n        The accident took place at the intersection of Maple Rd and Maple Rd. I was driving my vehicle, a gold Nissan Focus with license plate \n        number 662 YRI. At the same time, another vehicle, a gray Toyota C-Class with license plate number SHZ-228, \n        collided with my car. The driver, Monica Walker, failed to adhere to traffic rules, resulting in damage to both vehicles.\n\n        I promptly exchanged information with the other driver and took photos of the accident scene, including damages to both vehicles.\n        Attached to this email are the photos, a copy of the police report, and the estimate for the repair costs.\n\n        Kindly assist in processing this claim and let me know the next steps. You can reach me at 316.161.7082x34758 or angel81@hotmail.com.\n\n        Thank you for your assistance.\n\n        Sincerely,\n        Mario Austin\n        Unit 7539 Box 7428, DPO AE 06578\n        "}
{"customer_name": "Sharon Rowland", "customer_address": "0132 Jenna Stravenue, New Lisachester, NH 96269", "customer_email": "aheath@yahoo.com", "policy_number": "LK-582310281", "phone_number": "(210)952-7780x612", "accident_date": "2024-01-02", "accident_time": "6:30 PM", "accident_location": "intersection of Spruce Ct and Cedar Dr", "description": "\n        Dear Parasol Insurance,\n\n        My name is Sharon Rowland, and I am writing to file a claim for a recent car accident that occurred on 2024-01-02, \n        at approximately 6:30 PM. My policy number is LK-582310281.\n\n        The accident took place at the intersection of Spruce Ct and Cedar Dr. I was driving my vehicle, a gold Chevrolet 3 Series with license plate \n        number 0T II754. At the same time, another vehicle, a black Honda Sorento with license plate number IRC 705, \n        collided with my car. The driver, Andrew Alexander, failed to adhere to traffic rules, resulting in damage to both vehicles.\n\n        I promptly exchanged information with the other driver and took photos of the accident scene, including damages to both vehicles.\n        Attached to this email are the photos, a copy of the police report, and the estimate for the repair costs.\n\n        Kindly assist in processing this claim and let me know the next steps. You can reach me at (210)952-7780x612 or aheath@yahoo.com.\n\n        Thank you for your assistance.\n\n        Sincerely,\n        Sharon Rowland\n        0132 Jenna Stravenue, New Lisachester, NH 96269\n        "}
{"customer_name": "Frances Phillips", "customer_address": "PSC 9863, Box 0791, APO AA 50021", "customer_email": "chaas@hotmail.com", "policy_number": "LK-321025797", "phone_number": "5628192808", "accident_date": "2024-01-05", "accident_time": "11:45 AM", "accident_location": "intersection of Pine Blvd and Oak St", "description": "\n        Dear Parasol Insurance,\n\n        My name is Frances Phillips, and I am writing to file a claim for a recent car accident that occurred on 2024-01-05, \n        at approximately 11:45 AM. My policy number is LK-321025797.\n\n        The accident took place at the intersection of Pine Blvd and Oak St. I was driving my vehicle, a blue Mercedes-Benz C-Class with license plate \n        number 685-KOXM. At the same time, another vehicle, a yellow Mercedes-Benz Sorento with license plate number AIK 272, \n        collided with my car. The driver, Kimberly Clark, failed to adhere to traffic rules, resulting in damage to both vehicles.\n\n        I promptly exchanged information with the other driver and took photos of the accident scene, including damages to both vehicles.\n        Attached to this email are the photos, a copy of the police report, and the estimate for the repair costs.\n\n        Kindly assist in processing this claim and let me know the next steps. You can reach me at 5628192808 or chaas@hotmail.com.\n\n        Thank you for your assistance.\n\n        Sincerely,\n        Frances Phillips\n        PSC 9863, Box 0791, APO AA 50021\n        "}
{"customer_name": "Matthew Marshall", "customer_address": "382 Herrera Court Apt. 365, New Ericaborough, ME 52576", "customer_email": "lbarrett@yahoo.com", "policy_number": "XY-746192003", "phone_number": "001-762-094-8510", "accident_date": "2024-01-05", "accident_time": "6:30 PM", "accident_location": "intersection of Maple Rd and Pine Blvd", "description": "\n        Dear Parasol Insurance,\n\n        My name is Matthew Marshall, and I am writing to file a claim for a recent car accident that occurred on 2024-01-05, \n        at approximately 6:30 PM. My policy number is XY-746192003.\n\n        The accident took place at the intersection of Maple Rd and Pine Blvd. I was driving my vehicle, a gold Kia Sorento with license plate \n        number 0AW 657. At the same time, another vehicle, a gray Mercedes-Benz 3 Series with license plate number 82HP410, \n        collided with my car. The driver, Anna Wells, failed to adhere to traffic rules, resulting in damage to both vehicles.\n\n        I promptly exchanged information with the other driver and took photos of the accident scene, including damages to both vehicles.\n        Attached to this email are the photos, a copy of the police report, and the estimate for the repair costs.\n\n        Kindly assist in processing this claim and let me know the next steps. You can reach me at 001-762-094-8510 or lbarrett@yahoo.com.\n\n        Thank you for your assistance.\n\n        Sincerely,\n        Matthew Marshall\n        382 Herrera Court Apt. 365, New Ericaborough, ME 52576\n        "}
{"customer_name": "Amy Kim", "customer_address": "66017 Peterson Tunnel Apt. 104, Lake Robert, CA 59826", "customer_email": "jennifer52@flores-brown.org", "policy_number": "BC-216590983", "phone_number": "9210037856", "accident_date": "2024-01-05", "accident_time": "10:00 AM", "accident_location": "intersection of Elm Ln and Willow Ave", "description": "\n        Dear Parasol Insurance,\n\n        My name is Amy Kim, and I am writing to file a claim for a recent car accident that occurred on 2024-01-05, \n        at approximately 10:00 AM. My policy number is BC-216590983.\n\n        The accident took place at the intersection of Elm Ln and Willow Ave. I was driving my vehicle, a silver Kia 3 Series with license plate \n        number 694 ZTZ. At the same time, another vehicle, a gold Kia Altima with license plate number FLY-992, \n        collided with my car. The driver, John Warner, failed to adhere to traffic rules, resulting in damage to both vehicles.\n\n        I promptly exchanged information with the other driver and took photos of the accident scene, including damages to both vehicles.\n        Attached to this email are the photos, a copy of the police report, and the estimate for the repair costs.\n\n        Kindly assist in processing this claim and let me know the next steps. You can reach me at 9210037856 or jennifer52@flores-brown.org.\n\n        Thank you for your assistance.\n\n        Sincerely,\n        Amy Kim\n        66017 Peterson Tunnel Apt. 104, Lake Robert, CA 59826\n        "}
{"customer_name": "Savannah Savage", "customer_address": "90919 Nancy Locks, Smithstad, WY 56501", "customer_email": "lewismark@vaughan.net", "policy_number": "MN-876378480", "phone_number": "(116)299-4940", "accident_date": "2024-01-02", "accident_time": "2:15 PM", "accident_location": "intersection of Main St and Elm Ln", "description": "\n        Dear Parasol Insurance,\n\n        My name is Savannah Savage, and I am writing to file a claim for a recent car accident that occurred on 2024-01-02, \n        at approximately 2:15 PM. My policy number is MN-876378480.\n\n        The accident took place at the intersection of Main St and Elm Ln. I was driving my vehicle, a silver Toyota Altima with license plate \n        number 6CV 986. At the same time, another vehicle, a yellow Audi 3 Series with license plate number 731 MGX, \n        collided with my car. The driver, Tyler Myers, failed to adhere to traffic rules, resulting in damage to both vehicles.\n\n        I promptly exchanged information with the other driver and took photos of the accident scene, including damages to both vehicles.\n        Attached to this email are the photos, a copy of the police report, and the estimate for the repair costs.\n\n        Kindly assist in processing this claim and let me know the next steps. You can reach me at (116)299-4940 or lewismark@vaughan.net.\n\n        Thank you for your assistance.\n\n        Sincerely,\n        Savannah Savage\n        90919 Nancy Locks, Smithstad, WY 56501\n        "}
{"customer_name": "Charles Humphrey", "customer_address": "443 Vaughn Station, Michaelport, CA 01991", "customer_email": "burnsjodi@haley.com", "policy_number": "MN-495316799", "phone_number": "(428)758-5812x13928", "accident_date": "2024-01-02", "accident_time": "11:45 AM", "accident_location": "intersection of Main St and Oak St", "description": "\n        Dear Parasol Insurance,\n\n        My name is Charles Humphrey, and I am writing to file a claim for a recent car accident that occurred on 2024-01-02, \n        at approximately 11:45 AM. My policy number is MN-495316799.\n\n        The accident took place at the intersection of Main St and Oak St. I was driving my vehicle, a yellow Chevrolet Civic with license plate \n        number SFF9202. At the same time, another vehicle, a green Ford Civic with license plate number 47M\u2022065, \n        collided with my car. The driver, Catherine Long, failed to adhere to traffic rules, resulting in damage to both vehicles.\n\n        I promptly exchanged information with the other driver and took photos of the accident scene, including damages to both vehicles.\n        Attached to this email are the photos, a copy of the police report, and the estimate for the repair costs.\n\n        Kindly assist in processing this claim and let me know the next steps. You can reach me at (428)758-5812x13928 or burnsjodi@haley.com.\n\n        Thank you for your assistance.\n\n        Sincerely,\n        Charles Humphrey\n        443 Vaughn Station, Michaelport, CA 01991\n        "}
{"customer_name": "David Baker", "customer_address": "127 Reed Vista Apt. 044, Kingborough, MT 52939", "customer_email": "lwelch@yahoo.com", "policy_number": "MN-754293323", "phone_number": "0023341678", "accident_date": "2024-01-05", "accident_time": "11:45 AM", "accident_location": "intersection of Birch St and Willow Ave", "description": "\n        Dear Parasol Insurance,\n\n        My name is David Baker, and I am writing to file a claim for a recent car accident that occurred on 2024-01-05, \n        at approximately 11:45 AM. My policy number is MN-754293323.\n\n        The accident took place at the intersection of Birch St and Willow Ave. I was driving my vehicle, a yellow Ford C-Class with license plate \n        number 9O 2725N. At the same time, another vehicle, a gold Toyota Altima with license plate number 873 YB8, \n        collided with my car. The driver, Robin Molina, failed to adhere to traffic rules, resulting in damage to both vehicles.\n\n        I promptly exchanged information with the other driver and took photos of the accident scene, including damages to both vehicles.\n        Attached to this email are the photos, a copy of the police report, and the estimate for the repair costs.\n\n        Kindly assist in processing this claim and let me know the next steps. You can reach me at 0023341678 or lwelch@yahoo.com.\n\n        Thank you for your assistance.\n\n        Sincerely,\n        David Baker\n        127 Reed Vista Apt. 044, Kingborough, MT 52939\n        "}
{"customer_name": "Mark Stephens", "customer_address": "51416 Drew Highway, Maryside, IA 78336", "customer_email": "maryjohnson@roberts-castillo.com", "policy_number": "YZ-398042033", "phone_number": "9684942160", "accident_date": "2024-01-07", "accident_time": "2:15 PM", "accident_location": "intersection of Birch St and Oak St", "description": "\n        Dear Parasol Insurance,\n\n        My name is Mark Stephens, and I am writing to file a claim for a recent car accident that occurred on 2024-01-07, \n        at approximately 2:15 PM. My policy number is YZ-398042033.\n\n        The accident took place at the intersection of Birch St and Oak St. I was driving my vehicle, a blue Mercedes-Benz 3 Series with license plate \n        number HUJ 214. At the same time, another vehicle, a maroon Hyundai Traverse with license plate number 78S P35, \n        collided with my car. The driver, Brian Humphrey, failed to adhere to traffic rules, resulting in damage to both vehicles.\n\n        I promptly exchanged information with the other driver and took photos of the accident scene, including damages to both vehicles.\n        Attached to this email are the photos, a copy of the police report, and the estimate for the repair costs.\n\n        Kindly assist in processing this claim and let me know the next steps. You can reach me at 9684942160 or maryjohnson@roberts-castillo.com.\n\n        Thank you for your assistance.\n\n        Sincerely,\n        Mark Stephens\n        51416 Drew Highway, Maryside, IA 78336\n        "}
{"customer_name": "Kurt Taylor", "customer_address": "3933 Kristen Inlet Apt. 171, Batesstad, SC 07503", "customer_email": "nicole96@smith.biz", "policy_number": "AC-882418828", "phone_number": "506.487.2240", "accident_date": "2024-01-02", "accident_time": "10:00 AM", "accident_location": "intersection of Oak St and Maple Rd", "description": "\n        Dear Parasol Insurance,\n\n        My name is Kurt Taylor, and I am writing to file a claim for a recent car accident that occurred on 2024-01-02, \n        at approximately 10:00 AM. My policy number is AC-882418828.\n\n        The accident took place at the intersection of Oak St and Maple Rd. I was driving my vehicle, a gold Honda Sorento with license plate \n        number HBA0018. At the same time, another vehicle, a red Audi Camry with license plate number WXD 542, \n        collided with my car. The driver, Michelle Anderson, failed to adhere to traffic rules, resulting in damage to both vehicles.\n\n        I promptly exchanged information with the other driver and took photos of the accident scene, including damages to both vehicles.\n        Attached to this email are the photos, a copy of the police report, and the estimate for the repair costs.\n\n        Kindly assist in processing this claim and let me know the next steps. You can reach me at 506.487.2240 or nicole96@smith.biz.\n\n        Thank you for your assistance.\n\n        Sincerely,\n        Kurt Taylor\n        3933 Kristen Inlet Apt. 171, Batesstad, SC 07503\n        "}
{"customer_name": "Joseph Brown", "customer_address": "394 Johnson Key Suite 615, Port Mariah, AL 65654", "customer_email": "richard20@franklin.com", "policy_number": "MN-505703324", "phone_number": "324.504.7478x18661", "accident_date": "2024-01-05", "accident_time": "4:00 PM", "accident_location": "intersection of Spruce Ct and Oak St", "description": "\n        Dear Parasol Insurance,\n\n        My name is Joseph Brown, and I am writing to file a claim for a recent car accident that occurred on 2024-01-05, \n        at approximately 4:00 PM. My policy number is MN-505703324.\n\n        The accident took place at the intersection of Spruce Ct and Oak St. I was driving my vehicle, a silver Toyota Altima with license plate \n        number 243 LIK. At the same time, another vehicle, a blue Honda Sorento with license plate number X41 1ZI, \n        collided with my car. The driver, Jaime Davis, failed to adhere to traffic rules, resulting in damage to both vehicles.\n\n        I promptly exchanged information with the other driver and took photos of the accident scene, including damages to both vehicles.\n        Attached to this email are the photos, a copy of the police report, and the estimate for the repair costs.\n\n        Kindly assist in processing this claim and let me know the next steps. You can reach me at 324.504.7478x18661 or richard20@franklin.com.\n\n        Thank you for your assistance.\n\n        Sincerely,\n        Joseph Brown\n        394 Johnson Key Suite 615, Port Mariah, AL 65654\n        "}
{"customer_name": "Rebecca Nguyen", "customer_address": "0178 Nathan Cape Suite 976, Valentineborough, HI 50674", "customer_email": "jenniferroach@gmail.com", "policy_number": "MN-399633309", "phone_number": "505.708.0896x59816", "accident_date": "2024-01-07", "accident_time": "5:15 PM", "accident_location": "intersection of Pine Blvd and Main St", "description": "\n        Dear Parasol Insurance,\n\n        My name is Rebecca Nguyen, and I am writing to file a claim for a recent car accident that occurred on 2024-01-07, \n        at approximately 5:15 PM. My policy number is MN-399633309.\n\n        The accident took place at the intersection of Pine Blvd and Main St. I was driving my vehicle, a red Chevrolet Focus with license plate \n        number 765 XGH. At the same time, another vehicle, a blue Ford C-Class with license plate number NTK-322, \n        collided with my car. The driver, Kevin Clark, failed to adhere to traffic rules, resulting in damage to both vehicles.\n\n        I promptly exchanged information with the other driver and took photos of the accident scene, including damages to both vehicles.\n        Attached to this email are the photos, a copy of the police report, and the estimate for the repair costs.\n\n        Kindly assist in processing this claim and let me know the next steps. You can reach me at 505.708.0896x59816 or jenniferroach@gmail.com.\n\n        Thank you for your assistance.\n\n        Sincerely,\n        Rebecca Nguyen\n        0178 Nathan Cape Suite 976, Valentineborough, HI 50674\n        "}
{"customer_name": "Elaine Rosales", "customer_address": "55595 Stephen Plaza Apt. 124, North Sandratown, MN 86154", "customer_email": "tammykim@hotmail.com", "policy_number": "LK-445787251", "phone_number": "(742)910-9304x505", "accident_date": "2024-01-02", "accident_time": "11:45 AM", "accident_location": "intersection of Spruce Ct and Spruce Ct", "description": "\n        Dear Parasol Insurance,\n\n        My name is Elaine Rosales, and I am writing to file a claim for a recent car accident that occurred on 2024-01-02, \n        at approximately 11:45 AM. My policy number is LK-445787251.\n\n        The accident took place at the intersection of Spruce Ct and Spruce Ct. I was driving my vehicle, a gray Honda A4 with license plate \n        number 4T P3786. At the same time, another vehicle, a green Hyundai Camry with license plate number CNE-493, \n        collided with my car. The driver, Zachary Barnett, failed to adhere to traffic rules, resulting in damage to both vehicles.\n\n        I promptly exchanged information with the other driver and took photos of the accident scene, including damages to both vehicles.\n        Attached to this email are the photos, a copy of the police report, and the estimate for the repair costs.\n\n        Kindly assist in processing this claim and let me know the next steps. You can reach me at (742)910-9304x505 or tammykim@hotmail.com.\n\n        Thank you for your assistance.\n\n        Sincerely,\n        Elaine Rosales\n        55595 Stephen Plaza Apt. 124, North Sandratown, MN 86154\n        "}
{"customer_name": "Eddie Miller", "customer_address": "2143 Powers Pine Apt. 987, Port Crystalshire, AR 41751", "customer_email": "kjohnston@shaw.com", "policy_number": "LK-127327571", "phone_number": "470.792.1702x491", "accident_date": "2024-01-06", "accident_time": "5:15 PM", "accident_location": "intersection of Cedar Dr and Spruce Ct", "description": "\n        Dear Parasol Insurance,\n\n        My name is Eddie Miller, and I am writing to file a claim for a recent car accident that occurred on 2024-01-06, \n        at approximately 5:15 PM. My policy number is LK-127327571.\n\n        The accident took place at the intersection of Cedar Dr and Spruce Ct. I was driving my vehicle, a gold Nissan 3 Series with license plate \n        number 813-XSK. At the same time, another vehicle, a black Nissan Civic with license plate number 074-APM, \n        collided with my car. The driver, Christopher Watson, failed to adhere to traffic rules, resulting in damage to both vehicles.\n\n        I promptly exchanged information with the other driver and took photos of the accident scene, including damages to both vehicles.\n        Attached to this email are the photos, a copy of the police report, and the estimate for the repair costs.\n\n        Kindly assist in processing this claim and let me know the next steps. You can reach me at 470.792.1702x491 or kjohnston@shaw.com.\n\n        Thank you for your assistance.\n\n        Sincerely,\n        Eddie Miller\n        2143 Powers Pine Apt. 987, Port Crystalshire, AR 41751\n        "}
{"customer_name": "Susan Casey", "customer_address": "29560 Edward Ramp Suite 054, East Kevin, MO 59296", "customer_email": "michaelmanning@gmail.com", "policy_number": "LK-739588153", "phone_number": "360.944.7245x97318", "accident_date": "2024-01-02", "accident_time": "4:00 PM", "accident_location": "intersection of Oak St and Cedar Dr", "description": "\n        Dear Parasol Insurance,\n\n        My name is Susan Casey, and I am writing to file a claim for a recent car accident that occurred on 2024-01-02, \n        at approximately 4:00 PM. My policy number is LK-739588153.\n\n        The accident took place at the intersection of Oak St and Cedar Dr. I was driving my vehicle, a gray Mercedes-Benz A4 with license plate \n        number EXD 723. At the same time, another vehicle, a gray Ford Camry with license plate number 74P P39, \n        collided with my car. The driver, Stephen Lee, failed to adhere to traffic rules, resulting in damage to both vehicles.\n\n        I promptly exchanged information with the other driver and took photos of the accident scene, including damages to both vehicles.\n        Attached to this email are the photos, a copy of the police report, and the estimate for the repair costs.\n\n        Kindly assist in processing this claim and let me know the next steps. You can reach me at 360.944.7245x97318 or michaelmanning@gmail.com.\n\n        Thank you for your assistance.\n\n        Sincerely,\n        Susan Casey\n        29560 Edward Ramp Suite 054, East Kevin, MO 59296\n        "}
{"customer_name": "Stephen Leblanc", "customer_address": "25556 Sanders Unions, Christopherfort, WY 57380", "customer_email": "nicolejones@gmail.com", "policy_number": "AC-689429779", "phone_number": "229-007-6472", "accident_date": "2024-01-06", "accident_time": "12:00 PM", "accident_location": "intersection of Cedar Dr and Maple Rd", "description": "\n        Dear Parasol Insurance,\n\n        My name is Stephen Leblanc, and I am writing to file a claim for a recent car accident that occurred on 2024-01-06, \n        at approximately 12:00 PM. My policy number is AC-689429779.\n\n        The accident took place at the intersection of Cedar Dr and Maple Rd. I was driving my vehicle, a black Toyota 3 Series with license plate \n        number 25-10290. At the same time, another vehicle, a white BMW A4 with license plate number 60-L823, \n        collided with my car. The driver, Cameron Pierce, failed to adhere to traffic rules, resulting in damage to both vehicles.\n\n        I promptly exchanged information with the other driver and took photos of the accident scene, including damages to both vehicles.\n        Attached to this email are the photos, a copy of the police report, and the estimate for the repair costs.\n\n        Kindly assist in processing this claim and let me know the next steps. You can reach me at 229-007-6472 or nicolejones@gmail.com.\n\n        Thank you for your assistance.\n\n        Sincerely,\n        Stephen Leblanc\n        25556 Sanders Unions, Christopherfort, WY 57380\n        "}
{"customer_name": "Lori Hunter", "customer_address": "Unit 8276 Box 5539, DPO AA 13185", "customer_email": "robertdrake@ortiz.info", "policy_number": "LK-852585250", "phone_number": "+1-061-590-3149x588", "accident_date": "2024-01-05", "accident_time": "10:00 AM", "accident_location": "intersection of Elm Ln and Cedar Dr", "description": "\n        Dear Parasol Insurance,\n\n        My name is Lori Hunter, and I am writing to file a claim for a recent car accident that occurred on 2024-01-05, \n        at approximately 10:00 AM. My policy number is LK-852585250.\n\n        The accident took place at the intersection of Elm Ln and Cedar Dr. I was driving my vehicle, a blue Nissan Elantra with license plate \n        number 215 MHF. At the same time, another vehicle, a blue Hyundai Elantra with license plate number 43-IU93, \n        collided with my car. The driver, Shawn Jacobs, failed to adhere to traffic rules, resulting in damage to both vehicles.\n\n        I promptly exchanged information with the other driver and took photos of the accident scene, including damages to both vehicles.\n        Attached to this email are the photos, a copy of the police report, and the estimate for the repair costs.\n\n        Kindly assist in processing this claim and let me know the next steps. You can reach me at +1-061-590-3149x588 or robertdrake@ortiz.info.\n\n        Thank you for your assistance.\n\n        Sincerely,\n        Lori Hunter\n        Unit 8276 Box 5539, DPO AA 13185\n        "}
{"customer_name": "Ethan Perry", "customer_address": "Unit 7041 Box 7869, DPO AP 06781", "customer_email": "hannahrobles@gmail.com", "policy_number": "YZ-864345157", "phone_number": "410-755-6445", "accident_date": "2024-01-02", "accident_time": "5:15 PM", "accident_location": "intersection of Main St and Elm Ln", "description": "\n        Dear Parasol Insurance,\n\n        My name is Ethan Perry, and I am writing to file a claim for a recent car accident that occurred on 2024-01-02, \n        at approximately 5:15 PM. My policy number is YZ-864345157.\n\n        The accident took place at the intersection of Main St and Elm Ln. I was driving my vehicle, a white Ford Focus with license plate \n        number 31MG968. At the same time, another vehicle, a yellow Ford Elantra with license plate number YMK 310, \n        collided with my car. The driver, Alex Stevens, failed to adhere to traffic rules, resulting in damage to both vehicles.\n\n        I promptly exchanged information with the other driver and took photos of the accident scene, including damages to both vehicles.\n        Attached to this email are the photos, a copy of the police report, and the estimate for the repair costs.\n\n        Kindly assist in processing this claim and let me know the next steps. You can reach me at 410-755-6445 or hannahrobles@gmail.com.\n\n        Thank you for your assistance.\n\n        Sincerely,\n        Ethan Perry\n        Unit 7041 Box 7869, DPO AP 06781\n        "}
{"customer_name": "Steven Olson", "customer_address": "2876 Kimberly Views, New Megan, NC 83209", "customer_email": "whitneyandrew@wiley.com", "policy_number": "MN-501719493", "phone_number": "+1-915-593-1130x521", "accident_date": "2024-01-05", "accident_time": "11:45 AM", "accident_location": "intersection of Cedar Dr and Oak St", "description": "\n        Dear Parasol Insurance,\n\n        My name is Steven Olson, and I am writing to file a claim for a recent car accident that occurred on 2024-01-05, \n        at approximately 11:45 AM. My policy number is MN-501719493.\n\n        The accident took place at the intersection of Cedar Dr and Oak St. I was driving my vehicle, a black Honda Traverse with license plate \n        number 998015. At the same time, another vehicle, a black Mercedes-Benz Civic with license plate number VV-5200, \n        collided with my car. The driver, Dr. Robert Fernandez, failed to adhere to traffic rules, resulting in damage to both vehicles.\n\n        I promptly exchanged information with the other driver and took photos of the accident scene, including damages to both vehicles.\n        Attached to this email are the photos, a copy of the police report, and the estimate for the repair costs.\n\n        Kindly assist in processing this claim and let me know the next steps. You can reach me at +1-915-593-1130x521 or whitneyandrew@wiley.com.\n\n        Thank you for your assistance.\n\n        Sincerely,\n        Steven Olson\n        2876 Kimberly Views, New Megan, NC 83209\n        "}
{"customer_name": "Clarence Carter", "customer_address": "82216 Andrea Orchard, North Kelly, NY 44952", "customer_email": "jasonbell@lara-johnson.com", "policy_number": "MN-565891975", "phone_number": "642.252.9433x8558", "accident_date": "2024-01-07", "accident_time": "6:30 PM", "accident_location": "intersection of Willow Ave and Pine Blvd", "description": "\n        Dear Parasol Insurance,\n\n        My name is Clarence Carter, and I am writing to file a claim for a recent car accident that occurred on 2024-01-07, \n        at approximately 6:30 PM. My policy number is MN-565891975.\n\n        The accident took place at the intersection of Willow Ave and Pine Blvd. I was driving my vehicle, a white Toyota 3 Series with license plate \n        number 3R 63894. At the same time, another vehicle, a red Hyundai Focus with license plate number 9-2806L, \n        collided with my car. The driver, Jacqueline Gill, failed to adhere to traffic rules, resulting in damage to both vehicles.\n\n        I promptly exchanged information with the other driver and took photos of the accident scene, including damages to both vehicles.\n        Attached to this email are the photos, a copy of the police report, and the estimate for the repair costs.\n\n        Kindly assist in processing this claim and let me know the next steps. You can reach me at 642.252.9433x8558 or jasonbell@lara-johnson.com.\n\n        Thank you for your assistance.\n\n        Sincerely,\n        Clarence Carter\n        82216 Andrea Orchard, North Kelly, NY 44952\n        "}
{"customer_name": "Kevin Fox", "customer_address": "2347 Webb Mills, East Josephton, AL 61899", "customer_email": "bbrewer@hotmail.com", "policy_number": "XY-285977336", "phone_number": "+1-806-292-7907x07076", "accident_date": "2024-01-02", "accident_time": "10:00 AM", "accident_location": "intersection of Main St and Elm Ln", "description": "\n        Dear Parasol Insurance,\n\n        My name is Kevin Fox, and I am writing to file a claim for a recent car accident that occurred on 2024-01-02, \n        at approximately 10:00 AM. My policy number is XY-285977336.\n\n        The accident took place at the intersection of Main St and Elm Ln. I was driving my vehicle, a white Honda Camry with license plate \n        number 4GL1933. At the same time, another vehicle, a yellow Hyundai Camry with license plate number 527 JQ8, \n        collided with my car. The driver, Vanessa Allen, failed to adhere to traffic rules, resulting in damage to both vehicles.\n\n        I promptly exchanged information with the other driver and took photos of the accident scene, including damages to both vehicles.\n        Attached to this email are the photos, a copy of the police report, and the estimate for the repair costs.\n\n        Kindly assist in processing this claim and let me know the next steps. You can reach me at +1-806-292-7907x07076 or bbrewer@hotmail.com.\n\n        Thank you for your assistance.\n\n        Sincerely,\n        Kevin Fox\n        2347 Webb Mills, East Josephton, AL 61899\n        "}
{"customer_name": "Valerie Berg", "customer_address": "94971 Griffin Streets Apt. 192, Alexanderstad, WV 62003", "customer_email": "richardsonfelicia@hotmail.com", "policy_number": "LK-329159373", "phone_number": "363-752-1956x1923", "accident_date": "2024-01-02", "accident_time": "3:30 PM", "accident_location": "intersection of Elm Ln and Spruce Ct", "description": "\n        Dear Parasol Insurance,\n\n        My name is Valerie Berg, and I am writing to file a claim for a recent car accident that occurred on 2024-01-02, \n        at approximately 3:30 PM. My policy number is LK-329159373.\n\n        The accident took place at the intersection of Elm Ln and Spruce Ct. I was driving my vehicle, a silver Kia Focus with license plate \n        number MJL 058. At the same time, another vehicle, a black Audi Civic with license plate number 37-K899, \n        collided with my car. The driver, Charlene Harrison, failed to adhere to traffic rules, resulting in damage to both vehicles.\n\n        I promptly exchanged information with the other driver and took photos of the accident scene, including damages to both vehicles.\n        Attached to this email are the photos, a copy of the police report, and the estimate for the repair costs.\n\n        Kindly assist in processing this claim and let me know the next steps. You can reach me at 363-752-1956x1923 or richardsonfelicia@hotmail.com.\n\n        Thank you for your assistance.\n\n        Sincerely,\n        Valerie Berg\n        94971 Griffin Streets Apt. 192, Alexanderstad, WV 62003\n        "}
{"customer_name": "Brenda Sullivan", "customer_address": "Unit 9663 Box 1879, DPO AE 52395", "customer_email": "huntdaniel@hill.info", "policy_number": "LK-696998206", "phone_number": "(395)278-8142x3978", "accident_date": "2024-01-07", "accident_time": "11:45 AM", "accident_location": "intersection of Main St and Oak St", "description": "\n        Dear Parasol Insurance,\n\n        My name is Brenda Sullivan, and I am writing to file a claim for a recent car accident that occurred on 2024-01-07, \n        at approximately 11:45 AM. My policy number is LK-696998206.\n\n        The accident took place at the intersection of Main St and Oak St. I was driving my vehicle, a green Nissan C-Class with license plate \n        number 160 FTN. At the same time, another vehicle, a blue Ford Sorento with license plate number 7473 XT, \n        collided with my car. The driver, Kyle Nichols, failed to adhere to traffic rules, resulting in damage to both vehicles.\n\n        I promptly exchanged information with the other driver and took photos of the accident scene, including damages to both vehicles.\n        Attached to this email are the photos, a copy of the police report, and the estimate for the repair costs.\n\n        Kindly assist in processing this claim and let me know the next steps. You can reach me at (395)278-8142x3978 or huntdaniel@hill.info.\n\n        Thank you for your assistance.\n\n        Sincerely,\n        Brenda Sullivan\n        Unit 9663 Box 1879, DPO AE 52395\n        "}
{"customer_name": "Wendy Williams", "customer_address": "7755 Kim Drive Suite 832, West Jorgebury, NE 47031", "customer_email": "fschmidt@andrade.info", "policy_number": "XY-366823456", "phone_number": "(302)064-6738", "accident_date": "2024-01-03", "accident_time": "2:15 PM", "accident_location": "intersection of Birch St and Main St", "description": "\n        Dear Parasol Insurance,\n\n        My name is Wendy Williams, and I am writing to file a claim for a recent car accident that occurred on 2024-01-03, \n        at approximately 2:15 PM. My policy number is XY-366823456.\n\n        The accident took place at the intersection of Birch St and Main St. I was driving my vehicle, a maroon Nissan Civic with license plate \n        number 9HE 406. At the same time, another vehicle, a red Chevrolet A4 with license plate number N 132229, \n        collided with my car. The driver, Teresa Fisher, failed to adhere to traffic rules, resulting in damage to both vehicles.\n\n        I promptly exchanged information with the other driver and took photos of the accident scene, including damages to both vehicles.\n        Attached to this email are the photos, a copy of the police report, and the estimate for the repair costs.\n\n        Kindly assist in processing this claim and let me know the next steps. You can reach me at (302)064-6738 or fschmidt@andrade.info.\n\n        Thank you for your assistance.\n\n        Sincerely,\n        Wendy Williams\n        7755 Kim Drive Suite 832, West Jorgebury, NE 47031\n        "}
{"customer_name": "Eddie Kelley", "customer_address": "5675 Murphy Mount, Harrisonmouth, MD 07227", "customer_email": "johnherring@gmail.com", "policy_number": "MN-308388529", "phone_number": "314.417.5202", "accident_date": "2024-01-06", "accident_time": "12:00 PM", "accident_location": "intersection of Elm Ln and Maple Rd", "description": "\n        Dear Parasol Insurance,\n\n        My name is Eddie Kelley, and I am writing to file a claim for a recent car accident that occurred on 2024-01-06, \n        at approximately 12:00 PM. My policy number is MN-308388529.\n\n        The accident took place at the intersection of Elm Ln and Maple Rd. I was driving my vehicle, a green Hyundai C-Class with license plate \n        number 4V 6Y1UGJ. At the same time, another vehicle, a blue Honda Civic with license plate number 8JK8519, \n        collided with my car. The driver, Shannon Weaver, failed to adhere to traffic rules, resulting in damage to both vehicles.\n\n        I promptly exchanged information with the other driver and took photos of the accident scene, including damages to both vehicles.\n        Attached to this email are the photos, a copy of the police report, and the estimate for the repair costs.\n\n        Kindly assist in processing this claim and let me know the next steps. You can reach me at 314.417.5202 or johnherring@gmail.com.\n\n        Thank you for your assistance.\n\n        Sincerely,\n        Eddie Kelley\n        5675 Murphy Mount, Harrisonmouth, MD 07227\n        "}
{"customer_name": "Glenn Hernandez", "customer_address": "082 Carlson Circles, East Nathanstad, SC 36043", "customer_email": "tammygriffith@hotmail.com", "policy_number": "LK-279161404", "phone_number": "+1-823-147-6254x6247", "accident_date": "2024-01-02", "accident_time": "3:30 PM", "accident_location": "intersection of Oak St and Willow Ave", "description": "\n        Dear Parasol Insurance,\n\n        My name is Glenn Hernandez, and I am writing to file a claim for a recent car accident that occurred on 2024-01-02, \n        at approximately 3:30 PM. My policy number is LK-279161404.\n\n        The accident took place at the intersection of Oak St and Willow Ave. I was driving my vehicle, a white Ford Camry with license plate \n        number BWD 5965. At the same time, another vehicle, a gold Toyota Focus with license plate number 268 VGA, \n        collided with my car. The driver, Alyssa Hernandez, failed to adhere to traffic rules, resulting in damage to both vehicles.\n\n        I promptly exchanged information with the other driver and took photos of the accident scene, including damages to both vehicles.\n        Attached to this email are the photos, a copy of the police report, and the estimate for the repair costs.\n\n        Kindly assist in processing this claim and let me know the next steps. You can reach me at +1-823-147-6254x6247 or tammygriffith@hotmail.com.\n\n        Thank you for your assistance.\n\n        Sincerely,\n        Glenn Hernandez\n        082 Carlson Circles, East Nathanstad, SC 36043\n        "}
{"customer_name": "Jacqueline Sullivan", "customer_address": "44948 Johnson Pass, Robertbury, TX 25853", "customer_email": "ibrown@glenn-mcknight.biz", "policy_number": "YZ-642116832", "phone_number": "798-003-5687", "accident_date": "2024-01-05", "accident_time": "11:45 AM", "accident_location": "intersection of Spruce Ct and Maple Rd", "description": "\n        Dear Parasol Insurance,\n\n        My name is Jacqueline Sullivan, and I am writing to file a claim for a recent car accident that occurred on 2024-01-05, \n        at approximately 11:45 AM. My policy number is YZ-642116832.\n\n        The accident took place at the intersection of Spruce Ct and Maple Rd. I was driving my vehicle, a red Ford Civic with license plate \n        number 00Q\u2022453. At the same time, another vehicle, a silver Hyundai Traverse with license plate number 9-N3526, \n        collided with my car. The driver, Justin Roberts, failed to adhere to traffic rules, resulting in damage to both vehicles.\n\n        I promptly exchanged information with the other driver and took photos of the accident scene, including damages to both vehicles.\n        Attached to this email are the photos, a copy of the police report, and the estimate for the repair costs.\n\n        Kindly assist in processing this claim and let me know the next steps. You can reach me at 798-003-5687 or ibrown@glenn-mcknight.biz.\n\n        Thank you for your assistance.\n\n        Sincerely,\n        Jacqueline Sullivan\n        44948 Johnson Pass, Robertbury, TX 25853\n        "}
{"customer_name": "Christine Dixon", "customer_address": "14074 Horn Mountains, North Kristychester, NM 51957", "customer_email": "manuel12@yahoo.com", "policy_number": "BC-522723775", "phone_number": "+1-698-031-2229x7440", "accident_date": "2024-01-06", "accident_time": "5:15 PM", "accident_location": "intersection of Elm Ln and Cedar Dr", "description": "\n        Dear Parasol Insurance,\n\n        My name is Christine Dixon, and I am writing to file a claim for a recent car accident that occurred on 2024-01-06, \n        at approximately 5:15 PM. My policy number is BC-522723775.\n\n        The accident took place at the intersection of Elm Ln and Cedar Dr. I was driving my vehicle, a maroon Kia Traverse with license plate \n        number HBM 293. At the same time, another vehicle, a yellow Hyundai Sorento with license plate number 18AJ518, \n        collided with my car. The driver, Nathaniel Bowers, failed to adhere to traffic rules, resulting in damage to both vehicles.\n\n        I promptly exchanged information with the other driver and took photos of the accident scene, including damages to both vehicles.\n        Attached to this email are the photos, a copy of the police report, and the estimate for the repair costs.\n\n        Kindly assist in processing this claim and let me know the next steps. You can reach me at +1-698-031-2229x7440 or manuel12@yahoo.com.\n\n        Thank you for your assistance.\n\n        Sincerely,\n        Christine Dixon\n        14074 Horn Mountains, North Kristychester, NM 51957\n        "}
{"customer_name": "Kimberly Donovan", "customer_address": "42996 Coffey Pass, Dianashire, OR 17917", "customer_email": "rnelson@hogan.com", "policy_number": "BC-492673602", "phone_number": "433-596-9641", "accident_date": "2024-01-04", "accident_time": "4:00 PM", "accident_location": "intersection of Oak St and Oak St", "description": "\n        Dear Parasol Insurance,\n\n        My name is Kimberly Donovan, and I am writing to file a claim for a recent car accident that occurred on 2024-01-04, \n        at approximately 4:00 PM. My policy number is BC-492673602.\n\n        The accident took place at the intersection of Oak St and Oak St. I was driving my vehicle, a maroon Kia Sorento with license plate \n        number TPG5846. At the same time, another vehicle, a maroon Hyundai A4 with license plate number VHY-9920, \n        collided with my car. The driver, Jason Garcia, failed to adhere to traffic rules, resulting in damage to both vehicles.\n\n        I promptly exchanged information with the other driver and took photos of the accident scene, including damages to both vehicles.\n        Attached to this email are the photos, a copy of the police report, and the estimate for the repair costs.\n\n        Kindly assist in processing this claim and let me know the next steps. You can reach me at 433-596-9641 or rnelson@hogan.com.\n\n        Thank you for your assistance.\n\n        Sincerely,\n        Kimberly Donovan\n        42996 Coffey Pass, Dianashire, OR 17917\n        "}
{"customer_name": "Sean Bush", "customer_address": "1181 Ashley Road, Brittneyville, VA 61033", "customer_email": "campbellgregory@wood.net", "policy_number": "XY-238905493", "phone_number": "001-786-410-0877x2230", "accident_date": "2024-01-04", "accident_time": "2:15 PM", "accident_location": "intersection of Spruce Ct and Elm Ln", "description": "\n        Dear Parasol Insurance,\n\n        My name is Sean Bush, and I am writing to file a claim for a recent car accident that occurred on 2024-01-04, \n        at approximately 2:15 PM. My policy number is XY-238905493.\n\n        The accident took place at the intersection of Spruce Ct and Elm Ln. I was driving my vehicle, a gray Audi Focus with license plate \n        number 490-152. At the same time, another vehicle, a yellow Nissan Focus with license plate number 1O382, \n        collided with my car. The driver, Jessica Long, failed to adhere to traffic rules, resulting in damage to both vehicles.\n\n        I promptly exchanged information with the other driver and took photos of the accident scene, including damages to both vehicles.\n        Attached to this email are the photos, a copy of the police report, and the estimate for the repair costs.\n\n        Kindly assist in processing this claim and let me know the next steps. You can reach me at 001-786-410-0877x2230 or campbellgregory@wood.net.\n\n        Thank you for your assistance.\n\n        Sincerely,\n        Sean Bush\n        1181 Ashley Road, Brittneyville, VA 61033\n        "}
{"customer_name": "Kimberly Chen", "customer_address": "01902 Nicole Harbors Suite 260, Lake Michelle, AR 93876", "customer_email": "donnaellis@wyatt.com", "policy_number": "MN-445150116", "phone_number": "(005)584-4249x095", "accident_date": "2024-01-07", "accident_time": "3:30 PM", "accident_location": "intersection of Maple Rd and Oak St", "description": "\n        Dear Parasol Insurance,\n\n        My name is Kimberly Chen, and I am writing to file a claim for a recent car accident that occurred on 2024-01-07, \n        at approximately 3:30 PM. My policy number is MN-445150116.\n\n        The accident took place at the intersection of Maple Rd and Oak St. I was driving my vehicle, a maroon Chevrolet Altima with license plate \n        number 566PZV. At the same time, another vehicle, a blue Nissan Elantra with license plate number SSE 452, \n        collided with my car. The driver, Michelle Holmes, failed to adhere to traffic rules, resulting in damage to both vehicles.\n\n        I promptly exchanged information with the other driver and took photos of the accident scene, including damages to both vehicles.\n        Attached to this email are the photos, a copy of the police report, and the estimate for the repair costs.\n\n        Kindly assist in processing this claim and let me know the next steps. You can reach me at (005)584-4249x095 or donnaellis@wyatt.com.\n\n        Thank you for your assistance.\n\n        Sincerely,\n        Kimberly Chen\n        01902 Nicole Harbors Suite 260, Lake Michelle, AR 93876\n        "}
{"customer_name": "Christopher Burgess", "customer_address": "2974 Olivia Turnpike, New Brandon, WI 03366", "customer_email": "dawnbaker@hotmail.com", "policy_number": "BC-764063958", "phone_number": "(495)621-0544", "accident_date": "2024-01-06", "accident_time": "4:00 PM", "accident_location": "intersection of Cedar Dr and Spruce Ct", "description": "\n        Dear Parasol Insurance,\n\n        My name is Christopher Burgess, and I am writing to file a claim for a recent car accident that occurred on 2024-01-06, \n        at approximately 4:00 PM. My policy number is BC-764063958.\n\n        The accident took place at the intersection of Cedar Dr and Spruce Ct. I was driving my vehicle, a silver Ford C-Class with license plate \n        number TG-2244. At the same time, another vehicle, a maroon Hyundai Focus with license plate number 386 HJQ, \n        collided with my car. The driver, David Phelps, failed to adhere to traffic rules, resulting in damage to both vehicles.\n\n        I promptly exchanged information with the other driver and took photos of the accident scene, including damages to both vehicles.\n        Attached to this email are the photos, a copy of the police report, and the estimate for the repair costs.\n\n        Kindly assist in processing this claim and let me know the next steps. You can reach me at (495)621-0544 or dawnbaker@hotmail.com.\n\n        Thank you for your assistance.\n\n        Sincerely,\n        Christopher Burgess\n        2974 Olivia Turnpike, New Brandon, WI 03366\n        "}
{"customer_name": "Daniel Zimmerman", "customer_address": "44100 Porter Trail, Barbaraport, ME 87453", "customer_email": "kristi75@hotmail.com", "policy_number": "LK-930002286", "phone_number": "(266)580-2470x23200", "accident_date": "2024-01-07", "accident_time": "4:00 PM", "accident_location": "intersection of Elm Ln and Main St", "description": "\n        Dear Parasol Insurance,\n\n        My name is Daniel Zimmerman, and I am writing to file a claim for a recent car accident that occurred on 2024-01-07, \n        at approximately 4:00 PM. My policy number is LK-930002286.\n\n        The accident took place at the intersection of Elm Ln and Main St. I was driving my vehicle, a green Audi Traverse with license plate \n        number 32R R72. At the same time, another vehicle, a green BMW Altima with license plate number ZOR4228, \n        collided with my car. The driver, Donald King, failed to adhere to traffic rules, resulting in damage to both vehicles.\n\n        I promptly exchanged information with the other driver and took photos of the accident scene, including damages to both vehicles.\n        Attached to this email are the photos, a copy of the police report, and the estimate for the repair costs.\n\n        Kindly assist in processing this claim and let me know the next steps. You can reach me at (266)580-2470x23200 or kristi75@hotmail.com.\n\n        Thank you for your assistance.\n\n        Sincerely,\n        Daniel Zimmerman\n        44100 Porter Trail, Barbaraport, ME 87453\n        "}
{"customer_name": "Christine Hobbs", "customer_address": "686 Martin Forks Suite 286, Evanmouth, TN 25772", "customer_email": "yesenia46@nunez-frederick.org", "policy_number": "XY-657663833", "phone_number": "001-044-766-4509x3479", "accident_date": "2024-01-02", "accident_time": "12:00 PM", "accident_location": "intersection of Maple Rd and Oak St", "description": "\n        Dear Parasol Insurance,\n\n        My name is Christine Hobbs, and I am writing to file a claim for a recent car accident that occurred on 2024-01-02, \n        at approximately 12:00 PM. My policy number is XY-657663833.\n\n        The accident took place at the intersection of Maple Rd and Oak St. I was driving my vehicle, a green Toyota 3 Series with license plate \n        number 907 WCI. At the same time, another vehicle, a maroon Hyundai Camry with license plate number 3L 10984, \n        collided with my car. The driver, Ann Patel, failed to adhere to traffic rules, resulting in damage to both vehicles.\n\n        I promptly exchanged information with the other driver and took photos of the accident scene, including damages to both vehicles.\n        Attached to this email are the photos, a copy of the police report, and the estimate for the repair costs.\n\n        Kindly assist in processing this claim and let me know the next steps. You can reach me at 001-044-766-4509x3479 or yesenia46@nunez-frederick.org.\n\n        Thank you for your assistance.\n\n        Sincerely,\n        Christine Hobbs\n        686 Martin Forks Suite 286, Evanmouth, TN 25772\n        "}
{"customer_name": "Jason Pittman", "customer_address": "78721 Joshua Square, West Donaldberg, OK 98996", "customer_email": "oblackwell@peterson-lindsey.com", "policy_number": "YZ-613786776", "phone_number": "+1-255-337-5007", "accident_date": "2024-01-04", "accident_time": "6:30 PM", "accident_location": "intersection of Maple Rd and Willow Ave", "description": "\n        Dear Parasol Insurance,\n\n        My name is Jason Pittman, and I am writing to file a claim for a recent car accident that occurred on 2024-01-04, \n        at approximately 6:30 PM. My policy number is YZ-613786776.\n\n        The accident took place at the intersection of Maple Rd and Willow Ave. I was driving my vehicle, a green Ford Altima with license plate \n        number KVY-5576. At the same time, another vehicle, a red Chevrolet Altima with license plate number 53-AU84, \n        collided with my car. The driver, Jason Delgado, failed to adhere to traffic rules, resulting in damage to both vehicles.\n\n        I promptly exchanged information with the other driver and took photos of the accident scene, including damages to both vehicles.\n        Attached to this email are the photos, a copy of the police report, and the estimate for the repair costs.\n\n        Kindly assist in processing this claim and let me know the next steps. You can reach me at +1-255-337-5007 or oblackwell@peterson-lindsey.com.\n\n        Thank you for your assistance.\n\n        Sincerely,\n        Jason Pittman\n        78721 Joshua Square, West Donaldberg, OK 98996\n        "}
{"customer_name": "Kristin Smith", "customer_address": "3128 Hendrix Tunnel, Harrismouth, HI 46512", "customer_email": "bryansmith@may.com", "policy_number": "BC-675911207", "phone_number": "183.965.8166x819", "accident_date": "2024-01-06", "accident_time": "6:30 PM", "accident_location": "intersection of Elm Ln and Elm Ln", "description": "\n        Dear Parasol Insurance,\n\n        My name is Kristin Smith, and I am writing to file a claim for a recent car accident that occurred on 2024-01-06, \n        at approximately 6:30 PM. My policy number is BC-675911207.\n\n        The accident took place at the intersection of Elm Ln and Elm Ln. I was driving my vehicle, a silver Kia Sorento with license plate \n        number 608 AAE. At the same time, another vehicle, a black Ford Traverse with license plate number 73F PS5, \n        collided with my car. The driver, Amanda Marshall, failed to adhere to traffic rules, resulting in damage to both vehicles.\n\n        I promptly exchanged information with the other driver and took photos of the accident scene, including damages to both vehicles.\n        Attached to this email are the photos, a copy of the police report, and the estimate for the repair costs.\n\n        Kindly assist in processing this claim and let me know the next steps. You can reach me at 183.965.8166x819 or bryansmith@may.com.\n\n        Thank you for your assistance.\n\n        Sincerely,\n        Kristin Smith\n        3128 Hendrix Tunnel, Harrismouth, HI 46512\n        "}
{"customer_name": "Alexis Wade", "customer_address": "USNS Richard, FPO AA 89737", "customer_email": "vking@hotmail.com", "policy_number": "YZ-106479788", "phone_number": "(481)645-3335x97247", "accident_date": "2024-01-07", "accident_time": "10:00 AM", "accident_location": "intersection of Maple Rd and Elm Ln", "description": "\n        Dear Parasol Insurance,\n\n        My name is Alexis Wade, and I am writing to file a claim for a recent car accident that occurred on 2024-01-07, \n        at approximately 10:00 AM. My policy number is YZ-106479788.\n\n        The accident took place at the intersection of Maple Rd and Elm Ln. I was driving my vehicle, a black Toyota C-Class with license plate \n        number 442-GGO. At the same time, another vehicle, a gray Toyota Altima with license plate number RR4 P8Z, \n        collided with my car. The driver, Philip Castillo, failed to adhere to traffic rules, resulting in damage to both vehicles.\n\n        I promptly exchanged information with the other driver and took photos of the accident scene, including damages to both vehicles.\n        Attached to this email are the photos, a copy of the police report, and the estimate for the repair costs.\n\n        Kindly assist in processing this claim and let me know the next steps. You can reach me at (481)645-3335x97247 or vking@hotmail.com.\n\n        Thank you for your assistance.\n\n        Sincerely,\n        Alexis Wade\n        USNS Richard, FPO AA 89737\n        "}
{"customer_name": "Kimberly Davis", "customer_address": "6503 Martinez Trail, Jeffreyburgh, RI 48193", "customer_email": "amberdalton@hotmail.com", "policy_number": "YZ-636248568", "phone_number": "866.875.6841x043", "accident_date": "2024-01-06", "accident_time": "3:30 PM", "accident_location": "intersection of Oak St and Oak St", "description": "\n        Dear Parasol Insurance,\n\n        My name is Kimberly Davis, and I am writing to file a claim for a recent car accident that occurred on 2024-01-06, \n        at approximately 3:30 PM. My policy number is YZ-636248568.\n\n        The accident took place at the intersection of Oak St and Oak St. I was driving my vehicle, a silver Chevrolet Altima with license plate \n        number EUH S73. At the same time, another vehicle, a blue BMW C-Class with license plate number C83 7ZN, \n        collided with my car. The driver, Steven Baker, failed to adhere to traffic rules, resulting in damage to both vehicles.\n\n        I promptly exchanged information with the other driver and took photos of the accident scene, including damages to both vehicles.\n        Attached to this email are the photos, a copy of the police report, and the estimate for the repair costs.\n\n        Kindly assist in processing this claim and let me know the next steps. You can reach me at 866.875.6841x043 or amberdalton@hotmail.com.\n\n        Thank you for your assistance.\n\n        Sincerely,\n        Kimberly Davis\n        6503 Martinez Trail, Jeffreyburgh, RI 48193\n        "}
{"customer_name": "Thomas Perez", "customer_address": "29033 Kim Unions, Garciabury, MT 48670", "customer_email": "joshuamaddox@gmail.com", "policy_number": "XY-412158805", "phone_number": "001-225-399-1389x698", "accident_date": "2024-01-07", "accident_time": "5:15 PM", "accident_location": "intersection of Elm Ln and Pine Blvd", "description": "\n        Dear Parasol Insurance,\n\n        My name is Thomas Perez, and I am writing to file a claim for a recent car accident that occurred on 2024-01-07, \n        at approximately 5:15 PM. My policy number is XY-412158805.\n\n        The accident took place at the intersection of Elm Ln and Pine Blvd. I was driving my vehicle, a red Nissan C-Class with license plate \n        number 9ZM 628. At the same time, another vehicle, a white Hyundai Focus with license plate number 9TM P04, \n        collided with my car. The driver, Alexander Jimenez, failed to adhere to traffic rules, resulting in damage to both vehicles.\n\n        I promptly exchanged information with the other driver and took photos of the accident scene, including damages to both vehicles.\n        Attached to this email are the photos, a copy of the police report, and the estimate for the repair costs.\n\n        Kindly assist in processing this claim and let me know the next steps. You can reach me at 001-225-399-1389x698 or joshuamaddox@gmail.com.\n\n        Thank you for your assistance.\n\n        Sincerely,\n        Thomas Perez\n        29033 Kim Unions, Garciabury, MT 48670\n        "}
{"customer_name": "Gabriela Bennett", "customer_address": "604 Juan Ports Apt. 098, Lake Matthewport, IL 34733", "customer_email": "mwise@mitchell.biz", "policy_number": "LK-159159693", "phone_number": "(503)675-4307x001", "accident_date": "2024-01-02", "accident_time": "6:30 PM", "accident_location": "intersection of Spruce Ct and Elm Ln", "description": "\n        Dear Parasol Insurance,\n\n        My name is Gabriela Bennett, and I am writing to file a claim for a recent car accident that occurred on 2024-01-02, \n        at approximately 6:30 PM. My policy number is LK-159159693.\n\n        The accident took place at the intersection of Spruce Ct and Elm Ln. I was driving my vehicle, a blue Kia C-Class with license plate \n        number 598 EEU. At the same time, another vehicle, a silver Audi Elantra with license plate number 61Q K47, \n        collided with my car. The driver, Michael Page, failed to adhere to traffic rules, resulting in damage to both vehicles.\n\n        I promptly exchanged information with the other driver and took photos of the accident scene, including damages to both vehicles.\n        Attached to this email are the photos, a copy of the police report, and the estimate for the repair costs.\n\n        Kindly assist in processing this claim and let me know the next steps. You can reach me at (503)675-4307x001 or mwise@mitchell.biz.\n\n        Thank you for your assistance.\n\n        Sincerely,\n        Gabriela Bennett\n        604 Juan Ports Apt. 098, Lake Matthewport, IL 34733\n        "}
{"customer_name": "Tristan Hutchinson", "customer_address": "683 Brian Burgs, East Rayberg, UT 75064", "customer_email": "robert19@hernandez.info", "policy_number": "YZ-581010916", "phone_number": "296-364-7838x5258", "accident_date": "2024-01-06", "accident_time": "10:00 AM", "accident_location": "intersection of Pine Blvd and Maple Rd", "description": "\n        Dear Parasol Insurance,\n\n        My name is Tristan Hutchinson, and I am writing to file a claim for a recent car accident that occurred on 2024-01-06, \n        at approximately 10:00 AM. My policy number is YZ-581010916.\n\n        The accident took place at the intersection of Pine Blvd and Maple Rd. I was driving my vehicle, a white Mercedes-Benz C-Class with license plate \n        number 128 TY4. At the same time, another vehicle, a yellow Mercedes-Benz A4 with license plate number 8KX 930, \n        collided with my car. The driver, David Gilbert, failed to adhere to traffic rules, resulting in damage to both vehicles.\n\n        I promptly exchanged information with the other driver and took photos of the accident scene, including damages to both vehicles.\n        Attached to this email are the photos, a copy of the police report, and the estimate for the repair costs.\n\n        Kindly assist in processing this claim and let me know the next steps. You can reach me at 296-364-7838x5258 or robert19@hernandez.info.\n\n        Thank you for your assistance.\n\n        Sincerely,\n        Tristan Hutchinson\n        683 Brian Burgs, East Rayberg, UT 75064\n        "}
{"customer_name": "Theresa Solis", "customer_address": "8849 Craig Wall, Lindseystad, ME 85250", "customer_email": "deanna33@abbott-silva.com", "policy_number": "AC-165132609", "phone_number": "378-220-5447x15796", "accident_date": "2024-01-04", "accident_time": "10:00 AM", "accident_location": "intersection of Elm Ln and Willow Ave", "description": "\n        Dear Parasol Insurance,\n\n        My name is Theresa Solis, and I am writing to file a claim for a recent car accident that occurred on 2024-01-04, \n        at approximately 10:00 AM. My policy number is AC-165132609.\n\n        The accident took place at the intersection of Elm Ln and Willow Ave. I was driving my vehicle, a white Nissan Civic with license plate \n        number 422 BYA. At the same time, another vehicle, a red Audi 3 Series with license plate number FND-9987, \n        collided with my car. The driver, Cindy Mcneil, failed to adhere to traffic rules, resulting in damage to both vehicles.\n\n        I promptly exchanged information with the other driver and took photos of the accident scene, including damages to both vehicles.\n        Attached to this email are the photos, a copy of the police report, and the estimate for the repair costs.\n\n        Kindly assist in processing this claim and let me know the next steps. You can reach me at 378-220-5447x15796 or deanna33@abbott-silva.com.\n\n        Thank you for your assistance.\n\n        Sincerely,\n        Theresa Solis\n        8849 Craig Wall, Lindseystad, ME 85250\n        "}
{"customer_name": "William Wright", "customer_address": "7123 Thomas Ranch Apt. 628, Murphyshire, AZ 87933", "customer_email": "kramerryan@gmail.com", "policy_number": "XY-782067472", "phone_number": "856-935-3344", "accident_date": "2024-01-04", "accident_time": "4:00 PM", "accident_location": "intersection of Pine Blvd and Spruce Ct", "description": "\n        Dear Parasol Insurance,\n\n        My name is William Wright, and I am writing to file a claim for a recent car accident that occurred on 2024-01-04, \n        at approximately 4:00 PM. My policy number is XY-782067472.\n\n        The accident took place at the intersection of Pine Blvd and Spruce Ct. I was driving my vehicle, a gold Toyota Sorento with license plate \n        number 736-YAH. At the same time, another vehicle, a blue Kia A4 with license plate number 479 PRF, \n        collided with my car. The driver, Christine Scott, failed to adhere to traffic rules, resulting in damage to both vehicles.\n\n        I promptly exchanged information with the other driver and took photos of the accident scene, including damages to both vehicles.\n        Attached to this email are the photos, a copy of the police report, and the estimate for the repair costs.\n\n        Kindly assist in processing this claim and let me know the next steps. You can reach me at 856-935-3344 or kramerryan@gmail.com.\n\n        Thank you for your assistance.\n\n        Sincerely,\n        William Wright\n        7123 Thomas Ranch Apt. 628, Murphyshire, AZ 87933\n        "}
{"customer_name": "Jason Reeves", "customer_address": "353 Gregory Squares Apt. 421, Jacobborough, NE 02347", "customer_email": "smurphy@buchanan.com", "policy_number": "YZ-795464045", "phone_number": "001-082-207-5798x84268", "accident_date": "2024-01-03", "accident_time": "1:45 PM", "accident_location": "intersection of Willow Ave and Oak St", "description": "\n        Dear Parasol Insurance,\n\n        My name is Jason Reeves, and I am writing to file a claim for a recent car accident that occurred on 2024-01-03, \n        at approximately 1:45 PM. My policy number is YZ-795464045.\n\n        The accident took place at the intersection of Willow Ave and Oak St. I was driving my vehicle, a green BMW Focus with license plate \n        number RVL-0072. At the same time, another vehicle, a gold Hyundai Camry with license plate number MBP 195, \n        collided with my car. The driver, Amanda Sanchez, failed to adhere to traffic rules, resulting in damage to both vehicles.\n\n        I promptly exchanged information with the other driver and took photos of the accident scene, including damages to both vehicles.\n        Attached to this email are the photos, a copy of the police report, and the estimate for the repair costs.\n\n        Kindly assist in processing this claim and let me know the next steps. You can reach me at 001-082-207-5798x84268 or smurphy@buchanan.com.\n\n        Thank you for your assistance.\n\n        Sincerely,\n        Jason Reeves\n        353 Gregory Squares Apt. 421, Jacobborough, NE 02347\n        "}
{"customer_name": "Gary Williams", "customer_address": "2180 Michael Hollow Suite 939, Wilsonburgh, AR 07234", "customer_email": "schmidtdanielle@hill.com", "policy_number": "AC-763972443", "phone_number": "609.570.0459x0156", "accident_date": "2024-01-06", "accident_time": "5:15 PM", "accident_location": "intersection of Birch St and Oak St", "description": "\n        Dear Parasol Insurance,\n\n        My name is Gary Williams, and I am writing to file a claim for a recent car accident that occurred on 2024-01-06, \n        at approximately 5:15 PM. My policy number is AC-763972443.\n\n        The accident took place at the intersection of Birch St and Oak St. I was driving my vehicle, a white Audi Altima with license plate \n        number 411 QUR. At the same time, another vehicle, a blue Ford Sorento with license plate number 408 5308, \n        collided with my car. The driver, Nancy Prince, failed to adhere to traffic rules, resulting in damage to both vehicles.\n\n        I promptly exchanged information with the other driver and took photos of the accident scene, including damages to both vehicles.\n        Attached to this email are the photos, a copy of the police report, and the estimate for the repair costs.\n\n        Kindly assist in processing this claim and let me know the next steps. You can reach me at 609.570.0459x0156 or schmidtdanielle@hill.com.\n\n        Thank you for your assistance.\n\n        Sincerely,\n        Gary Williams\n        2180 Michael Hollow Suite 939, Wilsonburgh, AR 07234\n        "}
{"customer_name": "Thomas Hall", "customer_address": "66571 Young Mountains Suite 319, Lisaburgh, TX 18235", "customer_email": "pgutierrez@allison-rivera.com", "policy_number": "XY-649933914", "phone_number": "(306)027-5170x07829", "accident_date": "2024-01-07", "accident_time": "3:30 PM", "accident_location": "intersection of Pine Blvd and Main St", "description": "\n        Dear Parasol Insurance,\n\n        My name is Thomas Hall, and I am writing to file a claim for a recent car accident that occurred on 2024-01-07, \n        at approximately 3:30 PM. My policy number is XY-649933914.\n\n        The accident took place at the intersection of Pine Blvd and Main St. I was driving my vehicle, a blue Honda Sorento with license plate \n        number 309 RHZ. At the same time, another vehicle, a gray Mercedes-Benz 3 Series with license plate number AYX1656, \n        collided with my car. The driver, Timothy Good, failed to adhere to traffic rules, resulting in damage to both vehicles.\n\n        I promptly exchanged information with the other driver and took photos of the accident scene, including damages to both vehicles.\n        Attached to this email are the photos, a copy of the police report, and the estimate for the repair costs.\n\n        Kindly assist in processing this claim and let me know the next steps. You can reach me at (306)027-5170x07829 or pgutierrez@allison-rivera.com.\n\n        Thank you for your assistance.\n\n        Sincerely,\n        Thomas Hall\n        66571 Young Mountains Suite 319, Lisaburgh, TX 18235\n        "}
{"customer_name": "Tyler Little", "customer_address": "784 Gonzalez Alley, Alexismouth, SD 54188", "customer_email": "vaughanleah@hotmail.com", "policy_number": "YZ-398257431", "phone_number": "(503)131-8063x1350", "accident_date": "2024-01-03", "accident_time": "2:15 PM", "accident_location": "intersection of Elm Ln and Birch St", "description": "\n        Dear Parasol Insurance,\n\n        My name is Tyler Little, and I am writing to file a claim for a recent car accident that occurred on 2024-01-03, \n        at approximately 2:15 PM. My policy number is YZ-398257431.\n\n        The accident took place at the intersection of Elm Ln and Birch St. I was driving my vehicle, a blue BMW Camry with license plate \n        number 63D US2. At the same time, another vehicle, a yellow Mercedes-Benz Focus with license plate number 3P 8E8WPE, \n        collided with my car. The driver, Jeffrey Hudson, failed to adhere to traffic rules, resulting in damage to both vehicles.\n\n        I promptly exchanged information with the other driver and took photos of the accident scene, including damages to both vehicles.\n        Attached to this email are the photos, a copy of the police report, and the estimate for the repair costs.\n\n        Kindly assist in processing this claim and let me know the next steps. You can reach me at (503)131-8063x1350 or vaughanleah@hotmail.com.\n\n        Thank you for your assistance.\n\n        Sincerely,\n        Tyler Little\n        784 Gonzalez Alley, Alexismouth, SD 54188\n        "}
{"customer_name": "Anna Brown", "customer_address": "30875 Thomas Brook, South Patricia, TN 96878", "customer_email": "william15@nicholson.com", "policy_number": "MN-932068645", "phone_number": "586.052.9300", "accident_date": "2024-01-06", "accident_time": "10:00 AM", "accident_location": "intersection of Pine Blvd and Cedar Dr", "description": "\n        Dear Parasol Insurance,\n\n        My name is Anna Brown, and I am writing to file a claim for a recent car accident that occurred on 2024-01-06, \n        at approximately 10:00 AM. My policy number is MN-932068645.\n\n        The accident took place at the intersection of Pine Blvd and Cedar Dr. I was driving my vehicle, a blue Kia A4 with license plate \n        number 172734. At the same time, another vehicle, a blue Mercedes-Benz Civic with license plate number BXM H90, \n        collided with my car. The driver, James Cruz, failed to adhere to traffic rules, resulting in damage to both vehicles.\n\n        I promptly exchanged information with the other driver and took photos of the accident scene, including damages to both vehicles.\n        Attached to this email are the photos, a copy of the police report, and the estimate for the repair costs.\n\n        Kindly assist in processing this claim and let me know the next steps. You can reach me at 586.052.9300 or william15@nicholson.com.\n\n        Thank you for your assistance.\n\n        Sincerely,\n        Anna Brown\n        30875 Thomas Brook, South Patricia, TN 96878\n        "}
{"customer_name": "Michael Smith", "customer_address": "15530 Rivers Ports, Mcgeeland, UT 94253", "customer_email": "sarahsimpson@fisher.com", "policy_number": "AC-506096892", "phone_number": "+1-316-137-1848", "accident_date": "2024-01-07", "accident_time": "6:30 PM", "accident_location": "intersection of Spruce Ct and Pine Blvd", "description": "\n        Dear Parasol Insurance,\n\n        My name is Michael Smith, and I am writing to file a claim for a recent car accident that occurred on 2024-01-07, \n        at approximately 6:30 PM. My policy number is AC-506096892.\n\n        The accident took place at the intersection of Spruce Ct and Pine Blvd. I was driving my vehicle, a yellow Ford A4 with license plate \n        number 8QRZ897. At the same time, another vehicle, a white Mercedes-Benz Sorento with license plate number 6H PX692, \n        collided with my car. The driver, Allison Phillips, failed to adhere to traffic rules, resulting in damage to both vehicles.\n\n        I promptly exchanged information with the other driver and took photos of the accident scene, including damages to both vehicles.\n        Attached to this email are the photos, a copy of the police report, and the estimate for the repair costs.\n\n        Kindly assist in processing this claim and let me know the next steps. You can reach me at +1-316-137-1848 or sarahsimpson@fisher.com.\n\n        Thank you for your assistance.\n\n        Sincerely,\n        Michael Smith\n        15530 Rivers Ports, Mcgeeland, UT 94253\n        "}
{"customer_name": "Taylor Richards", "customer_address": "166 Anthony Bypass Suite 651, West Kathyburgh, IL 16805", "customer_email": "emilyrobinson@shannon-anderson.com", "policy_number": "AC-953131875", "phone_number": "+1-373-079-0342x85210", "accident_date": "2024-01-04", "accident_time": "6:30 PM", "accident_location": "intersection of Oak St and Oak St", "description": "\n        Dear Parasol Insurance,\n\n        My name is Taylor Richards, and I am writing to file a claim for a recent car accident that occurred on 2024-01-04, \n        at approximately 6:30 PM. My policy number is AC-953131875.\n\n        The accident took place at the intersection of Oak St and Oak St. I was driving my vehicle, a green Hyundai 3 Series with license plate \n        number 801 GQK. At the same time, another vehicle, a red Honda C-Class with license plate number Y57 8YA, \n        collided with my car. The driver, John Cole, failed to adhere to traffic rules, resulting in damage to both vehicles.\n\n        I promptly exchanged information with the other driver and took photos of the accident scene, including damages to both vehicles.\n        Attached to this email are the photos, a copy of the police report, and the estimate for the repair costs.\n\n        Kindly assist in processing this claim and let me know the next steps. You can reach me at +1-373-079-0342x85210 or emilyrobinson@shannon-anderson.com.\n\n        Thank you for your assistance.\n\n        Sincerely,\n        Taylor Richards\n        166 Anthony Bypass Suite 651, West Kathyburgh, IL 16805\n        "}
{"customer_name": "Mark Fisher", "customer_address": "695 Ashley Wells, South Cassieview, MN 29612", "customer_email": "ericmartinez@yahoo.com", "policy_number": "YZ-185998067", "phone_number": "406-184-9173", "accident_date": "2024-01-02", "accident_time": "6:30 PM", "accident_location": "intersection of Cedar Dr and Oak St", "description": "\n        Dear Parasol Insurance,\n\n        My name is Mark Fisher, and I am writing to file a claim for a recent car accident that occurred on 2024-01-02, \n        at approximately 6:30 PM. My policy number is YZ-185998067.\n\n        The accident took place at the intersection of Cedar Dr and Oak St. I was driving my vehicle, a blue Mercedes-Benz Sorento with license plate \n        number Q 117765. At the same time, another vehicle, a black Audi Civic with license plate number HQA 325, \n        collided with my car. The driver, Leslie Duke, failed to adhere to traffic rules, resulting in damage to both vehicles.\n\n        I promptly exchanged information with the other driver and took photos of the accident scene, including damages to both vehicles.\n        Attached to this email are the photos, a copy of the police report, and the estimate for the repair costs.\n\n        Kindly assist in processing this claim and let me know the next steps. You can reach me at 406-184-9173 or ericmartinez@yahoo.com.\n\n        Thank you for your assistance.\n\n        Sincerely,\n        Mark Fisher\n        695 Ashley Wells, South Cassieview, MN 29612\n        "}
